### ISSUE TITLE
Cannot access internet or LAN addresses through PiVPN/Wireguard

### ISSUE THREAD

**Issue by jw-taylor** [pivpn/pivpn#1337]
## In raising this issue, I confirm the following: 

`{please fill the checkboxes, e.g: [X]}`

- [X] I have read and understood the [contributors guide](https://github.com/pivpn/pivpn/blob/master/CONTRIBUTING.md).
- [X] The issue I am reporting can be *replicated*.
- [X] The issue I am reporting *is* directly related to the pivpn installer script.

**Describe the bug**
I run OMV6 on an old Dell Studio 1558 mohterboard. I installed PiVPN with Wireguard following the steps on the website. I connect through a No-IP address (joel.servegame.com).

I want to be able to access my SMB shares while away from home and also manage OMV/Docker etc. However when I connect via Wireguard I can't do so, and also most (?) websites won't load - as in, I can access www.bbc.co.uk/news and www.bbc/co.uk/sport but google/canyouseeme/speedtest.net for example won't load.

I have tested this both on my android phone (both through LTE and with LTE turned off) and on my windows laptop connected through my phone's hotspot.

**Expected behavior**
Connect via VPN, access local IP addresses and network shares.

**Troubleshooting steps:**

As per https://github.com/pivpn/pivpn/wiki/faq:

pivpn -d gave:

```
::: Generating Debug Output
::::            PiVPN debug              ::::
=============================================
::::            Latest commit            ::::
commit 5aa0de636f32fd674b77a2b3dd64d97b51680707
Author: 4s3ti <4s3ti@protonmail.com>
Date:   Mon May 31 21:01:46 2021 +0200

    IRC From freenode to libera.chat

    Changed info about IRC Chanel,
    Chanel moved from freenode to libera.chat
=============================================
::::        Installation settings        ::::
PLAT=Debian
OSCN=bullseye
USING_UFW=0
IPv4dev=enp9s0
install_user=joel
install_home=/ssd/joel
VPN=wireguard
pivpnPORT=51820
pivpnDNS1=208.67.222.222
pivpnDNS2=208.67.220.220
pivpnHOST=REDACTED
INPUT_CHAIN_EDITED=0
FORWARD_CHAIN_EDITED=1
pivpnPROTO=udp
pivpnMTU=1420
pivpnDEV=wg0
pivpnNET=10.6.0.0
subnetClass=24
ALLOWED_IPS="0.0.0.0/0, ::0/0"
UNATTUPG=1
INSTALLED_PACKAGES=(wireguard-tools unattended-upgrades)
=============================================
::::  Server configuration shown below   ::::
[Interface]
PrivateKey = server_priv
Address = 10.6.0.1/24
MTU = 1420
ListenPort = 51820
### begin joel ###
[Peer]
PublicKey = joel_pub
PresharedKey = joel_psk
AllowedIPs = 10.6.0.2/32
### end joel ###
=============================================
::::  Client configuration shown below   ::::
[Interface]
PrivateKey = joel_priv
Address = 10.6.0.2/24
MTU = 1420
DNS = 208.67.222.222, 208.67.220.220

[Peer]
PublicKey = server_pub
PresharedKey = joel_psk
Endpoint = REDACTED:51820
AllowedIPs = 0.0.0.0/0, ::0/0
=============================================
::::    Recursive list of files in       ::::
::::    /etc/wireguard shown below       ::::
/etc/wireguard:
configs
keys
wg0.conf

/etc/wireguard/configs:
clients.txt
joel.conf

/etc/wireguard/keys:
joel_priv
joel_psk
joel_pub
server_priv
server_pub
=============================================
::::            Self check               ::::
:: [OK] IP forwarding is enabled
:: [OK] Iptables MASQUERADE rule set
:: [OK] Iptables FORWARD rule set
:: [OK] WireGuard is running
:: [OK] WireGuard is enabled (it will automatically start on reboot)
:: [OK] WireGuard is listening on port 51820/udp
=============================================
```

lsmod | grep wireguard gave:

```
wireguard              98304  0
libchacha20poly1305    16384  1 wireguard
ip6_udp_tunnel         16384  1 wireguard
udp_tunnel             20480  1 wireguard
libblake2s             16384  1 wireguard
curve25519_x86_64      36864  1 wireguard
libcurve25519_generic    49152  2 curve25519_x86_64,wireguard
```

I note that the installation settings (shown above) don't have entries for IPv4addr and IPv4gw but I don't know if those are only for OpenVPN?

ip -f inet address show enp9s0 gives:

```
2: enp9s0: <BROADCAST,MULTICAST,UP,LOWER_UP> mtu 1500 qdisc pfifo_fast state UP group default qlen 1000
    inet 192.168.11.123/24 brd 192.168.11.255 scope global dynamic enp9s0
       valid_lft 83708sec preferred_lft 83708sec
```

Packet capture gave a lot - here's the last bit:

```
14:42:21.822680 IP 213.205.198.105.22628 > 192.168.11.123.51820: UDP, length 112
14:42:21.830682 IP 213.205.198.105.22628 > 192.168.11.123.51820: UDP, length 96
14:42:21.830684 IP 213.205.198.105.22628 > 192.168.11.123.51820: UDP, length 96
14:42:21.838085 IP 192.168.11.123.51820 > 213.205.198.105.22628: UDP, length 96
14:42:21.838100 IP 192.168.11.123.51820 > 213.205.198.105.22628: UDP, length 96
14:42:21.890220 IP 213.205.198.105.22628 > 192.168.11.123.51820: UDP, length 96
14:42:21.890222 IP 213.205.198.105.22628 > 192.168.11.123.51820: UDP, length 96
14:42:21.898171 IP 213.205.198.105.22628 > 192.168.11.123.51820: UDP, length 608
14:42:21.905685 IP 192.168.11.123.51820 > 213.205.198.105.22628: UDP, length 96
14:42:21.912296 IP 192.168.11.123.51820 > 213.205.198.105.22628: UDP, length 1452
14:42:21.912534 IP 192.168.11.123.51820 > 213.205.198.105.22628: UDP, length 1452
14:42:21.912547 IP 192.168.11.123.51820 > 213.205.198.105.22628: UDP, length 1452
14:42:21.912568 IP 192.168.11.123.51820 > 213.205.198.105.22628: UDP, length 272
14:42:21.922958 IP 213.205.198.105.22628 > 192.168.11.123.51820: UDP, length 608
14:42:21.930095 IP 192.168.11.123.51820 > 213.205.198.105.22628: UDP, length 1452
14:42:21.930351 IP 192.168.11.123.51820 > 213.205.198.105.22628: UDP, length 96
14:42:21.936799 IP 192.168.11.123.51820 > 213.205.198.105.22628: UDP, length 1452
14:42:21.937074 IP 192.168.11.123.51820 > 213.205.198.105.22628: UDP, length 1452
14:42:21.937234 IP 192.168.11.123.51820 > 213.205.198.105.22628: UDP, length 1452
14:42:21.937241 IP 192.168.11.123.51820 > 213.205.198.105.22628: UDP, length 272
14:42:21.970679 IP 213.205.198.105.22628 > 192.168.11.123.51820: UDP, length 96
14:42:21.982686 IP 213.205.198.105.22628 > 192.168.11.123.51820: UDP, length 96
14:42:21.996059 IP 192.168.11.123.51820 > 213.205.198.105.22628: UDP, length 1452
14:42:21.996268 IP 192.168.11.123.51820 > 213.205.198.105.22628: UDP, length 1452
14:42:21.996275 IP 192.168.11.123.51820 > 213.205.198.105.22628: UDP, length 1452
14:42:22.007081 IP 192.168.11.123.51820 > 213.205.198.105.22628: UDP, length 1452
14:42:22.007089 IP 192.168.11.123.51820 > 213.205.198.105.22628: UDP, length 1452
14:42:22.007339 IP 192.168.11.123.51820 > 213.205.198.105.22628: UDP, length 1452
14:42:22.260814 IP 192.168.11.123.51820 > 213.205.198.105.22628: UDP, length 1452
14:42:22.270133 IP 192.168.11.123.51820 > 213.205.198.105.22628: UDP, length 1452
14:42:22.684841 IP 192.168.11.123.51820 > 213.205.198.105.22628: UDP, length 144
14:42:22.692001 IP 192.168.11.123.51820 > 213.205.198.105.22628: UDP, length 1452
14:42:22.807919 IP 192.168.11.123.51820 > 213.205.198.105.22628: UDP, length 96
14:42:22.821140 IP 192.168.11.123.51820 > 213.205.198.105.22628: UDP, length 1452
14:42:22.845844 IP 192.168.11.123.51820 > 213.205.198.105.22628: UDP, length 1452
14:42:22.909935 IP 192.168.11.123.51820 > 213.205.198.105.22628: UDP, length 96
14:42:23.134032 IP 192.168.11.123.51820 > 213.205.198.105.22628: UDP, length 144
14:42:23.146329 IP 192.168.11.123.51820 > 213.205.198.105.22628: UDP, length 1452
14:42:23.271444 IP 192.168.11.123.51820 > 213.205.198.105.22628: UDP, length 1452
^C
4046 packets captured
4046 packets received by filter
0 packets dropped by kernel
```

At this point I'm pretty much stuck!

**Comment by orazioedoardo** [comment]
> I want to be able to access my SMB shares while away from home and also manage OMV/Docker etc. However when I connect via Wireguard I can't do so, and also most (?) websites won't load - as in, I can access www.bbc.co.uk/news and www.bbc/co.uk/sport but google/canyouseeme/speedtest.net for example won't load.

Could be this: https://github.com/pivpn/pivpn/issues/1329#issuecomment-874228371
