### DISCUSSION TITLE
Wireguard connection not possible on MacOS

### DISCUSSION THREAD

**Discussion by jbreitbart** [pivpn/pivpn#1674] [Support]
Hi

I have used pivpn to setup a wireguard vpn on a Hetzner cloud server (that is also running my pihole). The VPN connection is working just fine on multiplie iOS/iPadOS devices, but I cannot get it to work on MacOS. I am using the official wireguard client from the appstore. I have run through https://docs.pivpn.io/faq/#how-do-i-troubleshoot-connection-issues and I receive packages on the server:

```
root@stargate:~# tcpdump -n -i eth0 udp port 51820
tcpdump: verbose output suppressed, use -v[v]... for full protocol decode
listening on eth0, link-type EN10MB (Ethernet), snapshot length 262144 bytes
11:01:33.844917 IP 188.74.1.132.58185 > 167.235.155.59.51820: UDP, length 148
11:01:33.845530 IP 167.235.155.59.51820 > 188.74.1.132.58185: UDP, length 92
11:01:33.866163 IP 188.74.1.132.58185 > 167.235.155.59.51820: UDP, length 128
11:01:33.866163 IP 188.74.1.132.58185 > 167.235.155.59.51820: UDP, length 128
11:01:33.866301 IP 188.74.1.132.58185 > 167.235.155.59.51820: UDP, length 128
11:01:33.866312 IP 188.74.1.132.58185 > 167.235.155.59.51820: UDP, length 112
11:01:33.866536 IP 188.74.1.132.58185 > 167.235.155.59.51820: UDP, length 96
11:01:33.866544 IP 188.74.1.132.58185 > 167.235.155.59.51820: UDP, length 112
11:01:33.866802 IP 188.74.1.132.58185 > 167.235.155.59.51820: UDP, length 112
11:01:33.866802 IP 188.74.1.132.58185 > 167.235.155.59.51820: UDP, length 96
11:01:33.866823 IP 188.74.1.132.58185 > 167.235.155.59.51820: UDP, length 112
11:01:33.871901 IP 167.235.155.59.51820 > 188.74.1.132.58185: UDP, length 192
11:01:33.871916 IP 167.235.155.59.51820 > 188.74.1.132.58185: UDP, length 176
11:01:33.871922 IP 167.235.155.59.51820 > 188.74.1.132.58185: UDP, length 192
11:01:33.871924 IP 167.235.155.59.51820 > 188.74.1.132.58185: UDP, length 128
11:01:33.871927 IP 167.235.155.59.51820 > 188.74.1.132.58185: UDP, length 144
11:01:33.871930 IP 167.235.155.59.51820 > 188.74.1.132.58185: UDP, length 176
11:01:33.877965 IP 167.235.155.59.51820 > 188.74.1.132.58185: UDP, length 208
11:01:33.894334 IP 188.74.1.132.58185 > 167.235.155.59.51820: UDP, length 96
11:01:33.894334 IP 188.74.1.132.58185 > 167.235.155.59.51820: UDP, length 96
11:01:33.902345 IP 188.74.1.132.58185 > 167.235.155.59.51820: UDP, length 96
11:01:33.902345 IP 188.74.1.132.58185 > 167.235.155.59.51820: UDP, length 128
11:01:33.903775 IP 167.235.155.59.51820 > 188.74.1.132.58185: UDP, length 144
11:01:33.904988 IP 167.235.155.59.51820 > 188.74.1.132.58185: UDP, length 96
11:01:33.905321 IP 167.235.155.59.51820 > 188.74.1.132.58185: UDP, length 96
11:01:33.910851 IP 167.235.155.59.51820 > 188.74.1.132.58185: UDP, length 320
11:01:33.923596 IP 188.74.1.132.58185 > 167.235.155.59.51820: UDP, length 96
11:01:33.923596 IP 188.74.1.132.58185 > 167.235.155.59.51820: UDP, length 96
11:01:33.923812 IP 188.74.1.132.58185 > 167.235.155.59.51820: UDP, length 96
11:01:33.924833 IP 188.74.1.132.58185 > 167.235.155.59.51820: UDP, length 272
11:01:33.924858 IP 188.74.1.132.58185 > 167.235.155.59.51820: UDP, length 272
11:01:33.926157 IP 167.235.155.59.51820 > 188.74.1.132.58185: UDP, length 304
11:01:33.927068 IP 167.235.155.59.51820 > 188.74.1.132.58185: UDP, length 96
11:01:33.927088 IP 188.74.1.132.58185 > 167.235.155.59.51820: UDP, length 112
11:01:33.927112 IP 188.74.1.132.58185 > 167.235.155.59.51820: UDP, length 112
11:01:33.927832 IP 167.235.155.59.51820 > 188.74.1.132.58185: UDP, length 112
11:01:33.928477 IP 167.235.155.59.51820 > 188.74.1.132.58185: UDP, length 128
```

However, the client logs fills up with:
```
[NET] peer(Vatn…XzwA) - Failed to send data packet: write udp4 0.0.0.0:65139->167.235.155.59:51820: sendto: network is unreachable
```

Has anyone seen this before?
