### ISSUE TITLE
Connecting takes long or even won't connect with UDP from outside. From LAN or with TCP works

### ISSUE THREAD

**Issue by bttd** [pivpn/pivpn#867]
## In raising this issue, I confirm the following: 

`{please fill the checkboxes, e.g: [X]}`

- [x] I have read and understood the [contributors guide](https://github.com/pivpn/pivpn/blob/master/CONTRIBUTING.md).
- [x] The issue I am reporting can be *replicated*.
- [x] The issue I am reporting can be *is* directly related to the pivpn installer script.
- [x] The issue I am reporting isn't a duplicate (see [FAQs](https://github.com/pivpn/pivpn/wiki/FAQ), [closed issues](https://github.com/pivpn/pivpn/issues?q=is%3Aissue+sort%3Aupdated-desc+is%3Aclosed), and [open issues](https://github.com/pivpn/pivpn/issues?q=is%3Aissue+sort%3Aupdated-desc+is%3Aopen)).

### Issue

Hi!

Im looking for solution for my issue. If I run pivpn in UDP connectig takes loooooong as hell from outside. I already tried on two different system. One of this is ubuntu 16.04 fresh install, and mikrotik router. On this netwok I already run another non pivpn openvpn in udp mode, and it fast and work as expected. If I install with pivpn connecting takes 2-3 minutes. 

On my other system where I have a TP-LINK router and same ubuntu 16.04 fresh installation I'm unable to connect from outside of the network. I Got errors in server log regarding TLS handshake failed. 

If I try with TCP it works fine, also if I try to connect from LAN it works with UDP too. 
I have another installation of pivpn on ubuntu 16.04 at home, wich is an older installation. It works fine. 

### Have you searched for similar issues and solutions?
    (yes/no / which issues?)
yes

### Console output of      `curl -L install.pivpn.io | bash`
```
  Output Here
```

### Console output of      `pivpn add` or `pivpn add nopass`
```
  Output Here
```

### Console output of      `pivpn debug`
```
::::            PiVPN debug              ::::
=============================================
::::            Latest commit            ::::
commit d0c10db6ec391961b7201fb564055c1176ca73e3
Author: 4s3ti <cfcolaco@colacoweb.net>
Date:   Tue Sep 3 10:09:48 2019 +0200

    install.sh: apt-get with , uninstall.sh: added var PKG_MANAGER and replaced apt-get with
=============================================
::::        Installation settings        ::::
/etc/pivpn/DET_PLATFORM -> Ubuntu
/etc/pivpn/FORWARD_CHAIN_EDITED -> 0
/etc/pivpn/HELP_SHOWN ->
/etc/pivpn/INPUT_CHAIN_EDITED -> 0
/etc/pivpn/INSTALL_PORT -> 1194
/etc/pivpn/INSTALL_PROTO -> udp
/etc/pivpn/INSTALL_USER -> optiwella
/etc/pivpn/NO_UFW -> 1
/etc/pivpn/pivpnINTERFACE -> eth0
/etc/pivpn/TWO_POINT_FOUR ->
=============================================
::::    setupVars file shown below       ::::
INSTALL_USER=user
UNATTUPG=unattended-upgrades
pivpnInterface=eth0
IPv4dns=
IPv4addr=192.168.1.26
IPv4gw=192.168.1.254
pivpnProto=udp
PORT=1194
ENCRYPT=256
APPLY_TWO_POINT_FOUR=true
DOWNLOAD_DH_PARAM=false
PUBLICDNS=
OVPNDNS1=1.1.1.1
OVPNDNS2=1.0.0.1
=============================================
::::  Server configuration shown below   ::::
dev tun
proto udp
port 1194
ca /etc/openvpn/easy-rsa/pki/ca.crt
cert /etc/openvpn/easy-rsa/pki/issued/xxx.crt
key /etc/openvpn/easy-rsa/pki/private/xxx.key
dh none
topology subnet
server 10.8.0.0 255.255.255.0
# Set your primary domain name server address for clients
push "dhcp-option DNS 1.1.1.1"
push "dhcp-option DNS 1.0.0.1"
# Prevent DNS leaks on Windows
push "block-outside-dns"
# Override the Client default gateway by using 0.0.0.0/1 and
# 128.0.0.0/1 rather than 0.0.0.0/0. This has the benefit of
# overriding but not wiping out the original default gateway.
push "redirect-gateway def1"
client-to-client
keepalive 1800 3600
remote-cert-tls client
tls-version-min 1.2
tls-crypt /etc/openvpn/easy-rsa/pki/ta.key
cipher AES-256-CBC
auth SHA256
user nobody
group nogroup
persist-key
persist-tun
crl-verify /etc/openvpn/crl.pem
status /var/log/openvpn-status.log 20
status-version 3
syslog
verb 3
link-mtu 1452
#DuplicateCNs allow access control on a less-granular, per user basis.
#Remove # if you will manage access by user instead of device.
#duplicate-cn
# Generated for use by PiVPN.io
=============================================
::::  Client template file shown below   ::::
client
dev tun
proto udp
remote REMOTE 1194
resolv-retry infinite
nobind
persist-key
persist-tun
remote-cert-tls server
tls-version-min 1.2
verify-x509-name OwVPN_8559e454-3009-45f3-926f-920a64c5bb18 name
cipher AES-256-CBC
auth SHA256
auth-nocache
verb 3
=============================================
::::    Recursive list of files in       ::::
::: /etc/openvpn/easy-rsa/pki shows below :::
/etc/openvpn/easy-rsa/pki/:
xxxxxx.ovpn
ca.crt
crl.pem
xxxxx.ovpn
Default.txt
ecparams
extensions.temp
index.txt
index.txt.attr
index.txt.attr.old
index.txt.old
issued
xxxx.ovpn
xxx.ovpn
openssl-easyrsa.cnf
private
renewed
revoked
safessl-easyrsa.cnf
serial
serial.old
ta.key

/etc/openvpn/easy-rsa/pki/ecparams:
prime256v1.pem

/etc/openvpn/easy-rsa/pki/issued:
xxxxx.crt
xxxxx.crt
xxxxx.crt
xxxxx.crt
xxxxx.crt

/etc/openvpn/easy-rsa/pki/private:
xxxxx.key
ca.key
xxxxx.key
xxxxx.key
xxxxx.key
xxxxxxxxxxxxxx.key

/etc/openvpn/easy-rsa/pki/renewed:
private_by_serial
reqs_by_serial

/etc/openvpn/easy-rsa/pki/renewed/private_by_serial:

/etc/openvpn/easy-rsa/pki/renewed/reqs_by_serial:

/etc/openvpn/easy-rsa/pki/revoked:
private_by_serial
reqs_by_serial

/etc/openvpn/easy-rsa/pki/revoked/private_by_serial:

/etc/openvpn/easy-rsa/pki/revoked/reqs_by_serial:
=============================================
::::            Self check               ::::
:: [OK] IP forwarding is enabled
:: [OK] Iptables MASQUERADE rule set
:: [OK] OpenVPN is running
:: [OK] OpenVPN is enabled (it will automatically start on reboot)
:: [OK] OpenVPN is listening on port 1194/udp
=============================================
::::      Snippet of the server log      ::::
Nov 24 06:50:55 VPN ovpn-server[118]: tls-crypt unwrap error: packet too short
Nov 24 06:50:55 VPN ovpn-server[118]: TLS Error: tls-crypt unwrapping failed from [AF_INET]REDACTED:39191
Nov 24 10:00:45 VPN ovpn-server[118]: tls-crypt unwrap error: packet too short
Nov 24 10:00:45 VPN ovpn-server[118]: TLS Error: tls-crypt unwrapping failed from [AF_INET]REDACTED:50661
=============================================
::::            Debug complete           ::::
:::
::: Debug output completed above.
::: Copy saved to /tmp/debug.txt
:::```
### Have you taken any steps towards solving your issue?
```
 First I think its MTU size problem, thats why I try with mssfix or link-mtu make pivpn mtu size smaller to fit my maximum 1452 MTU size, but it won't help.

tcpdump -i veth101i0 port 9767

14:52:26.220933 IP xxx.vodafone.hu.39686 > 192.168.7.5.9767: UDP, length 54
14:52:26.221801 IP 192.168.7.160.9767 > xxx.vodafone.hu.39686: UDP, length 66
14:52:28.230122 IP 192.168.7.160.9767 >xxx.vodafone.hu.39686: UDP, length 54
14:52:28.520501 IP xxx.vodafone.hu.39686 > 192.168.7.5.9767: UDP, length 54
14:52:28.520715 IP 192.168.7.160.9767 > xxx.vodafone.hu.39686: UDP, length 62

```

**Comment by orazioedoardo** [comment]
In the file `/etc/openvpn/server.conf` change the keepalive line to `keepalive 15 120`, then restart the server with `sudo systemctl restart openvpn`. Remove `persist-key` and `persist-tun` in the client config. Try again.

**Comment by orazioedoardo** [comment]
No replies in a while, closing...
