### ISSUE TITLE
[Support] <Your Issue here>

### ISSUE THREAD

**Issue by bobaxxx** [pivpn/pivpn#1158]
System = raspberry pi4
OS : Raspi-OS Buster

### Issue
Client cant connect to server with dyndns (dns entry) but works well with public IP, using wireguard 

### Have you searched for similar issues and solutions?

yes, i dont found anything about this problem

### Console output of      `pivpn debug`
```
::::		PiVPN debug		 ::::
=============================================
::::		Latest commit		 ::::
commit 32bd1c628af9e1926f3f4471c0bf49c74deff7c7 (grafted, HEAD -> master, origin/master, origin/HEAD)
Author: Orazio <orazioedoardo@users.noreply.github.com>
Date:   Fri Jul 24 18:52:57 2020 +0200

    Update LatestUpdate.md
=============================================
::::	    Installation settings    	 ::::
PLAT=Raspbian
OSCN=buster
USING_UFW=0
IPv4dev=eth0
IPv4addr=192.168.1.141/24
IPv4gw=192.168.1.1
install_user=pi
install_home=/home/pi
VPN=wireguard
pivpnPORT=51820
pivpnDNS1=10.6.0.1
pivpnDNS2=
pivpnHOST=REDACTED
INPUT_CHAIN_EDITED=0
FORWARD_CHAIN_EDITED=0
pivpnPROTO=udp
pivpnDEV=wg0
pivpnNET=10.6.0.0
subnetClass=24
UNATTUPG=1
INSTALLED_PACKAGES=()
=============================================
::::  Server configuration shown below   ::::
[Interface]
PrivateKey = server_priv
Address = 10.6.0.1/24
ListenPort = 51820
### begin essai ###
[Peer]
PublicKey = essai_pub
PresharedKey = essai_psk
AllowedIPs = 10.6.0.2/32
### end essai ###
=============================================
::::  Client configuration shown below   ::::
[Interface]
PrivateKey = essai_priv
Address = 10.6.0.2/24
DNS = 10.6.0.1
ListeningPort = 51820

[Peer]
PublicKey = server_pub
PresharedKey = essai_psk
Endpoint = REDACTED:51820
AllowedIPs = 0.0.0.0/0, ::0/0
=============================================
:::: 	Recursive list of files in	 ::::
::::	/etc/wireguard shown below	 ::::
/etc/wireguard:
configs  keys  wg0.conf

/etc/wireguard/configs:
clients.txt  essai.conf

/etc/wireguard/keys:
essai_priv  essai_psk  essai_pub  server_priv  server_pub
=============================================
::::		Self check		 ::::
:: [OK] IP forwarding is enabled
:: [OK] Iptables MASQUERADE rule set
:: [OK] WireGuard is running
:: [OK] WireGuard is enabled (it will automatically start on reboot)
:: [OK] WireGuard is listening on port 51820/udp
=============================================
:::: Having trouble connecting? Take a look at the FAQ:
:::: https://github.com/pivpn/pivpn/wiki/FAQ
=============================================
:::: WARNING: This script should have automatically masked sensitive       ::::
:::: information, however, still make sure that PrivateKey, PublicKey      ::::
:::: and PresharedKey are masked before reporting an issue. An example key ::::
:::: that you should NOT see in this log looks like this:                  ::::
:::: YIAoJVsdIeyvXfGGDDadHh6AxsMRymZTnnzZoAb9cxRe                          ::::
=============================================
::::		Debug complete		 ::::

```
### Have you taken any steps towards solving your issue?
```
- trying another ddns, same issue (using an ovh dynhost for the moment)
- check https://github.com/pivpn/pivpn/wiki/FAQ
- tcpdump, servers doesnt respond, with from an unknow ip address, probably ISP IP adress (mobile phone with LTE) :

tcpdump: verbose output suppressed, use -v or -vv for full protocol decode
listening on eth0, link-type EN10MB (Ethernet), capture size 262144 bytes
11:20:34.257087 IP 80.215.x.xx.40990 > 192.168.1.141.51820: UDP, length 148
11:20:39.358194 IP 80.215.x.xx.40990 > 192.168.1.141.51820: UDP, length 148
11:20:44.667068 IP 80.215.x.xx.40990 > 192.168.1.141.51820: UDP, length 148
11:20:49.904720 IP 80.215.x.xx.40990 > 192.168.1.141.51820: UDP, length 148


i noticed that the client try to connect to another port than 51820 (is that normal ?)

when i wg-quick up conf, i client is not connected to server, doesnt receive packets but still can send : 

allowed ips: 0.0.0.0/0, ::/0
transfer: 0 B received, 740 B sent
