### ISSUE TITLE
No handshake exchange between raspberryPi and IOS 18 using mobile data

### ISSUE THREAD

**Issue by polocto** [pivpn/pivpn#1870]
### In raising this issue I confirm that

- [x] I have read the [documentation](https://docs.pivpn.io)
- [X] I have read and understood the [PiVPN General Guidelines](https://github.com/pivpn/pivpn/#general-guidelines)
- [X] I have read and understood the [PiVPN Troubleshooting Guidelines](https://docs.pivpn.io/faq/#how-do-i-troubleshoot-connection-issues)
- [X] The issue I am reporting isn't a duplicate, see [closed issues](https://github.com/pivpn/pivpn/issues?q=is%3Aissue+sort%3Aupdated-desc+is%3Aclosed) and [open issues](https://github.com/pivpn/pivpn/issues?q=is%3Aissue+sort%3Aupdated-desc+is%3Aopen).
- [X] I have searched for similar issues and solutions
- [ ] I can replicate the issue even after a clean OS installation

### Describe the issue

The issue is that no handshake are exchanged between IOS 18 and my RaspberryPi 5 when it is using **mobile data**. When I am connected to a wifi I have no issues with my VPN connection and there is no problem with an Android phone using mobile data or wifi.

### Expected behavior

I expect to be able to connect to internet through my vpn connection when I am on my mobile network.

### Please describe the steps to replicate the issue

1. Disable wifi on your Iphone
2. Connect to mobile network
3. Start Wireguard VPN
4. Search anything on Internet

### Have you taken any steps towards solving your issue?

I tried different values for the MTU and finally set it up to 1420.

### Where did you run pivpn?

RaspberryPi

### Please provide your output from `uname -a`

Linux raspberrypi 6.6.51+rpt-rpi-2712 #1 SMP PREEMPT Debian 1:6.6.51-1+rpt3 (2024-10-08) aarch64 GNU/Linux

### Details about Operative System

PRETTY_NAME="Debian GNU/Linux 12 (bookworm)"
NAME="Debian GNU/Linux"
VERSION_ID="12"
VERSION="12 (bookworm)"
VERSION_CODENAME=bookworm
ID=debian
HOME_URL="https://www.debian.org/"
SUPPORT_URL="https://www.debian.org/support"
BUG_REPORT_URL="https://bugs.debian.org/"

### Profile / Client creation

[2024-10-28T16:48:14+0100]: ::: Error: Got an unexpected argument 'nopass'
::: Create a client conf profile
:::
::: Usage: pivpn <-a|add> [-n|--name <arg>] [-h|--help]
:::
::: Commands:
:::  [none]               Interactive mode
:::  -n,--name            Name for the Client (default: 'raspberrypi')
:::  -h,--help            Show this help dialog

### Debug output
```bash
::::  Server configuration shown below   ::::
[Interface]
PrivateKey = server_priv
Address = 10.124.138.1/24,fd11:5ee:bad:c0de::a7c:8a01/64
MTU = 1420
ListenPort = PORT
### begin polocto@phone ###
[Peer]
PublicKey = polocto@phone_pub
PresharedKey = polocto@phone_psk
AllowedIPs = 10.124.138.3/32,fd11:5ee:bad:c0de::a7c:8a03/128
### end polocto@phone ###
### begin polocto@macos ###
[Peer]
PublicKey = polocto@macos_pub
PresharedKey = polocto@macos_psk
AllowedIPs = 10.124.138.4/32,fd11:5ee:bad:c0de::a7c:8a04/128
### end polocto@macos ###
### begin laurent@phone ###
[Peer]
PublicKey = laurent@phone_pub
PresharedKey = laurent@phone_psk
AllowedIPs = 10.124.138.5/32,fd11:5ee:bad:c0de::a7c:8a05/128
### end laurent@phone ###
### begin raph@phone ###
[Peer]
PublicKey = raph@phone_pub
PresharedKey = raph@phone_psk
AllowedIPs = 10.124.138.6/32,fd11:5ee:bad:c0de::a7c:8a06/128
### end raph@phone ###
### begin raph@laptop ###
[Peer]
PublicKey = raph@laptop_pub
PresharedKey = raph@laptop_psk
AllowedIPs = 10.124.138.7/32,fd11:5ee:bad:c0de::a7c:8a07/128
### end raph@laptop ###
=============================================
::::  Client configuration shown below   ::::
[Interface]
PrivateKey = polocto@phone_priv
Address = 10.124.138.3/24,fd11:5ee:bad:c0de::a7c:8a03/64
DNS = 9.9.9.9, IP

[Peer]
PublicKey = server_pub
PresharedKey = polocto@phone_psk
Endpoint = REDACTED:PORT
AllowedIPs = 0.0.0.0/0, ::0/0
=============================================
:::: 	Recursive list of files in	 ::::
::::	/etc/wireguard shown below	 ::::
/etc/wireguard:
configs
keys
wg0.conf

/etc/wireguard/configs:
clients.txt
laurent@phone.conf
polocto@macos.conf
polocto@phone.conf
raph@laptop.conf
raph@phone.conf

/etc/wireguard/keys:
laurent@phone_priv
laurent@phone_psk
laurent@phone_pub
polocto@macos_priv
polocto@macos_psk
polocto@macos_pub
polocto@phone_priv
polocto@phone_psk
polocto@phone_pub
raph@laptop_priv
raph@laptop_psk
raph@laptop_pub
raph@phone_priv
raph@phone_psk
raph@phone_pub
server_priv
server_pub
=============================================
::::		Self check		 ::::
:: [OK] IP forwarding is enabled
:: [OK] Iptables MASQUERADE rule set
:: [OK] Iptables FORWARD rule set
:: [OK] WireGuard is running
:: [OK] WireGuard is enabled 
(it will automatically start on reboot)
:: [OK] WireGuard is listening on port PORT/udp
=============================================
:::: Having trouble connecting? Take a look at the FAQ:
:::: https://docs.pivpn.io/faq
=============================================
:::: WARNING: This script should have automatically masked sensitive       ::::
:::: information, however, still make sure that PrivateKey, PublicKey      ::::
:::: and PresharedKey are masked before reporting an issue. An example key ::::
:::: that you should NOT see in this log looks like this:                  ::::
:::: YIAoJVsdIeyvXfGGDDadHh6AxsMRymZTnnzZoAb9cxRe                          ::::
=============================================
::::		Debug complete		 ::::
::: 
::: Debug output completed above.
::: Copy saved to /tmp/debug.log
```

**Comment by orazioedoardo** [comment]
Sorry do you mean that the VPN works on mobile on Android but non on mobile on iOS?

**Comment by polocto** [comment]
It is working with iOS when I use wifi but not when I use mobile data.

The output while using my VPN through wifi with iOS is 

```bash
::: Generating Debug Output
::::            PiVPN debug              ::::
=============================================
::::            Latest commit            ::::
Branch: master
Commit: ececd4ed96b7e16493655131ae734b479aadd117
Author: 4s3ti
Date: Sat Apr 13 16:00:00 2024 +0200
Summary: build: Add automated release actions
=============================================
::::        Installation settings        ::::
PLAT=Debian
OSCN=bookworm
USING_UFW=0
IPv4dev=eth0
IPv6dev=eth0
dhcpReserv=1
IPv4addr=192.168.1.201/24
IPv4gw=192.168.1.254
install_user=polocto
install_home=/home/polocto
VPN=wireguard
pivpnPORT=51820
pivpnDNS1=9.9.9.9
pivpnDNS2=149.112.112.112
pivpnHOST=REDACTED
INPUT_CHAIN_EDITED=0
FORWARD_CHAIN_EDITED=1
INPUT_CHAIN_EDITEDv6=0
FORWARD_CHAIN_EDITEDv6=0
pivpnPROTO=udp
pivpnMTU=1420
pivpnDEV=wg0
pivpnNET=10.124.138.0
subnetClass=24
pivpnenableipv6=1
pivpnNETv6="fd11:5ee:bad:c0de::"
subnetClassv6=64
ALLOWED_IPS="0.0.0.0/0, ::0/0"
UNATTUPG=1
INSTALLED_PACKAGES=(dnsutils grepcidr bsdmainutils iptables-persistent wireguard-tools qrencode)
=============================================
::::  Server configuration shown below   ::::
[Interface]
PrivateKey = server_priv
Address = 10.124.138.1/24,fd11:5ee:bad:c0de::a7c:8a01/64
MTU = 1420
ListenPort = 51820
### begin polocto@phone ###
[Peer]
PublicKey = polocto@phone_pub
PresharedKey = polocto@phone_psk
AllowedIPs = 10.124.138.3/32,fd11:5ee:bad:c0de::a7c:8a03/128
### end polocto@phone ###
### begin polocto@macos ###
[Peer]
PublicKey = polocto@macos_pub
PresharedKey = polocto@macos_psk
AllowedIPs = 10.124.138.4/32,fd11:5ee:bad:c0de::a7c:8a04/128
### end polocto@macos ###
### begin laurent@phone ###
[Peer]
PublicKey = laurent@phone_pub
PresharedKey = laurent@phone_psk
AllowedIPs = 10.124.138.5/32,fd11:5ee:bad:c0de::a7c:8a05/128
### end laurent@phone ###
### begin raph@phone ###
[Peer]
PublicKey = raph@phone_pub
PresharedKey = raph@phone_psk
AllowedIPs = 10.124.138.6/32,fd11:5ee:bad:c0de::a7c:8a06/128
### end raph@phone ###
### begin raph@laptop ###
[Peer]
PublicKey = raph@laptop_pub
PresharedKey = raph@laptop_psk
AllowedIPs = 10.124.138.7/32,fd11:5ee:bad:c0de::a7c:8a07/128
### end raph@laptop ###
=============================================
::::  Client configuration shown below   ::::
[Interface]
PrivateKey = polocto@phone_priv
Address = 10.124.138.3/24,fd11:5ee:bad:c0de::a7c:8a03/64
DNS = 9.9.9.9, 149.112.112.112

[Peer]
PublicKey = server_pub
PresharedKey = polocto@phone_psk
Endpoint = REDACTED:51820
AllowedIPs = 0.0.0.0/0, ::0/0
=============================================
::::    Recursive list of files in       ::::
::::    /etc/wireguard shown below       ::::
/etc/wireguard:
configs
keys
wg0.conf

/etc/wireguard/configs:
clients.txt
laurent@phone.conf
polocto@macos.conf
polocto@phone.conf
raph@laptop.conf
raph@phone.conf

/etc/wireguard/keys:
laurent@phone_priv
laurent@phone_psk
laurent@phone_pub
polocto@macos_priv
polocto@macos_psk
polocto@macos_pub
polocto@phone_priv
polocto@phone_psk
polocto@phone_pub
raph@laptop_priv
raph@laptop_psk
raph@laptop_pub
raph@phone_priv
raph@phone_psk
raph@phone_pub
server_priv
server_pub
=============================================
::::            Self check               ::::
:: [OK] IP forwarding is enabled
:: [OK] Iptables MASQUERADE rule set
:: [OK] Iptables FORWARD rule set
:: [OK] WireGuard is running
:: [OK] WireGuard is enabled 
(it will automatically start on reboot)
:: [OK] WireGuard is listening on port 51820/udp
=============================================
:::: Having trouble connecting? Take a look at the FAQ:
:::: https://docs.pivpn.io/faq
=============================================
:::: WARNING: This script should have automatically masked sensitive       ::::
:::: information, however, still make sure that PrivateKey, PublicKey      ::::
:::: and PresharedKey are masked before reporting an issue. An example key ::::
:::: that you should NOT see in this log looks like this:                  ::::
:::: YIAoJVsdIeyvXfGGDDadHh6AxsMRymZTnnzZoAb9cxRe                          ::::
=============================================
::::            Debug complete           ::::
::: 
::: Debug output completed above.
::: Copy saved to /tmp/debug.log
::: 
```

IPv6 should also be running : 
```bash
$ lsmod | grep wireguard
wireguard             114688  0
libchacha20poly1305    49152  1 wireguard
ip6_udp_tunnel         49152  1 wireguard
udp_tunnel             49152  1 wireguard
libcurve25519_generic    65536  1 wireguard
ipv6                  589824  78 bridge,wireguard
```
While I am on mobile data the handshake does not seem to happen. On the mobile app no "dernier établissement de liaison" appear while I am using mobile data but appear when I am connected to wifi.

**Comment by polocto** [comment]
> Sorry do you mean that the VPN works on mobile on Android but non on mobile on iOS? You could try the troubleshooting while attempting to connect with iOS https://docs.pivpn.io/faq/#how-do-i-troubleshoot-connection-issues

It is working with iOS when I use wifi but not when I use mobile data.

The output while using my VPN through wifi with iOS is 

```bash
::: Generating Debug Output
::::            PiVPN debug              ::::
=============================================
::::            Latest commit            ::::
Branch: master
Commit: ececd4ed96b7e16493655131ae734b479aadd117
Author: 4s3ti
Date: Sat Apr 13 16:00:00 2024 +0200
Summary: build: Add automated release actions
=============================================
::::        Installation settings        ::::
PLAT=Debian
OSCN=bookworm
USING_UFW=0
IPv4dev=eth0
IPv6dev=eth0
dhcpReserv=1
IPv4addr=192.168.1.201/24
IPv4gw=192.168.1.254
install_user=polocto
install_home=/home/polocto
VPN=wireguard
pivpnPORT=51820
pivpnDNS1=9.9.9.9
pivpnDNS2=149.112.112.112
pivpnHOST=REDACTED
INPUT_CHAIN_EDITED=0
FORWARD_CHAIN_EDITED=1
INPUT_CHAIN_EDITEDv6=0
FORWARD_CHAIN_EDITEDv6=0
pivpnPROTO=udp
pivpnMTU=1420
pivpnDEV=wg0
pivpnNET=10.124.138.0
subnetClass=24
pivpnenableipv6=1
pivpnNETv6="fd11:5ee:bad:c0de::"
subnetClassv6=64
ALLOWED_IPS="0.0.0.0/0, ::0/0"
UNATTUPG=1
INSTALLED_PACKAGES=(dnsutils grepcidr bsdmainutils iptables-persistent wireguard-tools qrencode)
=============================================
::::  Server configuration shown below   ::::
[Interface]
PrivateKey = server_priv
Address = 10.124.138.1/24,fd11:5ee:bad:c0de::a7c:8a01/64
MTU = 1420
ListenPort = 51820
### begin polocto@phone ###
[Peer]
PublicKey = polocto@phone_pub
PresharedKey = polocto@phone_psk
AllowedIPs = 10.124.138.3/32,fd11:5ee:bad:c0de::a7c:8a03/128
### end polocto@phone ###
### begin polocto@macos ###
[Peer]
PublicKey = polocto@macos_pub
PresharedKey = polocto@macos_psk
AllowedIPs = 10.124.138.4/32,fd11:5ee:bad:c0de::a7c:8a04/128
### end polocto@macos ###
### begin laurent@phone ###
[Peer]
PublicKey = laurent@phone_pub
PresharedKey = laurent@phone_psk
AllowedIPs = 10.124.138.5/32,fd11:5ee:bad:c0de::a7c:8a05/128
### end laurent@phone ###
### begin raph@phone ###
[Peer]
PublicKey = raph@phone_pub
PresharedKey = raph@phone_psk
AllowedIPs = 10.124.138.6/32,fd11:5ee:bad:c0de::a7c:8a06/128
### end raph@phone ###
### begin raph@laptop ###
[Peer]
PublicKey = raph@laptop_pub
PresharedKey = raph@laptop_psk
AllowedIPs = 10.124.138.7/32,fd11:5ee:bad:c0de::a7c:8a07/128
### end raph@laptop ###
=============================================
::::  Client configuration shown below   ::::
[Interface]
PrivateKey = polocto@phone_priv
Address = 10.124.138.3/24,fd11:5ee:bad:c0de::a7c:8a03/64
DNS = 9.9.9.9, 149.112.112.112

[Peer]
PublicKey = server_pub
PresharedKey = polocto@phone_psk
Endpoint = REDACTED:51820
AllowedIPs = 0.0.0.0/0, ::0/0
=============================================
::::    Recursive list of files in       ::::
::::    /etc/wireguard shown below       ::::
/etc/wireguard:
configs
keys
wg0.conf

/etc/wireguard/configs:
clients.txt
laurent@phone.conf
polocto@macos.conf
polocto@phone.conf
raph@laptop.conf
raph@phone.conf

/etc/wireguard/keys:
laurent@phone_priv
laurent@phone_psk
laurent@phone_pub
polocto@macos_priv
polocto@macos_psk
polocto@macos_pub
polocto@phone_priv
polocto@phone_psk
polocto@phone_pub
raph@laptop_priv
raph@laptop_psk
raph@laptop_pub
raph@phone_priv
raph@phone_psk
raph@phone_pub
server_priv
server_pub
=============================================
::::            Self check               ::::
:: [OK] IP forwarding is enabled
:: [OK] Iptables MASQUERADE rule set
:: [OK] Iptables FORWARD rule set
:: [OK] WireGuard is running
:: [OK] WireGuard is enabled 
(it will automatically start on reboot)
:: [OK] WireGuard is listening on port 51820/udp
=============================================
:::: Having trouble connecting? Take a look at the FAQ:
:::: https://docs.pivpn.io/faq
=============================================
:::: WARNING: This script should have automatically masked sensitive       ::::
:::: information, however, still make sure that PrivateKey, PublicKey      ::::
:::: and PresharedKey are masked before reporting an issue. An example key ::::
:::: that you should NOT see in this log looks like this:                  ::::
:::: YIAoJVsdIeyvXfGGDDadHh6AxsMRymZTnnzZoAb9cxRe                          ::::
=============================================
::::            Debug complete           ::::
::: 
::: Debug output completed above.
::: Copy saved to /tmp/debug.log
::: 
```

IPv6 should also be running : 
```bash
$ lsmod | grep wireguard
wireguard             114688  0
libchacha20poly1305    49152  1 wireguard
ip6_udp_tunnel         49152  1 wireguard
udp_tunnel             49152  1 wireguard
libcurve25519_generic    65536  1 wireguard
ipv6                  589824  78 bridge,wireguard
```
While I am on mobile data the handshake does not seem to happen. On the mobile app no "dernier établissement de liaison" appear while I am using mobile data but appear when I am connected to wifi.

**Comment by orazioedoardo** [comment]
You have already posted the debug log, you don't need to post it again, but there are more steps to follow in my link above.

**Comment by polocto** [comment]
Here are the other steps

```bash
lsmod | grep wireguard
wireguard             114688  0
libchacha20poly1305    49152  1 wireguard
ip6_udp_tunnel         49152  1 wireguard
udp_tunnel             49152  1 wireguard
libcurve25519_generic    65536  1 wireguard
ipv6                  589824  62 bridge,wireguard
```

For the setupvar.conf I got the good values

```bash
sudo tcpdump -n -i eth0 udp port 51820
tcpdump: verbose output suppressed, use -v[v]... for full protocol decode
listening on eth0, link-type EN10MB (Ethernet), snapshot length 262144 bytes
01:03:30.895533 IP 192.168.1.201.51820 > 192.168.1.254.64888: UDP, length 272
01:03:30.899707 IP 192.168.1.254.64888 > 192.168.1.201.51820: UDP, length 96
01:03:30.979099 IP 192.168.1.201.51820 > 192.168.1.254.64888: UDP, length 288
01:03:30.985114 IP 192.168.1.254.64888 > 192.168.1.201.51820: UDP, length 96
01:03:31.083024 IP 192.168.1.201.51820 > 192.168.1.254.64888: UDP, length 288
01:03:31.088320 IP 192.168.1.254.64888 > 192.168.1.201.51820: UDP, length 96
01:03:31.187027 IP 192.168.1.201.51820 > 192.168.1.254.64888: UDP, length 288
01:03:31.192983 IP 192.168.1.254.64888 > 192.168.1.201.51820: UDP, length 96
01:03:31.291003 IP 192.168.1.201.51820 > 192.168.1.254.64888: UDP, length 288
01:03:31.298535 IP 192.168.1.254.64888 > 192.168.1.201.51820: UDP, length 96
01:03:31.389838 IP 192.168.1.254.64888 > 192.168.1.201.51820: UDP, length 128
01:03:31.394998 IP 192.168.1.201.51820 > 192.168.1.254.64888: UDP, length 368
01:03:31.401923 IP 192.168.1.254.64888 > 192.168.1.201.51820: UDP, length 96
...
496 packets captured
499 packets received by filter
``
0 packets dropped by kernel

**Comment by polocto** [comment]
Here is my logs from my iphone connected to cellular network

> 2024-11-04 13:42:58.272
[APP] startActivation: Entering (tunnel: Maison)
2024-11-04 13:42:58.281
[APP] startActivation: Starting tunnel
2024-11-04 13:42:58.282
[APP] startActivation: Success
2024-11-04 13:42:58.286
[APP] Tunnel 'Maison' connection status changed to 'connecting'
2024-11-04 13:42:58.384
[NET] App version: 1.0.16 (27)
2024-11-04 13:42:58.384
[NET] Starting tunnel from the app
2024-11-04 13:42:58.508
[NET] DNS64: mapped <MY PUBLIC IP> to itself.
2024-11-04 13:42:58.510
[NET] Attaching to interface
2024-11-04 13:42:58.510
[NET] UAPI: Updating private key
2024-11-04 13:42:58.511
[NET] Routine: encryption worker 2 - started
2024-11-04 13:42:58.511
[NET] Routine: handshake worker 3 - started
2024-11-04 13:42:58.511
[NET] Routine: encryption worker 1 - started
2024-11-04 13:42:58.511
[NET] Routine: decryption worker 1 - started
2024-11-04 13:42:58.511
[NET] Routine: decryption worker 5 - started
2024-11-04 13:42:58.511
[NET] UAPI: Removing all peers
2024-11-04 13:42:58.511
[NET] Routine: handshake worker 1 - started
2024-11-04 13:42:58.511
[NET] Routine: decryption worker 2 - started
2024-11-04 13:42:58.511
[NET] Routine: handshake worker 4 - started
2024-11-04 13:42:58.511
[NET] Routine: decryption worker 4 - started
2024-11-04 13:42:58.511
[NET] Routine: encryption worker 5 - started
2024-11-04 13:42:58.511
[NET] Routine: encryption worker 4 - started
2024-11-04 13:42:58.511
[NET] Routine: handshake worker 2 - started
2024-11-04 13:42:58.511
[NET] Routine: encryption worker 3 - started
2024-11-04 13:42:58.511
[NET] Routine: handshake worker 6 - started
2024-11-04 13:42:58.511
[NET] Routine: decryption worker 3 - started
2024-11-04 13:42:58.511
[NET] Routine: TUN reader - started
2024-11-04 13:42:58.511
[NET] Routine: encryption worker 6 - started
2024-11-04 13:42:58.511
[NET] Routine: decryption worker 6 - started
2024-11-04 13:42:58.511
[NET] Routine: handshake worker 5 - started
2024-11-04 13:42:58.511
[NET] Routine: event worker - started
2024-11-04 13:42:58.511
[NET] peer(zscN…l1ng) - UAPI: Created
2024-11-04 13:42:58.512
[NET] peer(zscN…l1ng) - UAPI: Updating preshared key
2024-11-04 13:42:58.512
[NET] peer(zscN…l1ng) - UAPI: Updating endpoint
2024-11-04 13:42:58.512
[NET] peer(zscN…l1ng) - UAPI: Updating persistent keepalive interval
2024-11-04 13:42:58.512
[NET] peer(zscN…l1ng) - UAPI: Removing all allowedips
2024-11-04 13:42:58.512
[NET] peer(zscN…l1ng) - UAPI: Adding allowedip
2024-11-04 13:42:58.512
[NET] peer(zscN…l1ng) - UAPI: Adding allowedip
2024-11-04 13:42:58.513
[NET] UDP bind has been updated
2024-11-04 13:42:58.513
[NET] peer(zscN…l1ng) - Starting
2024-11-04 13:42:58.513
[NET] Routine: receive incoming v6 - started
2024-11-04 13:42:58.513
[NET] Routine: receive incoming v4 - started
2024-11-04 13:42:58.513
[NET] Interface state was Down, requested Up, now Up
2024-11-04 13:42:58.513
[NET] Device started
2024-11-04 13:42:58.513
[NET] Tunnel interface is utun7
2024-11-04 13:42:58.514
[NET] peer(zscN…l1ng) - Routine: sequential receiver - started
2024-11-04 13:42:58.514
[NET] peer(zscN…l1ng) - Routine: sequential sender - started
2024-11-04 13:42:58.514
[NET] Network change detected with unsatisfied route and interface order [pdp_ip0]
2024-11-04 13:42:58.514
[NET] Connectivity offline, pausing backend.
2024-11-04 13:42:58.514
[NET] Device closing
2024-11-04 13:42:58.514
[NET] Routine: TUN reader - stopped
2024-11-04 13:42:58.515
[NET] Routine: event worker - stopped
2024-11-04 13:42:58.515
[NET] Routine: receive incoming v4 - stopped
2024-11-04 13:42:58.515
[NET] Routine: receive incoming v6 - stopped
2024-11-04 13:42:58.515
[NET] peer(zscN…l1ng) - Stopping
2024-11-04 13:42:58.515
[NET] peer(zscN…l1ng) - Routine: sequential receiver - stopped
2024-11-04 13:42:58.515
[NET] peer(zscN…l1ng) - Routine: sequential sender - stopped
2024-11-04 13:42:58.515
[NET] Device closed
2024-11-04 13:42:58.515
[NET] Routine: decryption worker 1 - stopped
2024-11-04 13:42:58.515
[NET] Routine: decryption worker 6 - stopped
2024-11-04 13:42:58.515
[NET] Routine: decryption worker 3 - stopped
2024-11-04 13:42:58.515
[NET] Routine: handshake worker 3 - stopped
2024-11-04 13:42:58.515
[NET] Routine: decryption worker 2 - stopped
2024-11-04 13:42:58.515
[APP] Tunnel 'Maison' connection status changed to 'connected'
2024-11-04 13:42:58.515
[NET] Routine: handshake worker 5 - stopped
2024-11-04 13:42:58.515
[NET] Routine: handshake worker 1 - stopped
2024-11-04 13:42:58.515
[NET] Routine: decryption worker 4 - stopped
2024-11-04 13:42:58.515
[NET] Routine: decryption worker 5 - stopped
2024-11-04 13:42:58.515
[NET] Routine: handshake worker 2 - stopped
2024-11-04 13:42:58.515
[NET] Routine: handshake worker 4 - stopped
2024-11-04 13:42:58.515
[NET] Routine: handshake worker 6 - stopped
2024-11-04 13:42:58.516
[NET] Routine: encryption worker 2 - stopped
2024-11-04 13:42:58.516
[NET] Routine: encryption worker 5 - stopped
2024-11-04 13:42:58.516
[NET] Routine: encryption worker 4 - stopped
2024-11-04 13:42:58.516
[NET] Routine: encryption worker 1 - stopped
2024-11-04 13:42:58.516
[NET] Routine: encryption worker 3 - stopped
2024-11-04 13:42:58.516
[NET] Routine: encryption worker 6 - stopped
2024-11-04 13:42:58.566
[NET] Network change detected with unsatisfied route and interface order [pdp_ip0, utun7]
2024-11-04 13:43:03.282
[APP] Status update notification timeout for tunnel 'Maison'. Tunnel status is now 'connected'.
2024-11-04 13:43:05.609
[APP] startDeactivation: Tunnel: Maison
2024-11-04 13:43:05.614
[APP] Tunnel 'Maison' connection status changed to 'disconnecting'
2024-11-04 13:43:05.724
[NET] Network change detected with unsatisfied route and interface order [pdp_ip0]
2024-11-04 13:43:05.935
[NET] Stopping tunnel

**Comment by orazioedoardo** [comment]
The `tcpdump` log only shows connection from the local network, can you try while connecting over mobile data?

**Comment by polocto** [comment]
I got no packets while using mobile data

```bash
sudo tcpdump -n -i eth0 udp port 51820
tcpdump: verbose output suppressed, use -v[v]... for full protocol decode
listening on eth0, link-type EN10MB (Ethernet), snapshot length 262144 bytes
```

**Comment by orazioedoardo** [comment]
> I got no packets while using mobile data

With both iOS as well as Android?

**Comment by polocto** [comment]
No only for IOS, for Android I got this

```bash
14:25:13.614234 IP 92.184.118.123.48116 > 192.168.1.201.51820: UDP, length 80
14:25:13.873592 IP 92.184.118.123.48116 > 192.168.1.201.51820: UDP, length 112
14:25:13.923804 IP 92.184.118.123.48116 > 192.168.1.201.51820: UDP, length 320
14:25:14.053812 IP 92.184.118.123.48116 > 192.168.1.201.51820: UDP, length 320
14:25:14.603226 IP 192.168.1.201.51820 > 192.168.1.254.61315: UDP, length 148
14:25:16.983368 IP 92.184.118.123.48116 > 192.168.1.201.51820: UDP, length 96
14:25:17.121401 IP 92.184.118.123.48116 > 192.168.1.201.51820: UDP, length 96
14:25:17.121401 IP 92.184.118.123.48116 > 192.168.1.201.51820: UDP, length 96
14:25:17.704425 IP 92.184.118.123.48116 > 192.168.1.201.51820: UDP, length 96
14:25:17.704425 IP 92.184.118.123.48116 > 192.168.1.201.51820: UDP, length 96
14:25:17.706719 IP 192.168.1.201.51820 > 92.184.118.123.48116: UDP, length 112
14:25:17.706725 IP 192.168.1.201.51820 > 92.184.118.123.48116: UDP, length 128
14:25:17.773718 IP 92.184.118.123.48116 > 192.168.1.201.51820: UDP, length 96
14:25:17.779665 IP 192.168.1.201.51820 > 92.184.118.123.48116: UDP, length 96
```

**Comment by orazioedoardo** [comment]
Weird, what if you try to connect iOS via the Android hotspot?

**Comment by polocto** [comment]
Just got the right IP as if I am connected to the VPN while using android hotspot but it seems that there is not packets exchange and turn on the VPN on my iPhone

**Comment by polocto** [comment]
Sorry test wrong network interface, it works correctly even though the connection is slow

> 14:39:47.105795 IP 92.184.118.123.64197 > 192.168.1.201.51820: UDP, length 128
14:39:47.271663 IP 92.184.118.123.64197 > 192.168.1.201.51820: UDP, length 128
14:39:48.299100 IP 92.184.118.123.64197 > 192.168.1.201.51820: UDP, length 128
14:39:49.099442 IP 192.168.1.201.51820 > 92.184.118.123.48116: UDP, length 148
14:39:49.263003 IP 92.184.118.123.64197 > 192.168.1.201.51820: UDP, length 128

**Comment by polocto** [comment]
> Really weird I got not packet exchange
> 
> ```shell
> sudo tcpdump -n -i wg0 udp port 51820
> tcpdump: verbose output suppressed, use -v[v]... for full protocol decode
> listening on wg0, link-type RAW (Raw IP), snapshot length 262144 bytes
> ```
> 
> but I got a really slow network connection
> 
> Tried to connect to whatis my IP to see if I go through the right network but I only have the HTML and not all the web page content and cannot see what is my IP


Sorry test wrong network interface, it works correctly even though the connection is slow
```bash
4:39:47.105795 IP 92.184.118.123.64197 > 192.168.1.201.51820: UDP, length 128
14:39:47.271663 IP 92.184.118.123.64197 > 192.168.1.201.51820: UDP, length 128
14:39:48.299100 IP 92.184.118.123.64197 > 192.168.1.201.51820: UDP, length 128
14:39:49.099442 IP 192.168.1.201.51820 > 92.184.118.123.48116: UDP, length 148
14:39:49.263003 IP 92.184.118.123.64197 > 192.168.1.201.51820: UDP, length 128
```

**Comment by orazioedoardo** [comment]
> it works correctly even though the connection is slow

Try lowering the MTU on the iPhone https://docs.pivpn.io/faq/#tweaking-mtu

**Comment by polocto** [comment]
I changed  `MTU` from 1280 to 1420 `+=20` but it is not effective and while using `pivpn -c` it does not appear as able to handshake while I try to connect my iPhone to my vpn through mobile data.

**Comment by orazioedoardo** [comment]
To eliminate a possible iOS issue, you could try the Android (e)SIM on the iPhone and see if it’s slow. Also try MTU under 1280. Though I suspect it’s an issue with the network rather than iOS.

**Comment by polocto** [comment]
Hello, I have been able to test the other sim card, their is no handshak with the server. It might have been an issue with the app or the network config. I reuninstalled it and reset my parameters and now its working
