### ISSUE TITLE
[Support] Connection established but can't access local network or internet (followed FAQ)

### ISSUE THREAD

**Issue by jimprince** [pivpn/pivpn#1240]
## In raising this issue, I confirm the following:

`{please fill the checkboxes, e.g: [X]}`

- [X] I have read and understood the [contributors guide](https://github.com/pivpn/pivpn/blob/master/CONTRIBUTING.md).
- [X] The issue I am reporting can be *replicated*.
- [X] The issue I am reporting can be *is* directly related to the pivpn installer script.
- [X] The issue I am reporting isn't a duplicate (see [FAQs](https://github.com/pivpn/pivpn/wiki/FAQ), [closed issues](https://github.com/pivpn/pivpn/issues?q=is%3Aissue+sort%3Aupdated-desc+is%3Aclosed), and [open issues](https://github.com/pivpn/pivpn/issues?q=is%3Aissue+sort%3Aupdated-desc+is%3Aopen)).

### Issue
I've been able to install pivpn to an fresh install of Raspberry Pi OS without any problems on the install. I have copied the config files to my Macbook and am able to connect, but do not seem to have any access to the server's network or the internet once connected. If I switch to a cellular network through my phone's hotspot I'm able to connect and access the network no problem. I've followed the FAQ and surprisingly am able to see packets from my macbook come into the raspberry pi but despite this am unable to access local resources or the internet through the connection. 

### Have you searched for similar issues and solutions?
yes, after several hours and several reinstalls I'm not able to remedy the problem.

### Console output of      `pivpn debug`
```
pi@raspberrypi:~ $ pivpn -d
::: Generating Debug Output
::::            PiVPN debug              ::::
=============================================
::::            Latest commit            ::::
commit b2b93de8dc30e5a6b3611c8f803a89eca0eb80db
Author: 4s3ti <4s3ti@protonmail.com>
Date:   Fri Feb 5 00:23:04 2021 +0100

    Update Dead and wrong links

    README.md: Changed dead link to old issue template
    CONTRIBUTING.md: Changed link poiting to blank issue leading users to
    not see the issue template when opening issues
=============================================
::::        Installation settings        ::::
PLAT=Raspbian
OSCN=buster
USING_UFW=0
IPv4dev=eth0
dhcpReserv=1
IPv4addr=192.168.77.109/24
IPv4gw=192.168.77.1
install_user=pi
install_home=/home/pi
VPN=wireguard
pivpnPORT=1194
pivpnDNS1=9.9.9.9
pivpnDNS2=149.112.112.112
pivpnHOST=REDACTED
INPUT_CHAIN_EDITED=0
FORWARD_CHAIN_EDITED=0
pivpnPROTO=udp
pivpnDEV=wg0
pivpnNET=10.6.0.0
subnetClass=24
ALLOWED_IPS="0.0.0.0/0, ::0/0"
UNATTUPG=1
INSTALLED_PACKAGES=()
=============================================
::::  Server configuration shown below   ::::
[Interface]
PrivateKey = server_priv
Address = 10.6.0.1/24
ListenPort = 1194
### begin BPMBP ###
[Peer]
PublicKey = BPMBP_pub
PresharedKey = BPMBP_psk
AllowedIPs = 10.6.0.2/32
### end BPMBP ###
=============================================
::::  Client configuration shown below   ::::
[Interface]
PrivateKey = BPMBP_priv
Address = 10.6.0.2/24
DNS = 9.9.9.9, 149.112.112.112

[Peer]
PublicKey = server_pub
PresharedKey = BPMBP_psk
Endpoint = REDACTED:1194
AllowedIPs = 0.0.0.0/0, ::0/0
=============================================
::::    Recursive list of files in       ::::
::::    /etc/wireguard shown below       ::::
/etc/wireguard:
configs
keys
wg0.conf

/etc/wireguard/configs:
BPMBP.conf
clients.txt

/etc/wireguard/keys:
BPMBP_priv
BPMBP_psk
BPMBP_pub
server_priv
server_pub
=============================================
::::            Self check               ::::
:: [OK] IP forwarding is enabled
:: [OK] Iptables MASQUERADE rule set
:: [OK] WireGuard is running
:: [OK] WireGuard is enabled (it will automatically start on reboot)
:: [OK] WireGuard is listening on port 1194/udp
=============================================
:::: Having trouble connecting? Take a look at the FAQ:
:::: https://github.com/pivpn/pivpn/wiki/FAQ
=============================================
:::: WARNING: This script should have automatically masked sensitive       ::::
:::: information, however, still make sure that PrivateKey, PublicKey      ::::
:::: and PresharedKey are masked before reporting an issue. An example key ::::
:::: that you should NOT see in this log looks like this:                  ::::
:::: YIAoJVsdIeyvXfGGDDadHh6AxsMRymZTnnzZoAb9cxRe                          ::::
=============================================
::::            Debug complete           ::::
:::
::: Debug output completed above.
::: Copy saved to /tmp/debug.log
:::
```

### Have you taken any steps towards solving your issue?
```
yes, I've followed the FAQ and a few other issues that seemed to have some relevance. I've reinstalled several times.
```

I've run `sudo systemctl restart wg-quick@wg0` and then `lsmod | grep wireguard`

```
pi@raspberrypi:~ $ lsmod | grep wireguard
wireguard              73728  0
curve25519_neon        28672  1 wireguard
libcurve25519_generic    24576  2 curve25519_neon,wireguard
libchacha20poly1305    16384  1 wireguard
ip6_udp_tunnel         16384  1 wireguard
udp_tunnel             24576  1 wireguard
libblake2s             16384  1 wireguard
ipv6                  495616  29 wireguard
```

Ran `cat /etc/pivpn/wireguard/setupVars.conf` and compared my network interface, the ipv4addr, apv4gw, pivpnpronto, pivpnport and pivpnhost, which all seem to be in order

```
pi@raspberrypi:~ $ cat /etc/pivpn/wireguard/setupVars.conf
PLAT=Raspbian
OSCN=buster
USING_UFW=0
IPv4dev=eth0
dhcpReserv=1
IPv4addr=192.168.77.109/24
IPv4gw=192.168.77.1
install_user=pi
install_home=/home/pi
VPN=wireguard
pivpnPORT=1194
pivpnDNS1=9.9.9.9
pivpnDNS2=149.112.112.112
pivpnHOST=REDACTED
INPUT_CHAIN_EDITED=0
FORWARD_CHAIN_EDITED=0
pivpnPROTO=udp
pivpnDEV=wg0
pivpnNET=10.6.0.0
subnetClass=24
ALLOWED_IPS="0.0.0.0/0, ::0/0"
UNATTUPG=1
INSTALLED_PACKAGES=()
```

Checked the packet capture using the command `tcpdump -n -i eth0 port 1194 -v` as superuser which shows:

```
pi@raspberrypi:~ $ sudo -s
root@raspberrypi:/home/pi# tcpdump -n -i eth0 port 1194 -v
tcpdump: listening on eth0, link-type EN10MB (Ethernet), capture size 262144 bytes
01:50:14.089029 IP (tos 0x68, ttl 57, id 44453, offset 0, flags [none], proto UDP (17), length 176)
    REDACTED.62834 > 192.168.77.109.1194: UDP, length 148
01:50:14.093091 IP (tos 0x88, ttl 64, id 19400, offset 0, flags [none], proto UDP (17), length 120)
    192.168.77.109.1194 > REDACTED.62834: UDP, length 92
01:50:29.371252 IP (tos 0x0, ttl 57, id 34501, offset 0, flags [none], proto UDP (17), length 176)
    REDACTED.62834 > 192.168.77.109.1194: UDP, length 148
01:50:29.375036 IP (tos 0x88, ttl 64, id 20529, offset 0, flags [none], proto UDP (17), length 120)
    192.168.77.109.1194 > REDACTED.62834: UDP, length 92
01:50:44.846438 IP (tos 0x0, ttl 57, id 13962, offset 0, flags [none], proto UDP (17), length 176)
    REDACTED.62834 > 192.168.77.109.1194: UDP, length 148
01:50:44.850171 IP (tos 0x88, ttl 64, id 20767, offset 0, flags [none], proto UDP (17), length 120)
    192.168.77.109.1194 > REDACTED.62834: UDP, length 92
```

At that point the WireGuard GUI client indicates that the interface is "active", with a green circle

I've taken a look at IP Tables, but to be honest am not sure what to make of it except it looks the same as the one in the issue I was referencing and that didn't end up being their issue. Output of `sudo iptales -t nat -S`

```
pi@raspberrypi:~ $ sudo iptables -t nat -S
-P PREROUTING ACCEPT
-P INPUT ACCEPT
-P POSTROUTING ACCEPT
-P OUTPUT ACCEPT
-A POSTROUTING -s 10.6.0.0/24 -o eth0 -m comment --comment wireguard-nat-rule -j MASQUERADE
```

I also tried looking at the firewall using `sudo ufw status verbose` but get "ufw: command not found" which I suppose is a result of me using the Raspberry Pi Operating system and not Ubuntu.

That's about as far as I've gotten. I tried pinging my pi's network from my macbook but didn't get a response.

Any help appreciated.

Thanks!

**Comment by orazioedoardo** [comment]
> I have copied the config files to my Macbook and am able to connect, but do not seem to have any access to the server's network or the internet once connected.

Is your Macbook in the same network as the Raspberry Pi?

**Comment by jimprince** [comment]
@orazioedoardo nope, it isn't. My Pi is at home and I'm trying this from work on the other side of the city.

**Comment by orazioedoardo** [comment]
> If I switch to a cellular network through my phone's hotspot I'm able to connect and access the network no problem.
Works on your phone, and the debug log is ok, as well as iptables. So I'd say it's an issue with the MacBook?

Do you see Rx/Tx bytes increasing on the wireguard gui on Mac? Does `pivpn -c` show the last seen on the BPMBP line?

By the way, I see that you have one config only. Please know that you need one config for each client. If you connect with your phone you cannot use the same config at the same time on your Mac.

**Comment by TinCanTech** [comment]
Sounds like a subnet conflict ..

**Comment by jimprince** [comment]
> Do you see Rx/Tx bytes increasing on the wireguard gui on Mac? 

It sits in the bytes range, incrementing every 15 seconds when it renews the handshake.

>Does `pivpn -c` show the last seen on the BPMBP line?

Not at work today, I'll check on Monday and report back

> By the way, I see that you have one config only. Please know that you need one config for each client. If you connect with your phone you cannot use the same config at the same time on your Mac.

Thanks, before I reinstalled most recently I had a separate profile for my phone to use. When I use wireguard on my laptop through my phone's hotspot that connects without issue.


> Sounds like a subnet conflict ..

I was wondering about this too. The work network I was on has a subnet of 10.*.*.*/24 (can't remember exactly at the moment but it does not overlap in the subsequent 3 sets of numbers with the 10.6.0.0/24 piVPN subnet). I had thought the subnet mask of /24 meant that they would be different subnets, but I can try changing the piVPN subnet when I get back to work on Monday.

The other part I was confused about was the `[peer]` section of the server config specifies an IP of 10.6.0.2/32, but the client config specifies an IP of 10.6.0.2/24. The configuration file specifies a subnet of 24. These are all the defaults so presumably they're set appropriately, but it seemed odd that the server config would specify a different subnet class than the installation settings and client settings.

**Comment by orazioedoardo** [comment]
> The other part I was confused about was the [peer] section of the server config specifies an IP of 10.6.0.2/32, but the client config specifies an IP of 10.6.0.2/24. The installation settings file specifies a subnet of 24. These are all the defaults so presumably they're set appropriately, but it seemed odd that the server config would specify a different subnet class than the installation settings and client settings.

`Address` in the `[Interface]` section means a single IP address with its netmask, while `AllowedIPs` in the `[Peer]` section specifies a group of ip addresses that the peer is allowed to be inside the tunnel, /32 is a single IP address.

**Comment by jimprince** [comment]
My work subnet, in case someone can see an issue with it that I don't.

![image](https://user-images.githubusercontent.com/9954186/107572663-cbeec500-6ba9-11eb-96f8-a27748727601.png)

**Comment by TinCanTech** [comment]
If you set `--verb 4` in your client config file and then read your log file from the point of connection over the two various connections you use, any errors will be shown there.

**Comment by orazioedoardo** [comment]
> Thanks, before I reinstalled most recently I had a separate profile for my phone to use. When I use wireguard on my laptop through my phone's hotspot that connects without issue.

Any chance your work network tries to block WireGuard?

**Comment by jimprince** [comment]
And part of the log from the client side when connecting from my work network.
```
2021-02-10 14:11:56.309 [NET] peer(EcMs…AUl8) - Sending handshake initiation
2021-02-10 14:11:56.310 [NET] peer(EcMs…AUl8) - Awaiting keypair
2021-02-10 14:11:56.405 [NET] peer(EcMs…AUl8) - Received handshake response
2021-02-10 14:11:56.406 [NET] peer(EcMs…AUl8) - Obtained awaited keypair
2021-02-10 14:11:59.424 [NET] Interface set up
2021-02-10 14:12:00.739 [APP] Status update notification timeout for tunnel 'bpmbp'. Tunnel status is now 'connected'.
2021-02-10 14:12:11.572 [NET] peer(EcMs…AUl8) - Retrying handshake because we stopped hearing back after 15 seconds
2021-02-10 14:12:11.572 [NET] peer(EcMs…AUl8) - Sending handshake initiation
2021-02-10 14:12:11.596 [NET] peer(EcMs…AUl8) - Received handshake response
2021-02-10 14:12:11.597 [NET] peer(EcMs…AUl8) - Sending keepalive packet
2021-02-10 14:12:26.794 [NET] peer(EcMs…AUl8) - Retrying handshake because we stopped hearing back after 15 seconds
2021-02-10 14:12:26.794 [NET] peer(EcMs…AUl8) - Sending handshake initiation
2021-02-10 14:12:26.816 [NET] peer(EcMs…AUl8) - Received handshake response
2021-02-10 14:12:26.817 [NET] peer(EcMs…AUl8) - Sending keepalive packet
2021-02-10 14:12:42.554 [NET] peer(EcMs…AUl8) - Retrying handshake because we stopped hearing back after 15 seconds
```

Also some additional config from my laptop after running ifconfig
```
bridge0 (14):
  flags         UP BROADCAST NOTRAILERS RUNNING SIMPLEX MULTICAST
  mtu           1500

en0 (6):
  inet address  10.213.154.69
  netmask       255.255.224.0
  broadcast     10.213.159.255
  flags         UP BROADCAST NOTRAILERS RUNNING SIMPLEX MULTICAST
  mtu           1500

utun4 (19):
  inet address  10.6.0.2
  netmask       255.255.255.0
  peer address  10.6.0.2
  flags         UP POINTOPOINT RUNNING MULTICAST
  mtu           1420
```

**Comment by jimprince** [comment]
> Any chance your work network tries to block WireGuard?

If that were the case, wouldn't I not be able to connect at all? I had previously setup openVPN on a DDWRT router and it worked. WireGuard had gotten enough good reviews that when I replaced my router I thought I'd give it a shot. Perhaps I'll reinstall using OpenVPN and see if it is still doing the same thing. I suppose if OpenVPN works and Wireguard doesn't it may be something in the way the network handles UDP packets vs TCP packets?

**Comment by TinCanTech** [comment]
It would be ineresting to see the routing table of the MAC once connected to the VPN.

**Comment by jimprince** [comment]
Ok, here's what I've got:

[routingTablesCellVPN.txt](https://github.com/pivpn/pivpn/files/5977210/routingTablesCellVPN.txt)
[routingTablesWiFiVPN.txt](https://github.com/pivpn/pivpn/files/5977211/routingTablesWiFiVPN.txt)
[routingTablesCellNoVPN.txt](https://github.com/pivpn/pivpn/files/5977212/routingTablesCellNoVPN.txt)
[routingTablesWiFiNoVPN.txt](https://github.com/pivpn/pivpn/files/5977213/routingTablesWiFiNoVPN.txt)

I've stared at them for a couple hours now and understand a whole lot more about routes, but unfortunately even fumbling adding a direct entry to my piVPN (10.6.0.1  `route add -net 10.6.0.1 -link 19 -interface utun4`) or randomly deleting some of the en0 entries I couldn't get things to work. 

The tables with VPN in the name are those where wireguard is connected. CellVPN is a functioning VPN connection, WiFiVPN is the connection that I would like to work, but doesn't. For reference I've included the baseline routing tables without using VPN for both Cell and Wifi.

**Comment by jeffrysurya** [comment]
hi, can you give screenshot of ip addr ? last time i have problem like this, then i see that dhcpd is also on when up the wireguard by wg-quick. this because dhcp also use 10.6.0.1/8 on wg0 to enable dhcp feature. i also install pivpn on server.

**Comment by jorgemieec** [comment]
I was setting up PiVPN today and had the exact same problem. It was connected, but no internet available. When I ran the script, I noticed there were some errors related with iptables, maybe it's related to that?

**Comment by orazioedoardo** [comment]
@jimprince WiFiVPN ha no default route through en0 as CellVPN. What if you try to remove `::0/0` from the client config? (This may cause an IPv6 leak if your work network supports IPv6).

**Comment by jorgemieec** [comment]
@jimprince I ran _pivpn -d_ and it confirmed my suspicions. It was a problem with iptables, and it prompted me to fix those rules. It's working now.

**Comment by jimprince** [comment]
> @jimprince WiFiVPN ha no default route through en0 as CellVPN. What if you try to remove `::0/0` from the client config? (This may cause an IPv6 leak if your work network supports IPv6).

Interesting thought, I had only looked at the `Internet` tables and didn't realize that default route was missing in `Internet6`. To me it seems like the line `default            10.213.128.1       UGScI          en0` plays the role of default gateway for IPv4 requests, and that is present in both the "VPN" and "NoVPN" wifi routing tables. It does appear that a default gateway is missing in both the "WifiNoVPN" and "WiFiVPN" routing tables, and the "VPN" table is able to connect to the internet no problem. I would have thought that Wireguard would have used a functioning IPv4 connection if available, but I'm still new at this so I'm probably missing something.

Removing ::0/0 presumably disables Wireguard from using IPv6? AFAIK, the work network only used IPv4 and looking at the WiFiNoVPN table seems to confirm that. 

I should be able to give this a shot tomorrow, I'll let you know.


> I was setting up PiVPN today and had the exact same problem. It was connected, but no internet available. When I ran the script, I noticed there were some errors about iptables, maybe it's related to that?

I think my problem may be a bit different as my setup had no errors and on a different network my VPN works just fine, indicating a successful install of piVPN.

**Comment by TinCanTech** [comment]
@jimprince  The issue is clearly routing and yours is a mess. I am not debugging that.

**Comment by jimprince** [comment]
> @jimprince The issue is clearly routing and yours is a mess. I am not debugging that.

In the immortal words of toddlers everywhere, "It wasn't me" 😇

**Comment by TinCanTech** [comment]
If not you then who ?  That would be the guy to ask ..

**Comment by TinCanTech** [comment]
Normally, I would refrain from this sort of banter but today feels like a good day to _soap box_.

My personal impression is that you have not been entirely honest about your setup.
This could simply be that you are not aware of the tricks being played upon you ..
But I think you know what I mean .. you are not a fool.

So, you can either come clean and spill the beans .. 
Or, these guys here just might side with me on this one.

If there were really a problem of the nature of which you speak, regarding either WireGuard or OpenVPN, I can tell you this for sure, **I would know**.

**Comment by TinCanTech** [comment]
Mad ravings of a lunatic:

PiVPN could chose something more custom than 10.8/24

Eg: 10.205.79.0/24

**Comment by 4s3ti** [comment]
> PiVPN could chose something more custom than 10.8/24
> Eg: 10.205.79.0/24

TL;DR but don't see a reason why not .. just avoids weird conflicts.

**Comment by jimprince** [comment]
> If not you then who ? That would be the guy to ask ..

1. I didn't know MacOS had a routing table until it was brought up here so I definitely hadn't made any manual changes to it. 
2. The routing table also resets itself every time I connect/disconnect from a wifi network so even if I want to, I don't have much control over it.

> Is it Pihole ?

No, not a PiHole

> My personal impression is that you have not been entirely honest about your setup.
> This could simply be that you are not aware of the tricks being played upon you ..
> But I think you know what I mean .. you are not a fool.

> Sorry, I don't mean to sound impolite

Totally fair, and no offense taken (moreover I'm super grateful for your help!). The only thing I can think of that I haven't shared is that I work at a province wide hospital network as clinical staff. The organization has a dedicated IT department with a network that spans across the province connecting all the sites together. I typically connect via WiFi using an authentication mechanism that I don't understand (no passphrase, I use my corporate credentials). There is a VPN solution to connect from home using forticlient which allows for RDP and citrix access to the corporate network. My occasional interactions with IT have only ever been with product support staff and they naturally are able to support the products but have very little familiarity with the underlying infrastructure. I assumed the network used IPv4 but I neither know whether use of IPv6 on the network is important nor what tests would be important.

As far as the routing tables go, the only thing I can figure out is that once connected to the wifi it gets shoved full of references to every other machine on the subnet, and someone decided to make the subnets huge. I've spent hours trying to understand how routing tables work, I have flushed the routing table dozens of times, tried adding routes and removing routes and it makes no difference, the table is always huge when connected to the work network and I'm not able to get my packets moving. After I finish my experiments I disconnect and reconnect and the table is back to however it was before.

In terms of setup I don't think my Mac has anything that would make a difference. I use a vanilla install of OSX Big Sur with  the wireguard client for Mac version App version: 1.0.12 (22) Go backend version: 0.0.20201119. I use an adblocker in chrome but my understanding was that those work at the application level. Citrix is open occasionally, and Viscoscity is still installed from when i was using OpenVPN.

> WiFiVPN ha no default route through en0 as CellVPN. What if you try to remove `::0/0` from the client config? (This may cause an IPv6 leak if your work network supports IPv6).

I did try this, and it didn't change things. Still unable to connect to internet and can't ping 10.6.0.1. Was worth a shot.

> hi, can you give screenshot of ip addr ? last time i have problem like this, then i see that dhcpd is also on when up the wireguard by wg-quick. this because dhcp also use 10.6.0.1/8 on wg0 to enable dhcp feature. i also install pivpn on server.

Sure thing, I'm back at work tomorrow.


It has dawned on me that if this is a routing table problem I'm not going to be able to fix that on my phone in order to connect. I've reinstalled PiVPN tonight with OpenVPN and will give that a shot tomorrow. OpenVPN was previously working when I had it setup on my openWRT router so that hopefully will get things going again. I'll post back with how it goes.

**Comment by TinCanTech** [comment]
Good answer!  This is clearly more complicated than I expected.

Is it possible you can take your MAC to a completely new network and try ?

**Comment by TinCanTech** [comment]
> I typically connect via WiFi using an authentication mechanism that I don't understand (no passphrase, I use my **corporate credentials**).

My impression is that this WiFi is intentionally more secure than your average network.

**Comment by jimprince** [comment]
An interesting twist happened in that OpenVPN is able to connect just fine from the work network. I'm able to access my SMB shares remotely. Yay!

If there is value to the community in continuing to troubleshoot what was going on with wireguard, I'm happy to test a few more things. All else being equal though, I have a functional solution so am happy to close the issue. 
Cheers.

**Comment by eabase** [comment]
I was looking at the routing tables... :facepalm:   
Why can't you try with the simplest possible one?

**Comment by TinCanTech** [comment]
If you are still interested in finding out why wireguard does not wotk then there is a couple of things you can try.  First, I need to establish a base line though, so a couple of yes/no (leave blank for no):

- [ ] Does wireguard successfully "connect" ? - If you don't know leave blank.
- [ ] Can you `ping` the remote endpoint, which I presume is `10.6.0.x`
- [ ] Can you `ping` any address you know to be on the remote end, eg. your LAN router.

**Comment by TinCanTech** [comment]
@jimprince :gun: _Do ya feel lucky .. punk_ ? :rofl:

**Comment by TinCanTech** [comment]
The only logical conclusion I can come to is that **no answer** is equivalent to `No[Blank], No and No`

My only guess would be that OpenVPN port is not blocked but WG port is blocked, by your network host.

For me, this one is closed.

**Comment by mikemand** [comment]
I'm sorry to necro this issue after 6 months, but I have a very similar problem (without the complicated network setup).

- [x] Does wireguard successfully "connect" ? - If you don't know leave blank.
Yes, and I can see packets going back and forth on `tcpdump`
- [x] Can you ping the remote endpoint? Which I presume is 10.6.0.x
Yes, the endpoint pivpn generated was `10.6.0.1`
- [x] Can you ping any address you know to be on the remote end, eg. your LAN router?
Yes, I am able to ping devices on the network after connecting via Wireguard. I am not able to *access* any of those devices, however.

I have a brand new RaspberryPi 4 that is only running pivpn. No PiHole, nothing extra.

Here are my debug outputs:

<details>
<summary>pivpn debug</summary>

```
::::		PiVPN debug		 ::::
=============================================
::::		Latest commit		 ::::
Branch: master
Commit: 50798ccd42ef7a2b67f14b801b84f425805a40ed
Author: Orazio
Date: Wed Sep 15 17:52:17 2021 +0200
Summary: Important change to custom MTU handling (mainly to fix issue #1357)
=============================================
::::	    Installation settings    	 ::::
PLAT=Raspbian
OSCN=buster
USING_UFW=0
IPv4dev=eth0
dhcpReserv=1
IPv4addr=192.168.1.254/24
IPv4gw=192.168.1.1
install_user=micheal
install_home=/home/micheal
VPN=wireguard
pivpnPORT=57100
pivpnDNS1=192.168.1.1
pivpnDNS2=8.8.8.8
pivpnDNS3=1.1.1.1
pivpnHOST=REDACTED
INPUT_CHAIN_EDITED=0
FORWARD_CHAIN_EDITED=0
pivpnPROTO=udp
pivpnMTU=1400
pivpnDEV=wg0
pivpnNET=10.6.0.0
subnetClass=24
AllowedIPs=0.0.0.0/0, ::0/0
UNATTUPG=1
INSTALLED_PACKAGES=(dnsutils iptables-persistent wireguard-tools qrencode unattended-upgrades)
=============================================
::::  Server configuration shown below   ::::
[Interface]
PrivateKey = server_priv
Address = 10.6.0.1/24
MTU = 1420
ListenPort = 57100
### begin micheal-laptop ###
[Peer]
PublicKey = micheal-laptop_pub
PresharedKey = micheal-laptop_psk
AllowedIPs = 10.6.0.2/32
### end micheal-laptop ###
### begin micheal ###
[Peer]
PublicKey = micheal_pub
PresharedKey = micheal_psk
AllowedIPs = 10.6.0.3/32
### end micheal ###
=============================================
::::  Client configuration shown below   ::::
[Interface]
PrivateKey = micheal-laptop_priv
Address = 10.6.0.2/24
DNS = 8.8.8.8, 1.1.1.1

[Peer]
PublicKey = server_pub
PresharedKey = micheal-laptop_psk
Endpoint = REDACTED:57100
AllowedIPs = 0.0.0.0/0, ::0/0
=============================================
:::: 	Recursive list of files in	 ::::
::::m/etc/wireguard shown below	 ::::
/etc/wireguard:
configs
keys
wg0.conf

/etc/wireguard/configs:
clients.txt
micheal.conf
micheal-laptop.conf

/etc/wireguard/keys:
micheal-laptop_priv
micheal-laptop_psk
micheal-laptop_pub
micheal_priv
micheal_psk
micheal_pub
server_priv
server_pub
=============================================
::::		Self check		 ::::
:: [OK] IP forwarding is enabled
:: [OK] Iptables MASQUERADE rule set
:: [OK] WireGuard is running
:: [OK] WireGuard is enabled (it will automatically start on reboot)
:: [OK] WireGuard is listening on port 57100/udp
=============================================
:::: Having trouble connecting? Take a look at the FAQ:
:::: https://docs.pivpn.io/faq
=============================================
:::: WARNING: This script should have automatically masked sensitive       ::::
:::: information, however, still make sure that PrivateKey, PublicKey      ::::
:::: and PresharedKey are masked before reporting an issue. An example key ::::
:::: that you should NOT see in this log looks like this:                  ::::
:::: YIAoJVsdIeyvXfGGDDadHh6AxsMRymZTnnzZoAb9cxRe                          ::::
=============================================
::::		Debug complete		 ::::
```

</details>

<details>
<summary>lsmod | grep wireguard</summary>

```
wireguard              69632  0
curve25519_neon        28672  1 wireguard
libcurve25519_generic    24576  2 curve25519_neon,wireguard
libchacha20poly1305    16384  1 wireguard
ip6_udp_tunnel         16384  1 wireguard
udp_tunnel             24576  1 wireguard
libblake2s             16384  1 wireguard
ipv6                  495616  69 wireguard
```

</details>

<details>
<summary>cat /etc/pivpn/wireguard/setupVars.conf</summary>

```
PLAT=Raspbian
OSCN=buster
USING_UFW=0
IPv4dev=eth0
dhcpReserv=1
IPv4addr=192.168.1.254/24
IPv4gw=192.168.1.1
install_user=micheal
install_home=/home/micheal
VPN=wireguard
pivpnPORT=57100
pivpnDNS1=192.168.1.1
pivpnDNS2=8.8.8.8
pivpnHOST=redacted
INPUT_CHAIN_EDITED=0
FORWARD_CHAIN_EDITED=0
pivpnPROTO=udp
pivpnMTU=1420
pivpnDEV=wg0
pivpnNET=10.6.0.0
subnetClass=24
AllowedIPs=0.0.0.0/0, ::0/0
UNATTUPG=1
INSTALLED_PACKAGES=(dnsutils iptables-persistent wireguard-tools qrencode unattended-upgrades)
```

</details>

<details>
<summary>ip -f inet address show eth0</summary>

```
2: eth0: <BROADCAST,MULTICAST,UP,LOWER_UP> mtu 1500 qdisc mq state UP group default qlen 1000
    inet 192.168.1.254/24 brd 192.168.1.255 scope global dynamic noprefixroute eth0
       valid_lft 85473sec preferred_lft 74673sec
```

</details>

My DDNS domain has the same IP address as my public IP address

<details>
<summary>sudo tcpdump -n -i eth0 udp port 57100</summary>

```
tcpdump: verbose output suppressed, use -v or -vv for full protocol decode
listening on eth0, link-type EN10MB (Ethernet), capture size 262144 bytes
14:09:58.303616 IP 174.198.132.181.1361 > 192.168.1.254.57100: UDP, length 148
14:09:58.306714 IP 192.168.1.254.57100 > 174.198.132.181.1361: UDP, length 92
14:09:58.368701 IP 174.198.132.181.1361 > 192.168.1.254.57100: UDP, length 112
14:09:58.486192 IP 174.198.132.181.1361 > 192.168.1.254.57100: UDP, length 240
14:09:58.488652 IP 174.198.132.181.1361 > 192.168.1.254.57100: UDP, length 96
14:09:58.641051 IP 174.198.132.181.1361 > 192.168.1.254.57100: UDP, length 96
14:09:58.641161 IP 174.198.132.181.1361 > 192.168.1.254.57100: UDP, length 112
14:09:58.641169 IP 174.198.132.181.1361 > 192.168.1.254.57100: UDP, length 96
14:09:58.641325 IP 174.198.132.181.1361 > 192.168.1.254.57100: UDP, length 32
14:09:58.641333 IP 174.198.132.181.1361 > 192.168.1.254.57100: UDP, length 96
14:09:58.641339 IP 174.198.132.181.1361 > 192.168.1.254.57100: UDP, length 96
14:09:58.641343 IP 174.198.132.181.1361 > 192.168.1.254.57100: UDP, length 96
14:09:58.653669 IP 174.198.132.181.1361 > 192.168.1.254.57100: UDP, length 112
14:09:58.653754 IP 174.198.132.181.1361 > 192.168.1.254.57100: UDP, length 112
14:09:58.653763 IP 174.198.132.181.1361 > 192.168.1.254.57100: UDP, length 112
14:09:58.978666 IP 174.198.132.181.1361 > 192.168.1.254.57100: UDP, length 96
14:09:58.983652 IP 174.198.132.181.1361 > 192.168.1.254.57100: UDP, length 96
14:09:58.983717 IP 174.198.132.181.1361 > 192.168.1.254.57100: UDP, length 96
14:09:59.083599 IP 174.198.132.181.1361 > 192.168.1.254.57100: UDP, length 128
14:09:59.088679 IP 174.198.132.181.1361 > 192.168.1.254.57100: UDP, length 128
14:09:59.088751 IP 174.198.132.181.1361 > 192.168.1.254.57100: UDP, length 128
14:09:59.088756 IP 174.198.132.181.1361 > 192.168.1.254.57100: UDP, length 128
14:09:59.088885 IP 174.198.132.181.1361 > 192.168.1.254.57100: UDP, length 128
14:09:59.088891 IP 174.198.132.181.1361 > 192.168.1.254.57100: UDP, length 128
14:09:59.088896 IP 174.198.132.181.1361 > 192.168.1.254.57100: UDP, length 112
14:09:59.113552 IP 174.198.132.181.1361 > 192.168.1.254.57100: UDP, length 240
14:09:59.341105 IP 174.198.132.181.1361 > 192.168.1.254.57100: UDP, length 112
14:09:59.536112 IP 174.198.132.181.1361 > 192.168.1.254.57100: UDP, length 96
14:09:59.646038 IP 174.198.132.181.1361 > 192.168.1.254.57100: UDP, length 96
14:09:59.646046 IP 174.198.132.181.1361 > 192.168.1.254.57100: UDP, length 112
14:09:59.646129 IP 174.198.132.181.1361 > 192.168.1.254.57100: UDP, length 96
14:09:59.646161 IP 174.198.132.181.1361 > 192.168.1.254.57100: UDP, length 96
14:09:59.646163 IP 174.198.132.181.1361 > 192.168.1.254.57100: UDP, length 96
14:09:59.646198 IP 174.198.132.181.1361 > 192.168.1.254.57100: UDP, length 96
14:09:59.646201 IP 174.198.132.181.1361 > 192.168.1.254.57100: UDP, length 96
14:09:59.648582 IP 174.198.132.181.1361 > 192.168.1.254.57100: UDP, length 112
14:09:59.648587 IP 174.198.132.181.1361 > 192.168.1.254.57100: UDP, length 112
14:09:59.650999 IP 174.198.132.181.1361 > 192.168.1.254.57100: UDP, length 112
14:10:00.023598 IP 174.198.132.181.1361 > 192.168.1.254.57100: UDP, length 96
14:10:00.023700 IP 174.198.132.181.1361 > 192.168.1.254.57100: UDP, length 96
14:10:00.023709 IP 174.198.132.181.1361 > 192.168.1.254.57100: UDP, length 96
14:10:00.126102 IP 174.198.132.181.1361 > 192.168.1.254.57100: UDP, length 240
14:10:00.141116 IP 174.198.132.181.1361 > 192.168.1.254.57100: UDP, length 96
14:10:00.141250 IP 174.198.132.181.1361 > 192.168.1.254.57100: UDP, length 96
14:10:00.141256 IP 174.198.132.181.1361 > 192.168.1.254.57100: UDP, length 96
14:10:01.121138 IP 174.198.132.181.1361 > 192.168.1.254.57100: UDP, length 128
14:10:01.121263 IP 174.198.132.181.1361 > 192.168.1.254.57100: UDP, length 128
14:10:01.123621 IP 174.198.132.181.1361 > 192.168.1.254.57100: UDP, length 128
14:10:01.123634 IP 174.198.132.181.1361 > 192.168.1.254.57100: UDP, length 128
14:10:01.126104 IP 174.198.132.181.1361 > 192.168.1.254.57100: UDP, length 128
14:10:01.128664 IP 174.198.132.181.1361 > 192.168.1.254.57100: UDP, length 128
14:10:01.128722 IP 174.198.132.181.1361 > 192.168.1.254.57100: UDP, length 112
14:10:01.133681 IP 174.198.132.181.1361 > 192.168.1.254.57100: UDP, length 240
14:10:01.133769 IP 174.198.132.181.1361 > 192.168.1.254.57100: UDP, length 96
14:10:01.133775 IP 174.198.132.181.1361 > 192.168.1.254.57100: UDP, length 96
14:10:01.133779 IP 174.198.132.181.1361 > 192.168.1.254.57100: UDP, length 96
14:10:01.348606 IP 174.198.132.181.1361 > 192.168.1.254.57100: UDP, length 112
14:10:01.538603 IP 174.198.132.181.1361 > 192.168.1.254.57100: UDP, length 96
14:10:01.751041 IP 174.198.132.181.1361 > 192.168.1.254.57100: UDP, length 96
14:10:01.756071 IP 174.198.132.181.1361 > 192.168.1.254.57100: UDP, length 112
14:10:01.756148 IP 174.198.132.181.1361 > 192.168.1.254.57100: UDP, length 96
14:10:01.756155 IP 174.198.132.181.1361 > 192.168.1.254.57100: UDP, length 96
14:10:01.758547 IP 174.198.132.181.1361 > 192.168.1.254.57100: UDP, length 96
14:10:01.761018 IP 174.198.132.181.1361 > 192.168.1.254.57100: UDP, length 96
14:10:01.763570 IP 174.198.132.181.1361 > 192.168.1.254.57100: UDP, length 96
14:10:01.763653 IP 174.198.132.181.1361 > 192.168.1.254.57100: UDP, length 112
14:10:01.776185 IP 174.198.132.181.1361 > 192.168.1.254.57100: UDP, length 112
14:10:01.783587 IP 174.198.132.181.1361 > 192.168.1.254.57100: UDP, length 112
14:10:02.074441 IP 174.198.132.181.1361 > 192.168.1.254.57100: UDP, length 96
14:10:02.091533 IP 174.198.132.181.1361 > 192.168.1.254.57100: UDP, length 96
14:10:02.098593 IP 174.198.132.181.1361 > 192.168.1.254.57100: UDP, length 96
14:10:02.111077 IP 174.198.132.181.1361 > 192.168.1.254.57100: UDP, length 240
14:10:02.148634 IP 174.198.132.181.1361 > 192.168.1.254.57100: UDP, length 128
14:10:02.151080 IP 174.198.132.181.1361 > 192.168.1.254.57100: UDP, length 128
14:10:02.153601 IP 174.198.132.181.1361 > 192.168.1.254.57100: UDP, length 128
14:10:02.156011 IP 174.198.132.181.1361 > 192.168.1.254.57100: UDP, length 128
14:10:02.166010 IP 174.198.132.181.1361 > 192.168.1.254.57100: UDP, length 128
14:10:02.168656 IP 174.198.132.181.1361 > 192.168.1.254.57100: UDP, length 128
14:10:02.171056 IP 174.198.132.181.1361 > 192.168.1.254.57100: UDP, length 112
14:10:02.418567 IP 174.198.132.181.1361 > 192.168.1.254.57100: UDP, length 112
14:10:02.551059 IP 174.198.132.181.1361 > 192.168.1.254.57100: UDP, length 96
14:10:02.738559 IP 174.198.132.181.1361 > 192.168.1.254.57100: UDP, length 96
14:10:02.746052 IP 174.198.132.181.1361 > 192.168.1.254.57100: UDP, length 112
14:10:02.751047 IP 174.198.132.181.1361 > 192.168.1.254.57100: UDP, length 96
14:10:02.754240 IP 174.198.132.181.1361 > 192.168.1.254.57100: UDP, length 96
14:10:02.756318 IP 174.198.132.181.1361 > 192.168.1.254.57100: UDP, length 96
14:10:02.759383 IP 174.198.132.181.1361 > 192.168.1.254.57100: UDP, length 96
14:10:02.761492 IP 174.198.132.181.1361 > 192.168.1.254.57100: UDP, length 96
14:10:02.771224 IP 174.198.132.181.1361 > 192.168.1.254.57100: UDP, length 112
14:10:02.773612 IP 174.198.132.181.1361 > 192.168.1.254.57100: UDP, length 112
14:10:02.781062 IP 174.198.132.181.1361 > 192.168.1.254.57100: UDP, length 112
14:10:03.108601 IP 174.198.132.181.1361 > 192.168.1.254.57100: UDP, length 96
14:10:03.113632 IP 174.198.132.181.1361 > 192.168.1.254.57100: UDP, length 96
14:10:03.116039 IP 174.198.132.181.1361 > 192.168.1.254.57100: UDP, length 96
14:10:03.209198 IP 174.198.132.181.1361 > 192.168.1.254.57100: UDP, length 96
14:10:03.212007 IP 174.198.132.181.1361 > 192.168.1.254.57100: UDP, length 96
14:10:03.221031 IP 174.198.132.181.1361 > 192.168.1.254.57100: UDP, length 96
14:10:04.216084 IP 174.198.132.181.1361 > 192.168.1.254.57100: UDP, length 128
14:10:04.228547 IP 174.198.132.181.1361 > 192.168.1.254.57100: UDP, length 128
14:10:04.231074 IP 174.198.132.181.1361 > 192.168.1.254.57100: UDP, length 128
14:10:04.231104 IP 174.198.132.181.1361 > 192.168.1.254.57100: UDP, length 128
14:10:04.238565 IP 174.198.132.181.1361 > 192.168.1.254.57100: UDP, length 128
14:10:04.246082 IP 174.198.132.181.1361 > 192.168.1.254.57100: UDP, length 128
14:10:04.248637 IP 174.198.132.181.1361 > 192.168.1.254.57100: UDP, length 112
14:10:04.261060 IP 174.198.132.181.1361 > 192.168.1.254.57100: UDP, length 96
14:10:04.266105 IP 174.198.132.181.1361 > 192.168.1.254.57100: UDP, length 96
14:10:04.268571 IP 174.198.132.181.1361 > 192.168.1.254.57100: UDP, length 96
14:10:04.498530 IP 174.198.132.181.1361 > 192.168.1.254.57100: UDP, length 112
14:10:04.651003 IP 174.198.132.181.1361 > 192.168.1.254.57100: UDP, length 96
14:10:04.791144 IP 174.198.132.181.1361 > 192.168.1.254.57100: UDP, length 96
14:10:04.796110 IP 174.198.132.181.1361 > 192.168.1.254.57100: UDP, length 112
14:10:04.796204 IP 174.198.132.181.1361 > 192.168.1.254.57100: UDP, length 96
14:10:04.798557 IP 174.198.132.181.1361 > 192.168.1.254.57100: UDP, length 96
14:10:04.811064 IP 174.198.132.181.1361 > 192.168.1.254.57100: UDP, length 96
14:10:04.813621 IP 174.198.132.181.1361 > 192.168.1.254.57100: UDP, length 96
14:10:04.813636 IP 174.198.132.181.1361 > 192.168.1.254.57100: UDP, length 96
14:10:04.816065 IP 174.198.132.181.1361 > 192.168.1.254.57100: UDP, length 112
14:10:04.821087 IP 174.198.132.181.1361 > 192.168.1.254.57100: UDP, length 112
14:10:04.821209 IP 174.198.132.181.1361 > 192.168.1.254.57100: UDP, length 112
14:10:04.943584 IP 174.198.132.181.1361 > 192.168.1.254.57100: UDP, length 96
14:10:05.131039 IP 174.198.132.181.1361 > 192.168.1.254.57100: UDP, length 96
14:10:05.133540 IP 174.198.132.181.1361 > 192.168.1.254.57100: UDP, length 96
14:10:05.136079 IP 174.198.132.181.1361 > 192.168.1.254.57100: UDP, length 96
14:10:05.191155 IP 174.198.132.181.1361 > 192.168.1.254.57100: UDP, length 96
14:10:05.951102 IP 174.198.132.181.1361 > 192.168.1.254.57100: UDP, length 96
14:10:06.198555 IP 174.198.132.181.1361 > 192.168.1.254.57100: UDP, length 96
14:10:06.341112 IP 174.198.132.181.1361 > 192.168.1.254.57100: UDP, length 96
14:10:06.351250 IP 174.198.132.181.1361 > 192.168.1.254.57100: UDP, length 96
14:10:06.351266 IP 174.198.132.181.1361 > 192.168.1.254.57100: UDP, length 96
14:10:06.959236 IP 174.198.132.181.1361 > 192.168.1.254.57100: UDP, length 96
14:10:07.198602 IP 174.198.132.181.1361 > 192.168.1.254.57100: UDP, length 96
14:10:07.409155 IP 174.198.132.181.1361 > 192.168.1.254.57100: UDP, length 112
14:10:07.409462 IP 174.198.132.181.1361 > 192.168.1.254.57100: UDP, length 96
14:10:07.958694 IP 174.198.132.181.1361 > 192.168.1.254.57100: UDP, length 96
14:10:08.219701 IP 174.198.132.181.1361 > 192.168.1.254.57100: UDP, length 96
14:10:08.366034 IP 174.198.132.181.1361 > 192.168.1.254.57100: UDP, length 128
14:10:08.368566 IP 174.198.132.181.1361 > 192.168.1.254.57100: UDP, length 128
14:10:08.371003 IP 174.198.132.181.1361 > 192.168.1.254.57100: UDP, length 128
14:10:08.373528 IP 174.198.132.181.1361 > 192.168.1.254.57100: UDP, length 128
14:10:08.381109 IP 174.198.132.181.1361 > 192.168.1.254.57100: UDP, length 128
14:10:08.388645 IP 174.198.132.181.1361 > 192.168.1.254.57100: UDP, length 128
14:10:08.388664 IP 174.198.132.181.1361 > 192.168.1.254.57100: UDP, length 112
14:10:08.446181 IP 174.198.132.181.1361 > 192.168.1.254.57100: UDP, length 112
14:10:08.456068 IP 174.198.132.181.1361 > 192.168.1.254.57100: UDP, length 96
14:10:08.483613 IP 192.168.1.254.57100 > 174.198.132.181.1361: UDP, length 32
14:10:08.588598 IP 174.198.132.181.1361 > 192.168.1.254.57100: UDP, length 96
14:10:08.648646 IP 174.198.132.181.1361 > 192.168.1.254.57100: UDP, length 112
14:10:08.822157 IP 174.198.132.181.1361 > 192.168.1.254.57100: UDP, length 96
14:10:08.822423 IP 174.198.132.181.1361 > 192.168.1.254.57100: UDP, length 96
14:10:08.836164 IP 174.198.132.181.1361 > 192.168.1.254.57100: UDP, length 112
14:10:08.836187 IP 174.198.132.181.1361 > 192.168.1.254.57100: UDP, length 96
14:10:08.836364 IP 174.198.132.181.1361 > 192.168.1.254.57100: UDP, length 96
14:10:08.836375 IP 174.198.132.181.1361 > 192.168.1.254.57100: UDP, length 96
14:10:08.836382 IP 174.198.132.181.1361 > 192.168.1.254.57100: UDP, length 96
14:10:08.838606 IP 174.198.132.181.1361 > 192.168.1.254.57100: UDP, length 96
14:10:08.838632 IP 174.198.132.181.1361 > 192.168.1.254.57100: UDP, length 112
14:10:08.838827 IP 174.198.132.181.1361 > 192.168.1.254.57100: UDP, length 112
14:10:08.838836 IP 174.198.132.181.1361 > 192.168.1.254.57100: UDP, length 112
14:10:08.838843 IP 174.198.132.181.1361 > 192.168.1.254.57100: UDP, length 112
14:10:08.838850 IP 174.198.132.181.1361 > 192.168.1.254.57100: UDP, length 112
14:10:08.968658 IP 174.198.132.181.1361 > 192.168.1.254.57100: UDP, length 96
14:10:09.226062 IP 174.198.132.181.1361 > 192.168.1.254.57100: UDP, length 96
14:10:09.898635 IP 174.198.132.181.1361 > 192.168.1.254.57100: UDP, length 112
14:10:09.898813 IP 174.198.132.181.1361 > 192.168.1.254.57100: UDP, length 112
14:10:09.968684 IP 174.198.132.181.1361 > 192.168.1.254.57100: UDP, length 96
14:10:10.221083 IP 174.198.132.181.1361 > 192.168.1.254.57100: UDP, length 96
14:10:10.468654 IP 174.198.132.181.1361 > 192.168.1.254.57100: UDP, length 112
14:10:10.468670 IP 174.198.132.181.1361 > 192.168.1.254.57100: UDP, length 96
14:10:10.631167 IP 174.198.132.181.1361 > 192.168.1.254.57100: UDP, length 96
14:10:11.508614 IP 174.198.132.181.1361 > 192.168.1.254.57100: UDP, length 112
14:10:11.508645 IP 174.198.132.181.1361 > 192.168.1.254.57100: UDP, length 96
14:10:11.988683 IP 174.198.132.181.1361 > 192.168.1.254.57100: UDP, length 112
14:10:12.006168 IP 174.198.132.181.1361 > 192.168.1.254.57100: UDP, length 112
14:10:12.006200 IP 174.198.132.181.1361 > 192.168.1.254.57100: UDP, length 96
14:10:12.238621 IP 174.198.132.181.1361 > 192.168.1.254.57100: UDP, length 96
14:10:13.036265 IP 174.198.132.181.1361 > 192.168.1.254.57100: UDP, length 112
14:10:13.036292 IP 174.198.132.181.1361 > 192.168.1.254.57100: UDP, length 112
14:10:13.571183 IP 174.198.132.181.1361 > 192.168.1.254.57100: UDP, length 112
14:10:13.571454 IP 174.198.132.181.1361 > 192.168.1.254.57100: UDP, length 96
14:10:14.658612 IP 174.198.132.181.1361 > 192.168.1.254.57100: UDP, length 96
14:10:15.111110 IP 174.198.132.181.1361 > 192.168.1.254.57100: UDP, length 112
14:10:15.123617 IP 174.198.132.181.1361 > 192.168.1.254.57100: UDP, length 112
14:10:15.998585 IP 174.198.132.181.1361 > 192.168.1.254.57100: UDP, length 96
14:10:16.258592 IP 174.198.132.181.1361 > 192.168.1.254.57100: UDP, length 96
14:10:16.366192 IP 174.198.132.181.1361 > 192.168.1.254.57100: UDP, length 128
14:10:16.371153 IP 174.198.132.181.1361 > 192.168.1.254.57100: UDP, length 128
14:10:16.373614 IP 174.198.132.181.1361 > 192.168.1.254.57100: UDP, length 128
14:10:16.376095 IP 174.198.132.181.1361 > 192.168.1.254.57100: UDP, length 128
14:10:16.383683 IP 174.198.132.181.1361 > 192.168.1.254.57100: UDP, length 128
14:10:16.383702 IP 174.198.132.181.1361 > 192.168.1.254.57100: UDP, length 128
14:10:16.386098 IP 174.198.132.181.1361 > 192.168.1.254.57100: UDP, length 112
14:10:16.738603 IP 174.198.132.181.1361 > 192.168.1.254.57100: UDP, length 112
14:10:17.206123 IP 174.198.132.181.1361 > 192.168.1.254.57100: UDP, length 96
14:10:17.216135 IP 174.198.132.181.1361 > 192.168.1.254.57100: UDP, length 96
14:10:17.216154 IP 174.198.132.181.1361 > 192.168.1.254.57100: UDP, length 112
14:10:17.221118 IP 174.198.132.181.1361 > 192.168.1.254.57100: UDP, length 96
14:10:17.221144 IP 174.198.132.181.1361 > 192.168.1.254.57100: UDP, length 96
14:10:17.221298 IP 174.198.132.181.1361 > 192.168.1.254.57100: UDP, length 96
14:10:17.226147 IP 174.198.132.181.1361 > 192.168.1.254.57100: UDP, length 96
14:10:17.226177 IP 174.198.132.181.1361 > 192.168.1.254.57100: UDP, length 96
14:10:17.226442 IP 174.198.132.181.1361 > 192.168.1.254.57100: UDP, length 112
14:10:17.233611 IP 174.198.132.181.1361 > 192.168.1.254.57100: UDP, length 112
14:10:17.241153 IP 174.198.132.181.1361 > 192.168.1.254.57100: UDP, length 112
14:10:17.728708 IP 174.198.132.181.1361 > 192.168.1.254.57100: UDP, length 112
14:10:17.733626 IP 174.198.132.181.1361 > 192.168.1.254.57100: UDP, length 96
14:10:18.713679 IP 192.168.1.254.57100 > 174.198.132.181.1361: UDP, length 32
14:10:19.198602 IP 174.198.132.181.1361 > 192.168.1.254.57100: UDP, length 112
14:10:19.211083 IP 174.198.132.181.1361 > 192.168.1.254.57100: UDP, length 112
^C
208 packets captured
209 packets received by filter
1 packet dropped by kernel
```

</details>

I did have `ufw` installed after I installed pivpn, but later uninstalled it since pivpn uses `iptables` instead. My `iptables` are full of ufw stuff that I don't know how to get rid of. Maybe this is why nothing is working correctly?

<details>
<summary>sudo iptables -S</summary>

```
-P INPUT DROP
-P FORWARD DROP
-P OUTPUT ACCEPT
-N f2b-sshd
-N ufw-before-logging-input
-N ufw-before-logging-output
-N ufw-before-logging-forward
-N ufw-before-input
-N ufw-before-output
-N ufw-before-forward
-N ufw-after-input
-N ufw-after-output
-N ufw-after-forward
-N ufw-after-logging-input
-N ufw-after-logging-output
-N ufw-after-logging-forward
-N ufw-reject-input
-N ufw-reject-output
-N ufw-reject-forward
-N ufw-track-input
-N ufw-track-output
-N ufw-track-forward
-N ufw-logging-deny
-N ufw-logging-allow
-N ufw-skip-to-policy-input
-N ufw-skip-to-policy-output
-N ufw-skip-to-policy-forward
-N ufw-not-local
-N ufw-user-input
-N ufw-user-output
-N ufw-user-forward
-N ufw-user-logging-input
-N ufw-user-logging-output
-N ufw-user-logging-forward
-N ufw-user-limit
-N ufw-user-limit-accept
-A INPUT -p tcp -m multiport --dports 22 -j f2b-sshd
-A INPUT -i eth0 -p udp -m udp --dport 57100 -m comment --comment wireguard-input-rule -j ACCEPT
-A INPUT -p tcp -m multiport --dports 22 -j f2b-sshd
-A INPUT -j ufw-before-logging-input
-A INPUT -j ufw-before-input
-A INPUT -j ufw-after-input
-A INPUT -j ufw-after-logging-input
-A INPUT -j ufw-reject-input
-A INPUT -j ufw-track-input
-A FORWARD -j ufw-before-logging-forward
-A FORWARD -j ufw-before-forward
-A FORWARD -j ufw-after-forward
-A FORWARD -j ufw-after-logging-forward
-A FORWARD -j ufw-reject-forward
-A FORWARD -j ufw-track-forward
-A OUTPUT -j ufw-before-logging-output
-A OUTPUT -j ufw-before-output
-A OUTPUT -j ufw-after-output
-A OUTPUT -j ufw-after-logging-output
-A OUTPUT -j ufw-reject-output
-A OUTPUT -j ufw-track-output
-A f2b-sshd -s 104.244.74.29/32 -j REJECT --reject-with icmp-port-unreachable
-A f2b-sshd -j RETURN
-A f2b-sshd -j RETURN
-A ufw-before-input -i lo -j ACCEPT
-A ufw-before-input -m conntrack --ctstate RELATED,ESTABLISHED -j ACCEPT
-A ufw-before-input -m conntrack --ctstate INVALID -j ufw-logging-deny
-A ufw-before-input -m conntrack --ctstate INVALID -j DROP
-A ufw-before-input -p icmp -m icmp --icmp-type 3 -j ACCEPT
-A ufw-before-input -p icmp -m icmp --icmp-type 11 -j ACCEPT
-A ufw-before-input -p icmp -m icmp --icmp-type 12 -j ACCEPT
-A ufw-before-input -p icmp -m icmp --icmp-type 8 -j ACCEPT
-A ufw-before-input -p udp -m udp --sport 67 --dport 68 -j ACCEPT
-A ufw-before-input -j ufw-not-local
-A ufw-before-input -d 224.0.0.251/32 -p udp -m udp --dport 5353 -j ACCEPT
-A ufw-before-input -d 239.255.255.250/32 -p udp -m udp --dport 1900 -j ACCEPT
-A ufw-before-input -j ufw-user-input
-A ufw-before-output -o lo -j ACCEPT
-A ufw-before-output -m conntrack --ctstate RELATED,ESTABLISHED -j ACCEPT
-A ufw-before-output -j ufw-user-output
-A ufw-before-forward -m conntrack --ctstate RELATED,ESTABLISHED -j ACCEPT
-A ufw-before-forward -p icmp -m icmp --icmp-type 3 -j ACCEPT
-A ufw-before-forward -p icmp -m icmp --icmp-type 11 -j ACCEPT
-A ufw-before-forward -p icmp -m icmp --icmp-type 12 -j ACCEPT
-A ufw-before-forward -p icmp -m icmp --icmp-type 8 -j ACCEPT
-A ufw-before-forward -j ufw-user-forward
-A ufw-after-input -p udp -m udp --dport 137 -j ufw-skip-to-policy-input
-A ufw-after-input -p udp -m udp --dport 138 -j ufw-skip-to-policy-input
-A ufw-after-input -p tcp -m tcp --dport 139 -j ufw-skip-to-policy-input
-A ufw-after-input -p tcp -m tcp --dport 445 -j ufw-skip-to-policy-input
-A ufw-after-input -p udp -m udp --dport 67 -j ufw-skip-to-policy-input
-A ufw-after-input -p udp -m udp --dport 68 -j ufw-skip-to-policy-input
-A ufw-after-input -m addrtype --dst-type BROADCAST -j ufw-skip-to-policy-input
-A ufw-after-logging-input -m limit --limit 3/min --limit-burst 10 -j LOG --log-prefix "[UFW BLOCK] "
-A ufw-after-logging-forward -m limit --limit 3/min --limit-burst 10 -j LOG --log-prefix "[UFW BLOCK] "
-A ufw-track-output -p tcp -m conntrack --ctstate NEW -j ACCEPT
-A ufw-track-output -p udp -m conntrack --ctstate NEW -j ACCEPT
-A ufw-logging-deny -m conntrack --ctstate INVALID -m limit --limit 3/min --limit-burst 10 -j RETURN
-A ufw-logging-deny -m limit --limit 3/min --limit-burst 10 -j LOG --log-prefix "[UFW BLOCK] "
-A ufw-logging-allow -m limit --limit 3/min --limit-burst 10 -j LOG --log-prefix "[UFW ALLOW] "
-A ufw-skip-to-policy-input -j DROP
-A ufw-skip-to-policy-output -j ACCEPT
-A ufw-skip-to-policy-forward -j DROP
-A ufw-not-local -m addrtype --dst-type LOCAL -j RETURN
-A ufw-not-local -m addrtype --dst-type MULTICAST -j RETURN
-A ufw-not-local -m addrtype --dst-type BROADCAST -j RETURN
-A ufw-not-local -m limit --limit 3/min --limit-burst 10 -j ufw-logging-deny
-A ufw-not-local -j DROP
-A ufw-user-input -p tcp -m tcp --dport 22 -j ACCEPT
-A ufw-user-input -p tcp -m tcp --dport 80 -j ACCEPT
-A ufw-user-input -p tcp -m tcp --dport 443 -j ACCEPT
-A ufw-user-input -p tcp -m tcp --dport 5900 -m comment --comment "\'dapp_VNC\'" -j ACCEPT
-A ufw-user-input -p tcp -m tcp --dport 57100 -j ACCEPT
-A ufw-user-input -p udp -m udp --dport 57100 -j ACCEPT
-A ufw-user-limit -m limit --limit 3/min -j LOG --log-prefix "[UFW LIMIT BLOCK] "
-A ufw-user-limit -j REJECT --reject-with icmp-port-unreachable
-A ufw-user-limit-accept -j ACCEPT
```

</details>

<details>
<summary>sudo iptables -t nat -S</summary>

```
-P PREROUTING ACCEPT
-P INPUT ACCEPT
-P POSTROUTING ACCEPT
-P OUTPUT ACCEPT
-A POSTROUTING -s 10.6.0.0/24 -o eth0 -m comment --comment wireguard-nat-rule -j MASQUERADE
```

</details>

**Comment by PirvuCatalin** [comment]
> I'm sorry to necro this issue after 6 months, but I have a very similar problem (without the complicated network setup).
> 
> * [x]  Does wireguard successfully "connect" ? - If you don't know leave blank.
>   Yes, and I can see packets going back and forth on `tcpdump`
> * [x]  Can you ping the remote endpoint? Which I presume is 10.6.0.x
>   Yes, the endpoint pivpn generated was `10.6.0.1`
> * [x]  Can you ping any address you know to be on the remote end, eg. your LAN router?
>   Yes, I am able to ping devices on the network after connecting via Wireguard. I am not able to _access_ any of those devices, however.
> 
> I have a brand new RaspberryPi 4 that is only running pivpn. No PiHole, nothing extra.
> 
> Here are my debug outputs:
> 
> pivpn debug
> lsmod | grep wireguard
> cat /etc/pivpn/wireguard/setupVars.conf
> ip -f inet address show eth0
> My DDNS domain has the same IP address as my public IP address
> 
> sudo tcpdump -n -i eth0 udp port 57100
> I did have `ufw` installed after I installed pivpn, but later uninstalled it since pivpn uses `iptables` instead. My `iptables` are full of ufw stuff that I don't know how to get rid of. Maybe this is why nothing is working correctly?
> 
> sudo iptables -S
> sudo iptables -t nat -S
> ```
> -P PREROUTING ACCEPT
> -P INPUT ACCEPT
> -P POSTROUTING ACCEPT
> -P OUTPUT ACCEPT
> -A POSTROUTING -s 10.6.0.0/24 -o eth0 -m comment --comment wireguard-nat-rule -j MASQUERADE
> ```

I have exactly the same issue
