### ISSUE TITLE
vanilla pivpn lan and internet doesnt work

### ISSUE THREAD

**Issue by judos** [pivpn/pivpn#774]
## In raising this issue, I confirm the following: 

- [x] I have read and understood the [contributors guide](https://github.com/pivpn/pivpn/blob/master/CONTRIBUTING.md).
- [x] The issue I am reporting can be *replicated*.
- [?] The issue I am reporting can be *is* directly related to the pivpn installer script.
- [x] The issue I am reporting isn't a duplicate (see [FAQs](https://github.com/pivpn/pivpn/wiki/FAQ), [closed issues](https://github.com/pivpn/pivpn/issues?q=is%3Aissue+sort%3Aupdated-desc+is%3Aclosed), and [open issues](https://github.com/pivpn/pivpn/issues?q=is%3Aissue+sort%3Aupdated-desc+is%3Aopen)).

### Issue

I installed pivpn successfully and can connect to it but lan/internet doesn't seem reachable as soon as I do. I tried accessing the router/google and they both don't load.

### Have you searched for similar issues and solutions?
yes: https://github.com/pivpn/pivpn/issues/207, https://github.com/pivpn/pivpn/issues/634, https://github.com/pivpn/pivpn/issues/676, https://github.com/pivpn/pivpn/issues/752

### Console output of      `pivpn debug`
https://pastebin.com/CEbvUQfz

### Have you taken any steps towards solving your issue?

I tried several of the proposed solutions in the other tickets, but unluckily nothing worked so far.
No compression config is in the server.conf, and setting local ip, or push route also didn't seem to work.
Aside this at least I only used pivpn and nothing else, no pihole etc. Just a vanilla install with 2 users added. And everything from the installation to the connect vpn works. Just I don't reach any device then.

Any clues what might be wrong?
Thanks in advance for your help!

**Comment by orazioedoardo** [comment]
The connection seem to be established. When connected to the VPN, can you SSH into your raspberry pi via these addresses: 192.168.1.10 and 10.8.0.1? I see you are on android, you can use [JuiceSSH](https://play.google.com/store/apps/details?id=com.sonelli.juicessh&hl=it).

**Comment by judos** [comment]
Yes the connection seems generally ok in the android OpenVPN Connect client.
Yeah JuiceSSH is very nice, already use that a lot.
I can connect with 192.168.1.10 to the raspberry. (but it warns me that the public key of the raspberry has changed and that the connection might be unsecure therefore. Seems odd to me..)
Also 10.8.0.1 works fine.

**Comment by orazioedoardo** [comment]
OK so basically you can only connect to the raspberry pi itself, let's tackle this problem first.

- Install tcpdump on the raspberry pi: `sudo apt install tcpdump`
- Connect to the VPN
- Run `sudo tcpdump -i tun0 -nn host 192.168.1.1 and port 80` on the raspberry pi to sniff the traffic inside the tunnel, it should hopefully be populated when you visit the router web interface. If not, post the output.
- Also post the output of `sudo iptables -S` and `sudo iptables -t nat -S` in case the debug script didn't work.

**Comment by judos** [comment]
Ok so I installed tcpdump and ran the command you provided. While I request the router page on the mobile it produces the following output:
```
~ $ sudo tcpdump -i tun0 -nn host 192.168.1.1 and port 80
tcpdump: verbose output suppressed, use -v or -vv for full protocol decode
listening on tun0, link-type RAW (Raw IP), capture size 262144 bytes
16:47:48.988213 IP 10.8.0.2.55266 > 192.168.1.1.80: Flags [S], seq 2420061846, win 65535, options [mss 1361,sackOK,TS val 698284 ecr 0,nop,wscale 7], length 0
16:47:49.232357 IP 10.8.0.2.55267 > 192.168.1.1.80: Flags [S], seq 12117568, win 65535, options [mss 1361,sackOK,TS val 698309 ecr 0,nop,wscale 7], length 0
16:47:49.986950 IP 10.8.0.2.55266 > 192.168.1.1.80: Flags [S], seq 2420061846, win 65535, options [mss 1361,sackOK,TS val 698384 ecr 0,nop,wscale 7], length 0
16:47:50.232395 IP 10.8.0.2.55267 > 192.168.1.1.80: Flags [S], seq 12117568, win 65535, options [mss 1361,sackOK,TS val 698409 ecr 0,nop,wscale 7], length 0
16:47:51.987982 IP 10.8.0.2.55266 > 192.168.1.1.80: Flags [S], seq 2420061846, win 65535, options [mss 1361,sackOK,TS val 698584 ecr 0,nop,wscale 7], length 0
16:47:52.238475 IP 10.8.0.2.55267 > 192.168.1.1.80: Flags [S], seq 12117568, win 65535, options [mss 1361,sackOK,TS val 698609 ecr 0,nop,wscale 7], length 0
16:47:55.992917 IP 10.8.0.2.55266 > 192.168.1.1.80: Flags [S], seq 2420061846, win 65535, options [mss 1361,sackOK,TS val 698985 ecr 0,nop,wscale 7], length 0
16:47:56.242472 IP 10.8.0.2.55267 > 192.168.1.1.80: Flags [S], seq 12117568, win 65535, options [mss 1361,sackOK,TS val 699010 ecr 0,nop,wscale 7], length 0
16:48:04.027789 IP 10.8.0.2.55266 > 192.168.1.1.80: Flags [S], seq 2420061846, win 65535, options [mss 1361,sackOK,TS val 699788 ecr 0,nop,wscale 7], length 0
16:48:04.267926 IP 10.8.0.2.55267 > 192.168.1.1.80: Flags [S], seq 12117568, win 65535, options [mss 1361,sackOK,TS val 699812 ecr 0,nop,wscale 7], length 0
16:48:20.068222 IP 10.8.0.2.55266 > 192.168.1.1.80: Flags [S], seq 2420061846, win 65535, options [mss 1361,sackOK,TS val 701392 ecr 0,nop,wscale 7], length 0
16:48:20.302599 IP 10.8.0.2.55267 > 192.168.1.1.80: Flags [S], seq 12117568, win 65535, options [mss 1361,sackOK,TS val 701416 ecr 0,nop,wscale 7], length 0
```
When I try to reach google however it doesn't catch any packets.

The routing tables look as follows: (pastebin so this post doesnt get too long)
iptables -S: https://pastebin.com/Ca2Vc1EH
iptables -t nat -S: https://pastebin.com/xPfRBQjc

Does that tell you something?

**Comment by orazioedoardo** [comment]
> While I request the router page on the mobile it produces the following output:

That's what I suspected, your raspberry pi is not forwarding the traffic correctly (10.8.0.2 sends packets to 192.168.1.1 but it doesn't receive a response).

> When I try to reach google however it doesn't catch any packets.

Yeah, that tcpdump rule only catches rules with source or destination ip equal to 192.168.1.1 on port 80. It was enough for the test.

> Do the logs tell you something?

Yes, first that the debug script is right when he says `[OK] Iptables MASQUERADE rule set`, this means that the raspberry pi will replace the vpn client ip with its IP. This is required so when your android phone connects to your router, the latter sees 192.168.1.10 so it can respond back, otherwise he would have seen 10.8.0.2 which he doesn't know what network it belongs to.

However, your raspberry pi blocks packet forwarding by default `-P FORWARD DROP`, and the install script doesn't take this scenario into account. Pretty sure docker did this. Here's how you can fix (copy-paste every line one by one):

```
sudo -s
iptables -t nat -D POSTROUTING -s 10.8.0.0/24 -o eth0 -j MASQUERADE
iptables -t nat -I POSTROUTING 1 -s 10.8.0.0/24 -o eth0 -j MASQUERADE
iptables -I FORWARD 1 -d 10.8.0.0/24 -i eth0 -o tun0 -m conntrack --ctstate RELATED,ESTABLISHED -j ACCEPT
iptables -I FORWARD 2 -s 10.8.0.0/24 -i tun0 -o eth0 -j ACCEPT
iptables-save > /etc/iptables/rules.v4
exit
```

Try again.

**Comment by judos** [comment]
Wow cool. That actually worked. Now I can access the router and also the internet so I think that should be all!

At first I didn't even manage to connect anymore, but after a restart of the openvpn "systemctl restart openvpn" everything was solved!

So cool! Thanks for the help! Maybe this issue could go to "known issues" because I assume many people are using docker also...
Cheers

**Comment by bg172** [comment]
> ...
However, your raspberry pi blocks packet forwarding by default `-P FORWARD DROP`, and the install script doesn't take this scenario into account. Pretty sure docker did this. Here's how you can fix (copy-paste every line one by one):
> 
> ```
> sudo -s
> iptables -t nat -D POSTROUTING -s 10.8.0.0/24 -o eth0 -j MASQUERADE
> iptables -t nat -I POSTROUTING 1 -s 10.8.0.0/24 -o eth0 -j MASQUERADE
> iptables -I FORWARD 1 -d 10.8.0.0/24 -i eth0 -o tun0 -m conntrack --ctstate RELATED,ESTABLISHED -j ACCEPT
> iptables -I FORWARD 2 -s 10.8.0.0/24 -i tun0 -o eth0 -j ACCEPT
> iptables-save > /etc/iptables/rules.v4
> exit
> ```
> 
> Try again.

thank you, this worked!
