### ISSUE TITLE
[Support] Wireguard appears to be running, but no internet when connected.

### ISSUE THREAD

**Issue by CuppaJava123** [pivpn/pivpn#1338]
## In raising this issue, I confirm the following:

`{please fill the checkboxes, e.g: [X]}`

- [X] I have read and understood the [contributors guide](https://github.com/pivpn/pivpn/blob/master/CONTRIBUTING.md).
- [X] The issue I am reporting can be *replicated*.
- [] The issue I am reporting can be *is* directly related to the pivpn installer script.
- [X] The issue I am reporting isn't a duplicate (see [FAQs](https://github.com/pivpn/pivpn/wiki/FAQ), [closed issues](https://github.com/pivpn/pivpn/issues?q=is%3Aissue+sort%3Aupdated-desc+is%3Aclosed), and [open issues](https://github.com/pivpn/pivpn/issues?q=is%3Aissue+sort%3Aupdated-desc+is%3Aopen)).

### Issue
My goal is to connect to my home network from outside networks using a Wireguard VPN hosted on a Raspberry Pi. Also running on the Raspberry Pi is Pihole (not docker Pihole) and OpenMediaVault. I went through the installer and everything went smoothly. I forwarded port 51820 on my router with UDP. Then I created a profile for my phone and scanned the QR code. When the VPN is turned on, I cannot access the internet.

### Have you searched for similar issues and solutions?
    (**yes**/no / which issues?)
I'm not too proficient in networking, but I remember reading that its possible I'm behind NAT firewall and also that it could have something to do with ip-tables.

### Console output of      `pivpn debug`
```
  ::: Generating Debug Output
::::		PiVPN debug		::::
=============================================
::::		Latest commit		::::
commit 5aa0de636f32fd674b77a2b3dd64d97b51680707
Author: 4s3ti <4s3ti@protonmail.com>
Date:   Mon May 31 21:01:46 2021 +0200

    IRC From freenode to libera.chat
    
    Changed info about IRC Chanel,
    Chanel moved from freenode to libera.chat
=============================================
::::	   Installation settings    	::::
PLAT=Raspbian
OSCN=buster
USING_UFW=0
IPv4dev=eth0
dhcpReserv=1
IPv4addr=192.168.50.110/24
IPv4gw=192.168.50.1
install_user=pi
install_home=/home/pi
VPN=wireguard
pivpnPORT=51820
pivpnDNS1=10.6.0.1
pivpnDNS2=
pivpnHOST=REDACTED
INPUT_CHAIN_EDITED=0
FORWARD_CHAIN_EDITED=0
pivpnPROTO=udp
pivpnMTU=1420
pivpnDEV=wg0
pivpnNET=10.6.0.0
subnetClass=24
ALLOWED_IPS="0.0.0.0/0, ::0/0"
UNATTUPG=1
INSTALLED_PACKAGES=()
=============================================
::::  Server configuration shown below   ::::
[Interface]
PrivateKey = server_priv
Address = 10.6.0.1/24
MTU = 1420
ListenPort = 51820
### begin samsung ###
[Peer]
PublicKey = samsung_pub
PresharedKey = samsung_psk
AllowedIPs = 10.6.0.2/32
### end samsung ###
=============================================
::::  Client configuration shown below   ::::
[Interface]
PrivateKey = samsung_priv
Address = 10.6.0.2/24
MTU = 1420
DNS = 10.6.0.1

[Peer]
PublicKey = server_pub
PresharedKey = samsung_psk
Endpoint = REDACTED:51820
AllowedIPs = 0.0.0.0/0, ::0/0
=============================================
:::: 	Recursive list of files in	::::
::::[4m/etc/wireguard shown below	::::
/etc/wireguard:
configs
keys
wg0.conf

/etc/wireguard/configs:
clients.txt
samsung.conf

/etc/wireguard/keys:
samsung_priv
samsung_psk
samsung_pub
server_priv
server_pub
=============================================
::::		Self check		::::
:: [OK] IP forwarding is enabled
:: [OK] Iptables MASQUERADE rule set
:: [OK] WireGuard is running
:: [OK] WireGuard is enabled (it will automatically start on reboot)
:: [OK] WireGuard is listening on port 51820/udp
=============================================
:::: Having trouble connecting? Take a look at the FAQ:
:::: https://github.com/pivpn/pivpn/wiki/FAQ
=============================================
:::: WARNING: This script should have automatically masked sensitive       ::::
:::: information, however, still make sure that PrivateKey, PublicKey      ::::
:::: and PresharedKey are masked before reporting an issue. An example key ::::
:::: that you should NOT see in this log looks like this:                  ::::
:::: YIAoJVsdIeyvXfGGDDadHh6AxsMRymZTnnzZoAb9cxRe                          ::::
=============================================
::::		Debug complete		::::
::: 
::: Debug output completed above.
::: Copy saved to /tmp/debug.log
::: 
```
### Have you taken any steps towards solving your issue?
```
 Additionally, I performed the tcpdump mentioned in the FAQ:
`sudo tcpdump -n -i eth0 udp port 51820
tcpdump: verbose output suppressed, use -v or -vv for full protocol decode
listening on eth0, link-type EN10MB (Ethernet), capture size 262144 bytes`

Output of sudo iptables -S:
-P INPUT ACCEPT
-P FORWARD ACCEPT
-P OUTPUT ACCEPT

Output of sudo iptables -t nat -S:

-P PREROUTING ACCEPT
-P INPUT ACCEPT
-P POSTROUTING ACCEPT
-P OUTPUT ACCEPT
-A POSTROUTING -s 10.6.0.0/24 -o eth0 -m comment --comment wireguard-nat-rule -j MASQUERADE

Hopefully I've provided enough information, let me know if I should add anything else.
```

**Comment by orazioedoardo** [comment]
Did you see any packets on `tcpdump` when trying to connect. If not, then port forwarding is not working. Is your ISP under CGNAT (that way a question in the FAQ you have read). Are you using multiple chained routers?

**Comment by CuppaJava123** [comment]
`tcpdump` does not show any output when trying to connect. 

Also, I wasn't sure if I was under CGNAT, but according to this website, https://www.remoterig.com/wp/?page_id=3494, if the WAN IP address in my router settings is different from my public ip address is then I am under CGNAT. My WAN IP **is** different from my public ip so I guess I am under CGNAT.  

Here is my router setup: I have the Panoramic Wifi Gateway that Cox provided set to Bridge Mode and then I have an ASUS mesh wifi router connected to that. I added the port forwarding settings in the ASUS settings, not the Cox settings. I attached a picture of the port forwarding settings I used. 
![port-forward](https://user-images.githubusercontent.com/75396393/126520820-a4fb56a2-a36d-40a6-baf6-7c823f8724ef.png)
Hope this helps and thank you for your help.

**Comment by orazioedoardo** [comment]
Is the WAN IP of the Cox gateway the one showed on the website? If that's the case the ASUS router is not actually using bridge mode but creating an additional NAT. You can either try to fix it or connect the raspberry pi to the Cox gateway.

**Comment by CuppaJava123** [comment]
Okay, it turns out my Cox modem was not in true bridge mode. Now that it is, I reinstalled PiVPN and added a new profile for my phone. I don't actually think I'm under a CGNAT with cox because my WAN IP is the same as my public IP. Still unable to browse the web but the tcpdump actually works now:

`listening on eth0, link-type EN10MB (Ethernet), capture size 262144 bytes
19:04:07.312275 IP 172.58.4.53.61599 > 192.168.50.110.51820: UDP, length 148
19:04:12.421965 IP 172.58.4.53.61599 > 192.168.50.110.51820: UDP, length 148
19:04:17.502512 IP 172.58.4.53.61599 > 192.168.50.110.51820: UDP, length 148
19:04:22.602284 IP 172.58.4.53.61599 > 192.168.50.110.51820: UDP, length 148
19:04:27.605881 IP 172.58.4.53.61599 > 192.168.50.110.51820: UDP, length 148
19:04:32.741950 IP 172.58.4.53.61599 > 192.168.50.110.51820: UDP, length 148
^C
6 packets captured
6 packets received by filter
0 packets dropped by kernel`

Additionally, here is the debug info for this new installation, in case it helps:
`::: Generating Debug Output
::::		PiVPN debug		::::
=============================================
::::		Latest commit		::::
commit 5aa0de636f32fd674b77a2b3dd64d97b51680707
Author: 4s3ti <4s3ti@protonmail.com>
Date:   Mon May 31 21:01:46 2021 +0200

    IRC From freenode to libera.chat
    
    Changed info about IRC Chanel,
    Chanel moved from freenode to libera.chat
=============================================
::::	   Installation settings    	::::
PLAT=Raspbian
OSCN=buster
USING_UFW=0
IPv4dev=eth0
dhcpReserv=1
IPv4addr=192.168.50.109/24
IPv4gw=192.168.50.1
install_user=pi
install_home=/home/pi
VPN=wireguard
pivpnPORT=51820
pivpnDNS1=10.6.0.1
pivpnDNS2=
pivpnHOST=REDACTED
INPUT_CHAIN_EDITED=0
FORWARD_CHAIN_EDITED=0
pivpnPROTO=udp
pivpnMTU=1420
pivpnDEV=wg0
pivpnNET=10.6.0.0
subnetClass=24
ALLOWED_IPS="0.0.0.0/0, ::0/0"
UNATTUPG=1
INSTALLED_PACKAGES=()
=============================================
::::  Server configuration shown below   ::::
[Interface]
PrivateKey = server_priv
Address = 10.6.0.1/24
MTU = 1420
ListenPort = 51820
### begin samsung ###
[Peer]
PublicKey = samsung_pub
PresharedKey = samsung_psk
AllowedIPs = 10.6.0.2/32
### end samsung ###
=============================================
::::  Client configuration shown below   ::::
[Interface]
PrivateKey = samsung_priv
Address = 10.6.0.2/24
MTU = 1420
DNS = 10.6.0.1

[Peer]
PublicKey = server_pub
PresharedKey = samsung_psk
Endpoint = REDACTED:51820
AllowedIPs = 0.0.0.0/0, ::0/0
=============================================
:::: 	Recursive list of files in	::::
::::[4m/etc/wireguard shown below	::::
/etc/wireguard:
configs
keys
wg0.conf

/etc/wireguard/configs:
clients.txt
samsung.conf

/etc/wireguard/keys:
samsung_priv
samsung_psk
samsung_pub
server_priv
server_pub
=============================================
::::		Self check		::::
:: [OK] IP forwarding is enabled
:: [OK] Iptables MASQUERADE rule set
:: [OK] WireGuard is running
:: [OK] WireGuard is enabled (it will automatically start on reboot)
:: [OK] WireGuard is listening on port 51820/udp
=============================================
:::: Having trouble connecting? Take a look at the FAQ:
:::: https://github.com/pivpn/pivpn/wiki/FAQ
=============================================
:::: WARNING: This script should have automatically masked sensitive       ::::
:::: information, however, still make sure that PrivateKey, PublicKey      ::::
:::: and PresharedKey are masked before reporting an issue. An example key ::::
:::: that you should NOT see in this log looks like this:                  ::::
:::: YIAoJVsdIeyvXfGGDDadHh6AxsMRymZTnnzZoAb9cxRe                          ::::
=============================================
::::		Debug complete		::::
::: 
::: Debug output completed above.
::: Copy saved to /tmp/debug.log
::: `

**Comment by CuppaJava123** [comment]
FIXED: After switching to bridge mode, I made a modification to the static IP address of my Pi and but forgot to update the port forwarding rule. After updating the port forwarding rule with the new static (local) IP, the VPN works!
