### ISSUE TITLE
[Support] Wireguard no RX despite packets being sent back from pivpn

### ISSUE THREAD

**Issue by mrskizzex** [pivpn/pivpn#1237]
## In raising this issue, I confirm the following:

- [X] I have read and understood the [contributors guide](https://github.com/pivpn/pivpn/blob/master/CONTRIBUTING.md).
- [X] The issue I am reporting can be *replicated*.
- [] The issue I am reporting can be *is* directly related to the pivpn installer script.
- [X] The issue I am reporting isn't a duplicate (see [FAQs](https://github.com/pivpn/pivpn/wiki/FAQ), [closed issues](https://github.com/pivpn/pivpn/issues?q=is%3Aissue+sort%3Aupdated-desc+is%3Aclosed), and [open issues](https://github.com/pivpn/pivpn/issues?q=is%3Aissue+sort%3Aupdated-desc+is%3Aopen)).

### Issue

After installing and setting up pivpn I tried connecting to it without success. In android app i see TX counter going up but no RX.
I checked tcpdump from pivpn and I see packets coming in and going back to the device. When I do "sudo wg show" i see that RX counter is going up.

### Have you searched for similar issues and solutions?
```
Yes i did search but I couldn't find anything remotely close to my issue.
```
### Console output of      `curl -L install.pivpn.io | bash`
```
My issue is not related to the installer.
```

### Console output of      `pivpn add` or `pivpn add nopass`
```
My issue is not related to client creation
```

### Console output of      `pivpn debug`
```
::: Generating Debug Output
::::            PiVPN debug              ::::
=============================================
::::            Latest commit            ::::
commit 7fdbe44df5319b7c99a4481c754acd8c0c6c98fa
Author: 4s3ti <4s3ti@protonmail.com>
Date:   Tue Jan 26 17:24:10 2021 +0100

    Merge branch 'test'

    Merge test branch into master,
    Check LatestChanges.md for details
=============================================
::::        Installation settings        ::::
PLAT=Raspbian
OSCN=buster
USING_UFW=0
IPv4dev=eth0
dhcpReserv=1
IPv4addr=192.168.1.50/24
IPv4gw=192.168.1.1
install_user=pi
install_home=/home/pi
VPN=wireguard
pivpnPORT=51820
pivpnDNS1=10.6.0.1
pivpnDNS2=
pivpnHOST=REDACTED
INPUT_CHAIN_EDITED=0
FORWARD_CHAIN_EDITED=0
pivpnPROTO=udp
pivpnDEV=wg0
pivpnNET=10.6.0.0
subnetClass=24
ALLOWED_IPS="0.0.0.0/0, ::0/0"
UNATTUPG=1
INSTALLED_PACKAGES=(unattended-upgrades)
=============================================
::::  Server configuration shown below   ::::
[Interface]
PrivateKey = server_priv
Address = 10.6.0.1/24
ListenPort = 51820
### begin s20plus ###
[Peer]
PublicKey = s20plus_pub
PresharedKey = s20plus_psk
AllowedIPs = 10.6.0.2/32
### end s20plus ###
=============================================
::::  Client configuration shown below   ::::
[Interface]
PrivateKey = s20plus_priv
Address = 10.6.0.2/24
DNS = 10.6.0.1

[Peer]
PublicKey = server_pub
PresharedKey = s20plus_psk
Endpoint = REDACTED:51820
AllowedIPs = 0.0.0.0/0, ::0/0
=============================================
::::    Recursive list of files in       ::::
::::    /etc/wireguard shown below       ::::
/etc/wireguard:
configs
keys
wg0.conf

/etc/wireguard/configs:
clients.txt
s20plus.conf

/etc/wireguard/keys:
s20plus_priv
s20plus_psk
s20plus_pub
server_priv
server_pub
=============================================
::::            Self check               ::::
:: [OK] IP forwarding is enabled
:: [OK] Iptables MASQUERADE rule set
:: [OK] WireGuard is running
:: [OK] WireGuard is enabled (it will automatically start on reboot)
:: [OK] WireGuard is listening on port 51820/udp
=============================================
:::: Having trouble connecting? Take a look at the FAQ:
:::: https://github.com/pivpn/pivpn/wiki/FAQ
=============================================
:::: WARNING: This script should have automatically masked sensitive       ::::
:::: information, however, still make sure that PrivateKey, PublicKey      ::::
:::: and PresharedKey are masked before reporting an issue. An example key ::::
:::: that you should NOT see in this log looks like this:                  ::::
:::: YIAoJVsdIeyvXfGGDDadHh6AxsMRymZTnnzZoAb9cxRe                          ::::
=============================================
::::            Debug complete           ::::
:::
::: Debug output completed above.
::: Copy saved to /tmp/debug.log
:::

```
### Have you taken any steps towards solving your issue?
```
  I looked at FAQ but it just said to open an issue when I can see packets coming out from pivpn but no connection
```

### Packet capture outputs 

S20+ (my wireguard client)  connecting over LTE to my VPS and VPS connecting over OpenVPN to my home Linux server ( this is my way of port forwarding because I have CGNAT on my home connection as I use LTE )
```
root@vps711608:~# tcpdump -n -i any "port 51820"
tcpdump: verbose output suppressed, use -v or -vv for full protocol decode
listening on any, link-type LINUX_SLL (Linux cooked), capture size 262144 bytes
05:58:25.138430 IP 31.60.120.23.10845 > REDACTED.51820: UDP, length 148
05:58:25.138609 IP 31.60.120.23.10845 > 10.8.0.10.51820: UDP, length 148
05:58:30.175139 IP 31.60.120.23.10845 > REDACTED.51820: UDP, length 148
05:58:30.175279 IP 31.60.120.23.10845 > 10.8.0.10.51820: UDP, length 148
05:58:35.342011 IP 31.60.120.23.10845 > REDACTED.51820: UDP, length 148
05:58:35.342100 IP 31.60.120.23.10845 > 10.8.0.10.51820: UDP, length 148
05:58:40.349891 IP 31.60.120.23.10845 > REDACTED.51820: UDP, length 148
05:58:40.349958 IP 31.60.120.23.10845 > 10.8.0.10.51820: UDP, length 148
^C
8 packets captured
8 packets received by filter
0 packets dropped by kernel
```

My home Linux server connecting over LAN to my pivpn
```
root@vpn:~# tcpdump -n -i any "port 51820"
tcpdump: verbose output suppressed, use -v or -vv for full protocol decode
listening on any, link-type LINUX_SLL (Linux cooked v1), capture size 262144 bytes
05:58:25.153596 IP 31.60.120.23.10845 > 10.8.0.10.51820: UDP, length 148
05:58:25.153663 IP 31.60.120.23.10845 > 192.168.1.50.51820: UDP, length 148
05:58:30.187484 IP 31.60.120.23.10845 > 10.8.0.10.51820: UDP, length 148
05:58:30.187541 IP 31.60.120.23.10845 > 192.168.1.50.51820: UDP, length 148
05:58:35.354009 IP 31.60.120.23.10845 > 10.8.0.10.51820: UDP, length 148
05:58:35.354079 IP 31.60.120.23.10845 > 192.168.1.50.51820: UDP, length 148
05:58:40.361466 IP 31.60.120.23.10845 > 10.8.0.10.51820: UDP, length 148
05:58:40.361542 IP 31.60.120.23.10845 > 192.168.1.50.51820: UDP, length 148
05:58:45.360549 IP 31.60.120.23.10845 > 10.8.0.10.51820: UDP, length 148
05:58:45.360647 IP 31.60.120.23.10845 > 192.168.1.50.51820: UDP, length 148
^C
10 packets captured
12 packets received by filter
0 packets dropped by kernel
```

My pivpn receiving tx packet and responding back to them to my s20+ client.
```
pi@ZeroPi:~ $ sudo tcpdump -n -i any "port 51820"
tcpdump: verbose output suppressed, use -v or -vv for full protocol decode
listening on any, link-type LINUX_SLL (Linux cooked), capture size 262144 bytes
05:58:25.159762 IP 31.60.120.23.10845 > 192.168.1.50.51820: UDP, length 148
05:58:25.177498 IP 192.168.1.50.51820 > 31.60.120.23.10845: UDP, length 92
05:58:30.193664 IP 31.60.120.23.10845 > 192.168.1.50.51820: UDP, length 148
05:58:30.210713 IP 192.168.1.50.51820 > 31.60.120.23.10845: UDP, length 92
05:58:35.360190 IP 31.60.120.23.10845 > 192.168.1.50.51820: UDP, length 148
05:58:35.377181 IP 192.168.1.50.51820 > 31.60.120.23.10845: UDP, length 92
05:58:40.367811 IP 31.60.120.23.10845 > 192.168.1.50.51820: UDP, length 148
05:58:40.384730 IP 192.168.1.50.51820 > 31.60.120.23.10845: UDP, length 92
05:58:45.366932 IP 31.60.120.23.10845 > 192.168.1.50.51820: UDP, length 148
05:58:45.383827 IP 192.168.1.50.51820 > 31.60.120.23.10845: UDP, length 92
^C
10 packets captured
10 packets received by filter
0 packets dropped by kernel
```

### IPtables weren't edited
```
pi@ZeroPi:~ $ sudo iptables -S
-P INPUT ACCEPT
-P FORWARD ACCEPT
-P OUTPUT ACCEPT
pi@ZeroPi:~ $ sudo iptables -t nat -S
-P PREROUTING ACCEPT
-P INPUT ACCEPT
-P POSTROUTING ACCEPT
-P OUTPUT ACCEPT
-A POSTROUTING -s 10.6.0.0/24 -o eth0 -m comment --comment wireguard-nat-rule -j MASQUERADE
```

### wg show output
```
pi@ZeroPi:~ $ sudo wg show
interface: wg0
  public key: REDACTED=
  private key: (hidden)
  listening port: 51820

peer: REDACTED=
  preshared key: (hidden)
  endpoint: 31.60.120.23:10845
  allowed ips: 10.6.0.2/32
  transfer: 15.18 KiB received, 9.43 KiB sent

```

**Comment by orazioedoardo** [comment]
> S20+ (my wireguard client) connecting over LTE to my VPS and VPS connecting over OpenVPN to my home Linux server ( this is my way of port forwarding because I have CGNAT on my home connection as I use LTE )

If you have this working setup, you don't need to install PiVPN on your home Pi. Just connect the Samsung phone to the VPS and setup routing and forwarding on both VPS + home Linux server to reach the local network.

**Comment by mrskizzex** [comment]
That's actually a good idea, probably easier as well. Thank you.
I also checked connecting directly to the Pi IP from my home network and wireguard works so it's entirely my forwarding issue.

**Comment by aungthihaaung** [comment]
when you do "pivpn -d", the output says following.

:: [OK] WireGuard is listening on port 51820/udp

Hence, I changed my router port forwarding to both "tcp/udp" and it works.
