### ISSUE TITLE
[Support] PiVPN installation prevents pi-hole from being reachable from non-VPN clients.

### ISSUE THREAD

**Issue by Ge0rges** [pivpn/pivpn#1282]
## In raising this issue, I confirm the following:

- [X] I have read and understood the [contributors guide](https://github.com/pivpn/pivpn/blob/master/CONTRIBUTING.md).
- [] The issue I am reporting can be *replicated*.
- [] The issue I am reporting can be *is* directly related to the pivpn installer script.
- [X] The issue I am reporting isn't a duplicate 

### Issue
Hello all, I had a working setup running PiHole and Unbound as the upstream DNS. I had UFW set up, such that only my home IP could make requests to PiHole (ie. only my home IP packets will be accepted on port 53). This setup worked. 

After installing PiVPN (Wireguard), devices on my home network can no longer resolve DNS queries. This is confirmed by the PiHole log not showing any queries being requested. TCPDump shows that these packets are getting to the server however. 

Unbound listens on 5353. PiHole listens on 53. Apache is also running on this server on 80 and 443. I use UFW as my firewall.

### Have you searched for similar issues and solutions?
https://github.com/pivpn/pivpn/issues/1207
https://github.com/pivpn/pivpn/issues/380
https://github.com/pivpn/pivpn/issues/1192

### Console output of      `curl -L install.pivpn.io | bash`
```
root@ge0rges:~# curl -L install.pivpn.io | bash
  % Total    % Received % Xferd  Average Speed   Time    Time     Time  Current
                                 Dload  Upload   Total   Spent    Left  Speed
100    17  100    17    0     0    202      0 --:--:-- --:--:-- --:--:--   202
100   162  100   162    0     0    830      0 --:--:-- --:--:-- --:--:--   830
100 83358  100 83358    0     0   193k      0 --:--:-- --:--:-- --:--:--  193k
:::
::: You are root.
::: Update option selected.
::: The updating functionality for PiVPN scripts is temporarily disabled
::: To keep the VPN (and the system) up to date, use 'apt update' and 'apt upgrade'
```

### Console output of      `pivpn add` or `pivpn add nopass`
```
  Enter a Name for the Client: foo
::: Client Keys generated
::: Client config generated
::: Updated server config
::: Updated hosts file for Pi-hole
::: WireGuard reloaded
======================================================================
::: Done! foo.conf successfully created!
::: foo.conf was copied to /home/pivpn/configs for easy transfer.
::: Please use this profile only on one device and create additional
::: profiles for other devices. You can also use pivpn -qr
::: to generate a QR Code you can scan with the mobile app.
======================================================================
```

### Console output of      `pivpn debug`
```
::: Generating Debug Output
::::		PiVPN debug		 ::::
=============================================
::::		Latest commit		 ::::
commit d7771c251418fa443869397d46f93c5b0c197558
Author: 4s3ti <4s3ti@protonmail.com>
Date:   Sat Feb 6 23:04:11 2021 +0100

    Merge branch test into master
    
    fixes #1234
    ci/cd fixes and improvements
=============================================
::::	    Installation settings    	 ::::
PLAT=Ubuntu
OSCN=focal
USING_UFW=1
IPv4dev=ens3
install_user=pivpn
install_home=/home/pivpn
VPN=wireguard
pivpnPORT=20
pivpnDNS1=10.6.0.1
pivpnDNS2=
pivpnHOST=REDACTED
pivpnPROTO=udp
pivpnDEV=wg0
pivpnNET=10.6.0.0
subnetClass=24
ALLOWED_IPS="0.0.0.0/0, ::0/0"
UNATTUPG=1
INSTALLED_PACKAGES=(wireguard-tools qrencode)
=============================================
::::  Server configuration shown below   ::::
[Interface]
PrivateKey = server_priv
Address = 10.6.0.1/24
ListenPort = 20
=============================================
::::  Client configuration shown below   ::::
::: There are no clients yet
=============================================
:::: 	Recursive list of files in	 ::::
::::	[4m/etc/wireguard shown below	 ::::
/etc/wireguard:
configs
keys
wg0.conf

/etc/wireguard/configs:
clients.txt

/etc/wireguard/keys:
server_priv
server_pub
=============================================
::::		Self check		 ::::
:: [OK] IP forwarding is enabled
:: [OK] Ufw is enabled
:: [OK] Iptables MASQUERADE rule set
:: [OK] Ufw input rule set
:: [OK] Ufw forwarding rule set
:: [OK] WireGuard is running
:: [OK] WireGuard is enabled (it will automatically start on reboot)
:: [OK] WireGuard is listening on port 20/udp
=============================================
:::: Having trouble connecting? Take a look at the FAQ:
:::: https://github.com/pivpn/pivpn/wiki/FAQ
=============================================
:::: WARNING: This script should have automatically masked sensitive       ::::
:::: information, however, still make sure that PrivateKey, PublicKey      ::::
:::: and PresharedKey are masked before reporting an issue. An example key ::::
:::: that you should NOT see in this log looks like this:                  ::::
:::: YIAoJVsdIeyvXfGGDDadHh6AxsMRymZTnnzZoAb9cxRe                          ::::
=============================================
::::		Debug complete		 ::::
::: 
::: Debug output completed above.
::: Copy saved to /tmp/debug.log
::: 
```
### Have you taken any steps towards solving your issue?
I have attempted to do `ufw allow 53` to allow all traffic to PiHole, that did not fix the issue and neither did `ufw disable`. I attempted to remove `DNSMASQ_LISTENNING=local` from the PiHole `setupVars.conf` (added back) to no avail. 

### sudo iptables -vnL
```
Chain INPUT (policy DROP 5 packets, 250 bytes)
 pkts bytes target     prot opt in     out     source               destination         
  183 15110 ACCEPT     all  --  lo     *       0.0.0.0/0            0.0.0.0/0           
 1113  272K ACCEPT     all  --  *      *       0.0.0.0/0            0.0.0.0/0            ctstate RELATED,ESTABLISHED
    0     0 ACCEPT     esp  --  *      *       0.0.0.0/0            0.0.0.0/0           
    0     0 ACCEPT     ah   --  *      *       0.0.0.0/0            0.0.0.0/0           
    0     0 ACCEPT     icmp --  *      *       0.0.0.0/0            0.0.0.0/0            icmptype 8 limit: up to 5/sec burst 5 mode srcip
    0     0 ACCEPT     udp  --  *      *       0.0.0.0/0            0.0.0.0/0            multiport dports 123
    3   148 ACCEPT     tcp  --  *      *       0.0.0.0/0            0.0.0.0/0            tcp dpt:22 ctstate NEW
    0     0 ACCEPT     udp  --  *      *       0.0.0.0/0            172.31.141.238       udp dpt:53
 1800  121K ufw-before-logging-input  all  --  *      *       0.0.0.0/0            0.0.0.0/0           
 1800  121K ufw-before-input  all  --  *      *       0.0.0.0/0            0.0.0.0/0           
   66  3676 ufw-after-input  all  --  *      *       0.0.0.0/0            0.0.0.0/0           
   66  3676 ufw-after-logging-input  all  --  *      *       0.0.0.0/0            0.0.0.0/0           
   66  3676 ufw-reject-input  all  --  *      *       0.0.0.0/0            0.0.0.0/0           
   66  3676 ufw-track-input  all  --  *      *       0.0.0.0/0            0.0.0.0/0           

Chain FORWARD (policy DROP 0 packets, 0 bytes)
 pkts bytes target     prot opt in     out     source               destination         
    0     0 ACCEPT     all  --  *      *       10.0.8.0/24          10.0.8.0/24         
    0     0 DROP       all  --  *      *       10.0.8.0/24          169.254.0.0/16      
    0     0 ACCEPT     all  --  *      *       0.0.0.0/0            0.0.0.0/0            ctstate RELATED,ESTABLISHED
    0     0 ACCEPT     tcp  --  *      *       0.0.0.0/0            0.0.0.0/0            tcp dpt:445
    0     0 DROP       udp  --  *      *       0.0.0.0/0            0.0.0.0/0            multiport ports 137,138
    0     0 DROP       tcp  --  *      *       0.0.0.0/0            0.0.0.0/0            multiport ports 137,139
    0     0 ACCEPT     all  --  *      *       10.0.8.0/24          0.0.0.0/0            ctstate NEW policy match dir in pol none
    0     0 ufw-before-logging-forward  all  --  *      *       0.0.0.0/0            0.0.0.0/0           
    0     0 ufw-before-forward  all  --  *      *       0.0.0.0/0            0.0.0.0/0           
    0     0 ufw-after-forward  all  --  *      *       0.0.0.0/0            0.0.0.0/0           
    0     0 ufw-after-logging-forward  all  --  *      *       0.0.0.0/0            0.0.0.0/0           
    0     0 ufw-reject-forward  all  --  *      *       0.0.0.0/0            0.0.0.0/0           
    0     0 ufw-track-forward  all  --  *      *       0.0.0.0/0            0.0.0.0/0           

Chain OUTPUT (policy ACCEPT 0 packets, 0 bytes)
 pkts bytes target     prot opt in     out     source               destination         
    0     0 ACCEPT     all  --  *      *       0.0.0.0/0            10.0.8.0/24          owner GID match 15000
    0     0 DROP       all  --  *      *       0.0.0.0/0            169.254.0.0/16       owner GID match 15000
 1541  306K ufw-before-logging-output  all  --  *      *       0.0.0.0/0            0.0.0.0/0           
 1541  306K ufw-before-output  all  --  *      *       0.0.0.0/0            0.0.0.0/0           
  166 11698 ufw-after-output  all  --  *      *       0.0.0.0/0            0.0.0.0/0           
  166 11698 ufw-after-logging-output  all  --  *      *       0.0.0.0/0            0.0.0.0/0           
  166 11698 ufw-reject-output  all  --  *      *       0.0.0.0/0            0.0.0.0/0           
  166 11698 ufw-track-output  all  --  *      *       0.0.0.0/0            0.0.0.0/0           

Chain ufw-after-forward (1 references)
 pkts bytes target     prot opt in     out     source               destination         

Chain ufw-after-input (1 references)
 pkts bytes target     prot opt in     out     source               destination         
    0     0 ufw-skip-to-policy-input  udp  --  *      *       0.0.0.0/0            0.0.0.0/0            udp dpt:137
    0     0 ufw-skip-to-policy-input  udp  --  *      *       0.0.0.0/0            0.0.0.0/0            udp dpt:138
    0     0 ufw-skip-to-policy-input  tcp  --  *      *       0.0.0.0/0            0.0.0.0/0            tcp dpt:139
    0     0 ufw-skip-to-policy-input  tcp  --  *      *       0.0.0.0/0            0.0.0.0/0            tcp dpt:445
    0     0 ufw-skip-to-policy-input  udp  --  *      *       0.0.0.0/0            0.0.0.0/0            udp dpt:67
    0     0 ufw-skip-to-policy-input  udp  --  *      *       0.0.0.0/0            0.0.0.0/0            udp dpt:68
    0     0 ufw-skip-to-policy-input  all  --  *      *       0.0.0.0/0            0.0.0.0/0            ADDRTYPE match dst-type BROADCAST

Chain ufw-after-logging-forward (1 references)
 pkts bytes target     prot opt in     out     source               destination         
    0     0 LOG        all  --  *      *       0.0.0.0/0            0.0.0.0/0            limit: avg 3/min burst 10 LOG flags 0 level 4 prefix "[UFW BLOCK] "

Chain ufw-after-logging-input (1 references)
 pkts bytes target     prot opt in     out     source               destination         
   48  2928 LOG        all  --  *      *       0.0.0.0/0            0.0.0.0/0            limit: avg 3/min burst 10 LOG flags 0 level 4 prefix "[UFW BLOCK] "

Chain ufw-after-logging-output (1 references)
 pkts bytes target     prot opt in     out     source               destination         

Chain ufw-after-output (1 references)
 pkts bytes target     prot opt in     out     source               destination         

Chain ufw-before-forward (1 references)
 pkts bytes target     prot opt in     out     source               destination         
    0     0 ACCEPT     all  --  *      *       0.0.0.0/0            0.0.0.0/0            ctstate RELATED,ESTABLISHED
    0     0 ACCEPT     icmp --  *      *       0.0.0.0/0            0.0.0.0/0            icmptype 3
    0     0 ACCEPT     icmp --  *      *       0.0.0.0/0            0.0.0.0/0            icmptype 11
    0     0 ACCEPT     icmp --  *      *       0.0.0.0/0            0.0.0.0/0            icmptype 12
    0     0 ACCEPT     icmp --  *      *       0.0.0.0/0            0.0.0.0/0            icmptype 8
    0     0 ufw-user-forward  all  --  *      *       0.0.0.0/0            0.0.0.0/0           

Chain ufw-before-input (1 references)
 pkts bytes target     prot opt in     out     source               destination         
    0     0 ACCEPT     all  --  lo     *       0.0.0.0/0            0.0.0.0/0           
    0     0 ACCEPT     all  --  *      *       0.0.0.0/0            0.0.0.0/0            ctstate RELATED,ESTABLISHED
    5   208 ufw-logging-deny  all  --  *      *       0.0.0.0/0            0.0.0.0/0            ctstate INVALID
    5   208 DROP       all  --  *      *       0.0.0.0/0            0.0.0.0/0            ctstate INVALID
    0     0 ACCEPT     icmp --  *      *       0.0.0.0/0            0.0.0.0/0            icmptype 3
    0     0 ACCEPT     icmp --  *      *       0.0.0.0/0            0.0.0.0/0            icmptype 11
    0     0 ACCEPT     icmp --  *      *       0.0.0.0/0            0.0.0.0/0            icmptype 12
    0     0 ACCEPT     icmp --  *      *       0.0.0.0/0            0.0.0.0/0            icmptype 8
    0     0 ACCEPT     udp  --  *      *       0.0.0.0/0            0.0.0.0/0            udp spt:67 dpt:68
 1795  121K ufw-not-local  all  --  *      *       0.0.0.0/0            0.0.0.0/0           
    0     0 ACCEPT     udp  --  *      *       0.0.0.0/0            224.0.0.251          udp dpt:5353
    0     0 ACCEPT     udp  --  *      *       0.0.0.0/0            239.255.255.250      udp dpt:1900
 1795  121K ufw-user-input  all  --  *      *       0.0.0.0/0            0.0.0.0/0           

Chain ufw-before-logging-forward (1 references)
 pkts bytes target     prot opt in     out     source               destination         

Chain ufw-before-logging-input (1 references)
 pkts bytes target     prot opt in     out     source               destination         

Chain ufw-before-logging-output (1 references)
 pkts bytes target     prot opt in     out     source               destination         

Chain ufw-before-output (1 references)
 pkts bytes target     prot opt in     out     source               destination         
  183 15110 ACCEPT     all  --  *      lo      0.0.0.0/0            0.0.0.0/0           
 1192  279K ACCEPT     all  --  *      *       0.0.0.0/0            0.0.0.0/0            ctstate RELATED,ESTABLISHED
  166 11698 ufw-user-output  all  --  *      *       0.0.0.0/0            0.0.0.0/0           

Chain ufw-logging-allow (0 references)
 pkts bytes target     prot opt in     out     source               destination         
    0     0 LOG        all  --  *      *       0.0.0.0/0            0.0.0.0/0            limit: avg 3/min burst 10 LOG flags 0 level 4 prefix "[UFW ALLOW] "

Chain ufw-logging-deny (2 references)
 pkts bytes target     prot opt in     out     source               destination         
    5   208 RETURN     all  --  *      *       0.0.0.0/0            0.0.0.0/0            ctstate INVALID limit: avg 3/min burst 10
    0     0 LOG        all  --  *      *       0.0.0.0/0            0.0.0.0/0            limit: avg 3/min burst 10 LOG flags 0 level 4 prefix "[UFW BLOCK] "

Chain ufw-not-local (1 references)
 pkts bytes target     prot opt in     out     source               destination         
 1795  121K RETURN     all  --  *      *       0.0.0.0/0            0.0.0.0/0            ADDRTYPE match dst-type LOCAL
    0     0 RETURN     all  --  *      *       0.0.0.0/0            0.0.0.0/0            ADDRTYPE match dst-type MULTICAST
    0     0 RETURN     all  --  *      *       0.0.0.0/0            0.0.0.0/0            ADDRTYPE match dst-type BROADCAST
    0     0 ufw-logging-deny  all  --  *      *       0.0.0.0/0            0.0.0.0/0            limit: avg 3/min burst 10
    0     0 DROP       all  --  *      *       0.0.0.0/0            0.0.0.0/0           

Chain ufw-reject-forward (1 references)
 pkts bytes target     prot opt in     out     source               destination         

Chain ufw-reject-input (1 references)
 pkts bytes target     prot opt in     out     source               destination         

Chain ufw-reject-output (1 references)
 pkts bytes target     prot opt in     out     source               destination         

Chain ufw-skip-to-policy-forward (0 references)
 pkts bytes target     prot opt in     out     source               destination         
    0     0 DROP       all  --  *      *       0.0.0.0/0            0.0.0.0/0           

Chain ufw-skip-to-policy-input (7 references)
 pkts bytes target     prot opt in     out     source               destination         
    0     0 DROP       all  --  *      *       0.0.0.0/0            0.0.0.0/0           

Chain ufw-skip-to-policy-output (0 references)
 pkts bytes target     prot opt in     out     source               destination         
    0     0 ACCEPT     all  --  *      *       0.0.0.0/0            0.0.0.0/0           

Chain ufw-track-forward (1 references)
 pkts bytes target     prot opt in     out     source               destination         

Chain ufw-track-input (1 references)
 pkts bytes target     prot opt in     out     source               destination         

Chain ufw-track-output (1 references)
 pkts bytes target     prot opt in     out     source               destination         
   21  1260 ACCEPT     tcp  --  *      *       0.0.0.0/0            0.0.0.0/0            ctstate NEW
  145 10438 ACCEPT     udp  --  *      *       0.0.0.0/0            0.0.0.0/0            ctstate NEW

Chain ufw-user-forward (1 references)
 pkts bytes target     prot opt in     out     source               destination         
    0     0 ACCEPT     all  --  wg0    ens3    10.6.0.0/24          0.0.0.0/0           

Chain ufw-user-input (1 references)
 pkts bytes target     prot opt in     out     source               destination         
    0     0 ACCEPT     udp  --  *      *       0.0.0.0/0            0.0.0.0/0            udp dpt:20
    0     0 ACCEPT     tcp  --  *      *       0.0.0.0/0            0.0.0.0/0            tcp dpt:22 /* 'dapp_OpenSSH' */
    8   500 ACCEPT     tcp  --  *      *       0.0.0.0/0            0.0.0.0/0            multiport dports 80,443 /* 'dapp_Apache%20Full' */
    0     0 ACCEPT     tcp  --  *      *       0.0.0.0/0            0.0.0.0/0            tcp dpt:21
    0     0 ACCEPT     tcp  --  *      *       0.0.0.0/0            0.0.0.0/0            tcp dpt:25565
    0     0 ACCEPT     udp  --  *      *       0.0.0.0/0            0.0.0.0/0            udp dpt:25565
    0     0 ACCEPT     tcp  --  *      *       HOME_IP       0.0.0.0/0            tcp dpt:53
 1698  115K ACCEPT     udp  --  *      *       HOME_IP       0.0.0.0/0            udp dpt:53

Chain ufw-user-limit (0 references)
 pkts bytes target     prot opt in     out     source               destination         
    0     0 LOG        all  --  *      *       0.0.0.0/0            0.0.0.0/0            limit: avg 3/min burst 5 LOG flags 0 level 4 prefix "[UFW LIMIT BLOCK] "
    0     0 REJECT     all  --  *      *       0.0.0.0/0            0.0.0.0/0            reject-with icmp-port-unreachable

Chain ufw-user-limit-accept (0 references)
 pkts bytes target     prot opt in     out     source               destination         
    0     0 ACCEPT     all  --  *      *       0.0.0.0/0            0.0.0.0/0           

Chain ufw-user-logging-forward (0 references)
 pkts bytes target     prot opt in     out     source               destination         

Chain ufw-user-logging-input (0 references)
 pkts bytes target     prot opt in     out     source               destination         

Chain ufw-user-logging-output (0 references)
 pkts bytes target     prot opt in     out     source               destination         

Chain ufw-user-output (1 references)
 pkts bytes target     prot opt in     out     source               destination 
```

### ufw status numbered
```
Status: active

     To                         Action      From
     --                         ------      ----
[ 1] Anywhere on ens3           ALLOW FWD   10.6.0.0/24 on wg0        
[ 2] 20/udp                     ALLOW IN    Anywhere                  
[ 3] OpenSSH                    ALLOW IN    Anywhere                  
[ 4] Apache Full                ALLOW IN    Anywhere                  
[ 5] 21/tcp                     ALLOW IN    Anywhere                  
[ 6] 25565                      ALLOW IN    Anywhere                  
[ 7] 53                         ALLOW IN    HOME_IP
[ 8] 20/udp (v6)                ALLOW IN    Anywhere (v6)             
[ 9] OpenSSH (v6)               ALLOW IN    Anywhere (v6)             
[10] Apache Full (v6)           ALLOW IN    Anywhere (v6)             
[11] 21/tcp (v6)                ALLOW IN    Anywhere (v6)             
[12] 25565 (v6)                 ALLOW IN    Anywhere (v6) 
```

### tcpdump -i ens3 -nn port 53
```
tcpdump: verbose output suppressed, use -v or -vv for full protocol decode
listening on ens3, link-type EN10MB (Ethernet), capture size 262144 bytes
16:38:28.338627 IP HOME_IP.50861 > SERVER.53: 24282+ A? p09-keyvalueservice.icloud.com. (48)
16:38:28.344542 IP HOME_IP.51278 > SERVER.53: 848+ AAAA? p09-keyvalueservice.icloud.com. (48)
16:38:28.882057 IP HOME_IP.49409 > SERVER.53: 1849+ A? cma.itunes.apple.com. (38)
16:38:28.887795 IP HOME_IP.65161 > SERVER.53: 61560+ Type65? cma.itunes.apple.com. (38)
16:38:28.887795 IP HOME_IP.65424 > SERVER.53: 29062+ AAAA? cma.itunes.apple.com. (38)
.....
16:38:45.692722 IP6 .60614 > .53: 5130+ Type65? api-glb-euc1a.smoot.apple.com. (47)
16:38:46.222038 IP6 .54544 > .53: 55105+ AAAA? www.facebook.com. (34)
16:38:46.222038 IP6 .65363 > .53: 50264+ A? www.facebook.com. (34)
16:38:46.223590 IP6 53254 > .53: 15040+ Type65? www.facebook.com. (34)
16:38:47.262448 IP6 .54544 > .53: 55105+ AAAA? www.facebook.com. (34)
16:38:47.262546 IP6 .65363 > .53: 50264+ A? www.facebook.com. (34)
16:38:47.263981 IP6 .53254 > .53: 15040+ Type65? www.facebook.com. (34)
```

**Comment by Ge0rges** [comment]
Needed to set the pihole dnsmasq setting to listen on all interfaces by doing `pihole -a -i all`.

**Comment by Ge0rges** [comment]
In order to fix DNS for VPN clients I did `ufw allow in on wg0 to any port 53 from 10.6.0.0/24` to allow wg0 to make some DNS requests. 

I'd love to hear a more elegant or cleaner solution.

**Comment by davwheat** [comment]
I can't even access my SMB shares or web sever on my Pi after installing this, with ufw disabled, but I doubt that's related to this.

**Comment by Ashwin-droid** [comment]
**Prerequisites:** _pihole and pivpn are on the same machines_

Update your system and pihole with
'''
sudo apt-get update
sudo apt-get full-upgrade 
sudo pihole flush //do at your own risk
sudo pihole updatePihole
sudo pihole updateGravity
sudo pihole reconfigure  //do at your own risk
'''
Reconfigure it by
'''

sudo curl -L install.pivpn.io | sudo bash
'''
Wait some time then reconfigure => your personal setting till dns/protocol/port => no => set your settings or let it be default 

When it says " **_we have detected pihole installation. Do you want to set pihole as DNS?_**" then select yes

**Comment by orazioedoardo** [comment]
> Needed to set the pihole dnsmasq setting to listen on all interfaces by doing pihole -a -i all and in setupVars.conf I changed to DNSMASQ_LISTENING=all

If Pi-hole is detected when installing PiVPN, the script runs `pihole -a -i local` such that pihole listens on [all interfaces](https://github.com/pivpn/pivpn/blob/d7771c251418fa443869397d46f93c5b0c197558/auto_install/install.sh#L1472-L1475) (interfaces for which you have an IP on, like eth0, wg0).

> Wish PiVPN wouldn't change what interfaces are being listened to, and instead just add it's own interface.

We did in the past but it caused issues. If a pihole user has "listen only on interface eth0" (default), and then you add wg0, that's fine. However if later that user changes to "listen on all interfaces", pihole will actually listen on wg0 only. This is dnsmasq behaviour AFAIK.

> However DNS resolving doesn't work for VPN clients so far.

It doesn't because you have UFW installed which blocks everything unless allowed.

> In order to fix DNS for VPN clients I did ufw allow in on wg0 to any port 53 from 10.6.0.0/24 to allow wg0 to make some DNS requests.

That's actually the correct fix, we should add this to the script if UFW is detected when using pihole with pivpn.

> After installing PiVPN (Wireguard), devices on my home network can no longer resolve DNS queries.

This should not occur with "Listen on all interfaces", though.

**Comment by 4s3ti** [comment]
@orazioedoardo is there still anything to be done about this?

**Comment by EWouters** [comment]
Not sure if [this(1)](https://github.com/pivpn/pivpn/blob/master/auto_install/install.sh#L2083) fixes it or a [patch(2)](https://github.com/EWouters/pivpn/commit/2587d654753261833eb3f47b63bde373ebe5846b) is still needed.

(1) `$SUDO ufw route insert 1 allow in on "${pivpnDEV}" from "${pivpnNET}/${subnetClass}" out on "${IPv4dev}" to any >/dev/null`

(2) `$SUDO ufw insert 1 allow in on "${pivpnDEV}" to any port 53 from "${pivpnNET}/${subnetClass}" >/dev/null` <details>
```
---
 auto_install/install.sh | 6 ++++++
 1 file changed, 6 insertions(+)

diff --git a/auto_install/install.sh b/auto_install/install.sh
index 2875b31..36231ee 100755
--- a/auto_install/install.sh
+++ b/auto_install/install.sh
@@ -1473,6 +1473,12 @@ askClientDNS(){
 
 			echo "pivpnDNS1=${pivpnDNS1}" >> ${tempsetupVarsFile}
 			echo "pivpnDNS2=${pivpnDNS2}" >> ${tempsetupVarsFile}
+
+			# Allow DNS requests through UFW.
+			if [ "$USING_UFW" -eq 1 ]; then
+				$SUDO ufw insert 1 allow in on "${pivpnDEV}" to any port 53 from "${pivpnNET}/${subnetClass}" >/dev/null
+			fi
+
 			return
 		fi
 	fi
-- 
```
</details>

**Comment by orazioedoardo** [comment]
@EWouters rule (1) is for traffic forwarding, we need rules (2) to allow incoming traffic (thus not forwarded) to port 53. Can open the pull request?
