### ISSUE TITLE
[BUG] WireGuard tunnel doesn't forward *all* traffic

### ISSUE THREAD

**Issue by pennal** [pivpn/pivpn#1146]
## In raising this issue, I confirm the following: 

`{please fill the checkboxes, e.g: [X]}`

- [X] I have read and understood the [contributors guide](https://github.com/pivpn/pivpn/blob/master/CONTRIBUTING.md).
- [] The issue I am reporting can be *replicated*.
- [X] The issue I am reporting can be *is* directly related to the pivpn installer script.
- [X] The issue I am reporting isn't a duplicate (see [FAQs](https://github.com/pivpn/pivpn/wiki/FAQ), [closed issues](https://github.com/pivpn/pivpn/issues?q=is%3Aissue+sort%3Aupdated-desc+is%3Aclosed), and [open issues](https://github.com/pivpn/pivpn/issues?q=is%3Aissue+sort%3Aupdated-desc+is%3Aopen)).

**Describe the bug**
I have recently removed OpenVPN (installed with pivpn) and reinstalled WireGuard using the uninstall command, rebooting and then reinstalling by downloading a fresh version of pivpn using the installer. The installation went fine, and I can connect to the server without any issues, but the traffic is not forwarded. The public IP of the device seems to be correct (i.e. it's the same as where the server is installed) and on iOS and macOS the connection is established.I can see the packets being sent, but whenever I try to connect to any device on the network, it doesn't work (i.e. it cannot find the device). A simple lanscan also returns the devices on my current network, and not the ones where my VPN is installed.

On this machine, I have docker running with a few images. I remember that a few years ago I had a similar issue, which was due to Docker and the way that iptables are setup. If needed, I can provide info on that setup.

I performed the steps outlined in the FAQs (output below) and everything seems to be correctly setup. 

-----------------------------------------
`pivpn -d`

OUTPUT:
```
::::        PiVPN debug      ::::
=============================================
::::        Latest commit        ::::
commit 32bd1c628af9e1926f3f4471c0bf49c74deff7c7
Author: Orazio <orazioedoardo@users.noreply.github.com>
Date:   Fri Jul 24 18:52:57 2020 +0200

    Update LatestUpdate.md
=============================================
::::        Installation settings        ::::
PLAT=Raspbian
OSCN=jessie
USING_UFW=0
IPv4dev=eth0
dhcpReserv=1
IPv4addr=192.168.1.100/24
IPv4gw=192.168.1.1
install_user=pi
install_home=/home/pi
VPN=wireguard
pivpnPORT=1194
pivpnDNS1=9.9.9.9
pivpnDNS2=149.112.112.112
pivpnHOST=REDACTED
INPUT_CHAIN_EDITED=0
FORWARD_CHAIN_EDITED=1
pivpnPROTO=udp
pivpnDEV=wg0
pivpnNET=10.6.0.0
subnetClass=24
UNATTUPG=1
INSTALLED_PACKAGES=(raspberrypi-kernel-headers wireguard wireguard-tools wireguard-dkms qrencode)
=============================================
::::  Server configuration shown below   ::::
[Interface]
PrivateKey = server_priv
Address = 10.6.0.1/24
ListenPort = 1194
### begin retina-<redacted> ###
[Peer]
PublicKey = retina-<redacted>_pub
PresharedKey = retina-<redacted>_psk
AllowedIPs = 10.6.0.2/32
### end retina-<redacted> ###
=============================================
::::  Client configuration shown below   ::::
[Interface]
PrivateKey = retina-<redacted>_priv
Address = 10.6.0.2/24
DNS = 9.9.9.9, 149.112.112.112

[Peer]
PublicKey = server_pub
PresharedKey = retina-<redacted>_psk
Endpoint = REDACTED:1194
AllowedIPs = 0.0.0.0/0, ::0/0
=============================================
::::    Recursive list of files in   ::::
::::[4m/etc/wireguard shown below    ::::
/etc/wireguard:
configs  keys  wg0.conf

/etc/wireguard/configs:
clients.txt  retina-<redacted>.conf

/etc/wireguard/keys:
retina-<redacted>_priv  retina-<redacted>_psk  retina-<redacted>_pub  server_priv  server_pub
=============================================
::::        Self check       ::::
:: [OK] IP forwarding is enabled
:: [OK] Iptables MASQUERADE rule set
:: [OK] Iptables FORWARD rule set
:: [OK] WireGuard is running
:: [OK] WireGuard is enabled (it will automatically start on reboot)
:: [OK] WireGuard is listening on port 1194/udp
=============================================
:::: Having trouble connecting? Take a look at the FAQ:
:::: https://github.com/pivpn/pivpn/wiki/FAQ
=============================================
:::: WARNING: This script should have automatically masked sensitive       ::::
:::: information, however, still make sure that PrivateKey, PublicKey      ::::
:::: and PresharedKey are masked before reporting an issue. An example key ::::
:::: that you should NOT see in this log looks like this:                  ::::
:::: YIAoJVsdIeyvXfGGDDadHh6AxsMRymZTnnzZoAb9cxRe                          ::::
=============================================
::::        Debug complete       ::::
```
-----------------------------------------
`lsmod | grep wireguard`

OUTPUT:
```
wireguard             160826  0
ip6_udp_tunnel          2177  1 wireguard
udp_tunnel              4505  1 wireguard
ipv6                  408971  159 wireguard,bridge
```
-----------------------------------------
`cat /etc/pivpn/wireguard/setupVars.conf`

OUTPUT:
```
PLAT=Raspbian
OSCN=jessie
USING_UFW=0
IPv4dev=eth0
dhcpReserv=1
IPv4addr=192.168.1.100/24
IPv4gw=192.168.1.1
install_user=pi
install_home=/home/pi
VPN=wireguard
pivpnPORT=1194
pivpnDNS1=9.9.9.9
pivpnDNS2=149.112.112.112
pivpnHOST=<REDACTED>
INPUT_CHAIN_EDITED=0
FORWARD_CHAIN_EDITED=1
pivpnPROTO=udp
pivpnDEV=wg0
pivpnNET=10.6.0.0
subnetClass=24
UNATTUPG=1
INSTALLED_PACKAGES=(raspberrypi-kernel-headers wireguard wireguard-tools wireguard-dkms qrencode)
```

-------------------------------
`tcpdump -n -i eth0 udp port 1194`

OUTPUT:
```
sudo tcpdump -n -i eth0 udp port 1194
tcpdump: verbose output suppressed, use -v or -vv for full protocol decode
listening on eth0, link-type EN10MB (Ethernet), capture size 262144 bytes
15:04:28.830023 IP 92.104.148.75.58236 > 192.168.1.100.1194: UDP, length 148
15:04:28.834197 IP 192.168.1.100.1194 > 92.104.148.75.58236: UDP, length 92
15:04:28.932520 IP 92.104.148.75.58236 > 192.168.1.100.1194: UDP, length 96
15:04:28.932522 IP 92.104.148.75.58236 > 192.168.1.100.1194: UDP, length 96
15:04:28.933029 IP 92.104.148.75.58236 > 192.168.1.100.1194: UDP, length 112
15:04:28.939683 IP 192.168.1.100.1194 > 92.104.148.75.58236: UDP, length 256
15:04:28.943125 IP 192.168.1.100.1194 > 92.104.148.75.58236: UDP, length 224
15:04:28.943856 IP 192.168.1.100.1194 > 92.104.148.75.58236: UDP, length 224
15:04:28.957015 IP 92.104.148.75.58236 > 192.168.1.100.1194: UDP, length 96
15:04:29.254044 IP 92.104.148.75.58236 > 192.168.1.100.1194: UDP, length 112
15:04:29.261745 IP 192.168.1.100.1194 > 92.104.148.75.58236: UDP, length 240
15:04:29.263922 IP 92.104.148.75.58236 > 192.168.1.100.1194: UDP, length 112
15:04:29.270854 IP 192.168.1.100.1194 > 92.104.148.75.58236: UDP, length 176
15:04:29.277273 IP 92.104.148.75.58236 > 192.168.1.100.1194: UDP, length 96
15:04:29.284016 IP 92.104.148.75.58236 > 192.168.1.100.1194: UDP, length 96
15:04:29.447780 IP 192.168.1.100.1194 > 92.104.148.75.58236: UDP, length 224
15:04:29.628284 IP 92.104.148.75.58236 > 192.168.1.100.1194: UDP, length 112
15:04:29.635480 IP 192.168.1.100.1194 > 92.104.148.75.58236: UDP, length 224
15:04:31.537134 IP 92.104.148.75.58236 > 192.168.1.100.1194: UDP, length 96
15:04:31.545125 IP 192.168.1.100.1194 > 92.104.148.75.58236: UDP, length 128
15:04:31.563270 IP 92.104.148.75.58236 > 192.168.1.100.1194: UDP, length 96
15:04:31.563272 IP 92.104.148.75.58236 > 192.168.1.100.1194: UDP, length 96
15:04:31.583660 IP 192.168.1.100.1194 > 92.104.148.75.58236: UDP, length 96
15:04:31.583914 IP 192.168.1.100.1194 > 92.104.148.75.58236: UDP, length 96
15:04:31.598603 IP 92.104.148.75.58236 > 192.168.1.100.1194: UDP, length 96
15:04:31.598605 IP 92.104.148.75.58236 > 192.168.1.100.1194: UDP, length 608
15:04:31.600081 IP 92.104.148.75.58236 > 192.168.1.100.1194: UDP, length 96
15:04:31.600083 IP 92.104.148.75.58236 > 192.168.1.100.1194: UDP, length 608
...
```

**To Reproduce**
_Cannot be reproduced_

**Expected behavior**
I should be able to access the devices on my network

**Desktop (please complete the following information):**
 - WireGuard
 - OS: macOS
 - Version 10.14.6

**Smartphone (please complete the following information):**
 - WireGuard
 - Device: iPhone6s
 - OS: iOS
 - Version 13.7

**Additional context**
_None_

**Comment by andreasfors** [comment]
could you please provide a output from:
`sudo ip route list`

**Comment by pennal** [comment]
Sure, here it is:

```
default via 192.168.1.1 dev eth0  metric 202
10.6.0.0/24 dev wg0  proto kernel  scope link  src 10.6.0.1
169.254.0.0/16 dev br-731eed623186  proto kernel  scope link  src 169.254.216.150  metric 205
169.254.0.0/16 dev docker0  proto kernel  scope link  src 169.254.26.28  metric 206
169.254.0.0/16 dev veth291a681  proto kernel  scope link  src 169.254.214.98  metric 216
169.254.0.0/16 dev veth840a357  proto kernel  scope link  src 169.254.170.98  metric 218
169.254.0.0/16 dev vethb707f14  proto kernel  scope link  src 169.254.199.27  metric 220
169.254.0.0/16 dev veth515d58a  proto kernel  scope link  src 169.254.41.253  metric 222
172.17.0.0/16 dev docker0  proto kernel  scope link  src 172.17.0.1
172.18.0.0/16 dev br-731eed623186  proto kernel  scope link  src 172.18.0.1
192.168.1.0/24 dev eth0  proto kernel  scope link  src 192.168.1.100  metric 202
```

**Comment by andreasfors** [comment]
to me that output says that only traffic toward the network 10.6.0.0/24 will get routed thru your wg0 device.

If these where your nameserver
DNS = 9.9.9.9, 149.112.112.112.

`sudo ip route add 9.9.9.9/32 via 10.6.0.2/32 dev wg0`
Not 100% thats the correct line for you. 

but you are missing the routes

**Comment by orazioedoardo** [comment]
Do you have 192.168.1.0/24 on both the raspberry pi network as well as the network you are testing the vpn from?

**Comment by pennal** [comment]
> but you are missing the routes
That's what I suspected....I am going to look into it a bit more and see what I can find

**Comment by pennal** [comment]
> Do you have 192.168.1.0/24 on both the raspberry pi network as well as the network you are testing the vpn from?

No, and I think this is the culprit. 192.168.1.0 does not exist on the network, and the DHCP Server hands out addresses from 192.168.1.101 to 192.168.1.220. Is this of any help?

**Comment by orazioedoardo** [comment]
I meant "do you have the ip range 192.168.0.1-255 on both networks?"

**Comment by pennal** [comment]
Both the networks use 192.168.1.1-255 for the addresses

**Comment by orazioedoardo** [comment]
https://github.com/pivpn/pivpn/issues/958#issuecomment-589003985

**Comment by pennal** [comment]
Ok, I just tested this with my phone and it checks out. This means that if I am connected to a network that uses the same dhcp range then there may be collisions. Changing the remote lan might then be the only way to make this work. Thanks for the help!
