### ISSUE TITLE
[Support] VPN server stopped working

### ISSUE THREAD

**Issue by zillemarco** [pivpn/pivpn#1077]
- [] I have read and understood the [contributors guide](https://github.com/pivpn/pivpn/blob/master/CONTRIBUTING.md).
- [] The issue I am reporting can be *replicated*.
- [] The issue I am reporting can be *is* directly related to the pivpn installer script.
- [X] The issue I am reporting isn't a duplicate (see [FAQs](https://github.com/pivpn/pivpn/wiki/FAQ), [closed issues](https://github.com/pivpn/pivpn/issues?q=is%3Aissue+sort%3Aupdated-desc+is%3Aclosed), and [open issues](https://github.com/pivpn/pivpn/issues?q=is%3Aissue+sort%3Aupdated-desc+is%3Aopen)).

### Issue
I installed `pivpn`, setup to use `wireguard`, on our server months ago and everything worked wornderfully up to this morning (we noticed it this morning but 15 days ago was still working fine).
The problem we encountered is that the peers cannot access the internet, even browsing a website.

Trying to identify the issue I tried everything (restart the server, restart wireguard, various suggestions online, etc) but nothing worked so I decided to reinstall pivpn from scratch.
After installation it still wasn't working.
The problem though seems to be related to a forwarding issue since with `tcpdump` I can see the incoming packets but no response.

Following what the FAQs say this is what I could see:

### Console output of      `pivpn -d`
```
::::		PiVPN debug		 ::::
=============================================
::::		Latest commit		 ::::
commit b2ab7fc862e31da92576d51609f250701eb6e02c (grafted, HEAD -> master, origin/test, origin/master, origin/HEAD)
Author: Orazio <orazioedoardo@users.noreply.github.com>
Date:   Tue Jun 9 15:45:38 2020 +0200

    Fix change from pull request #1000 that prevented 'pivpn -l' to show revoked client names
=============================================
::::	    Installation settings    	 ::::
PLAT=Ubuntu
OSCN=bionic
USING_UFW=0
IPv4dev=eth0
install_user=vpn
install_home=/home/vpn
VPN=wireguard
pivpnPORT=51820
pivpnDNS1=8.8.8.8
pivpnDNS2=8.8.4.4
pivpnHOST=REDACTED
INPUT_CHAIN_EDITED=0
FORWARD_CHAIN_EDITED=1
pivpnPROTO=udp
pivpnDEV=wg0
pivpnNET=10.6.0.0
subnetClass=24
UNATTUPG=1
INSTALLED_PACKAGES=()
=============================================
::::  Server configuration shown below   ::::
[Interface]
PrivateKey = server_priv
Address = 10.6.0.1/24
ListenPort = 51820
### begin example ###
[Peer]
PublicKey = example_pub
PresharedKey = example_psk
AllowedIPs = 10.6.0.2/32
### end example ###
=============================================
::::  Client configuration shown below   ::::
[Interface]
PrivateKey = example_priv
Address = 10.6.0.2/24
DNS = 8.8.8.8, 8.8.4.4

[Peer]
PublicKey = server_pub
PresharedKey = example_psk
Endpoint = REDACTED:51820
AllowedIPs = 0.0.0.0/0, ::0/0
=============================================
:::: 	Recursive list of files in	 ::::
::::	[4m/etc/wireguard shown below	 ::::
/etc/wireguard:
configs  keys  wg0.conf

/etc/wireguard/configs:
clients.txt  MarcoZ.conf

/etc/wireguard/keys:
example_priv  example_psk  example_pub  server_priv  server_pub
=============================================
::::		Self check		 ::::
:: [OK] IP forwarding is enabled
:: [OK] Iptables MASQUERADE rule set
:: [OK] Iptables FORWARD rule set
:: [OK] WireGuard is running
:: [OK] WireGuard is enabled (it will automatically start on reboot)
:: [OK] WireGuard is listening on port 51820/udp
=============================================
:::: Having trouble connecting? Take a look at the FAQ:
:::: https://github.com/pivpn/pivpn/wiki/FAQ
=============================================
:::: WARNING: This script should have automatically masked sensitive       ::::
:::: information, however, still make sure that PrivateKey, PublicKey      ::::
:::: and PresharedKey are masked before reporting an issue. An example key ::::
:::: that you should NOT see in this log looks like this:                  ::::
:::: YIAoJVsdIeyvXfGGDDadHh6AxsMRymZTnnzZoAb9cxRe                          ::::
=============================================
::::		Debug complete		 ::::

```

### Console output of `lsmod | grep wireguard`
```
wireguard             217088  0
ip6_udp_tunnel         16384  1 wireguard
udp_tunnel             16384  1 wireguard
```

### Console output of `cat /etc/pivpn/setupVars.conf`
This file doesn't exist but I could find the file `/etc/pivpn/wireguard/setupVars.conf` and this is its content
```
PLAT=Ubuntu
OSCN=bionic
USING_UFW=0
IPv4dev=eth0
install_user=vpn
install_home=/home/vpn
VPN=wireguard
pivpnPORT=51820
pivpnDNS1=8.8.8.8
pivpnDNS2=8.8.4.4
pivpnHOST=<hidden>
INPUT_CHAIN_EDITED=0
FORWARD_CHAIN_EDITED=1
pivpnPROTO=udp
pivpnDEV=wg0
pivpnNET=10.6.0.0
subnetClass=24
UNATTUPG=1
INSTALLED_PACKAGES=()
```

### Console output of `tcpdump`
```
vpn@vpn:~$ sudo tcpdump -n -i eth0 udp port 51820
tcpdump: verbose output suppressed, use -v or -vv for full protocol decode
listening on eth0, link-type EN10MB (Ethernet), capture size 262144 bytes
11:38:59.561930 IP <hidden>.59240 > 192.168.20.210.51820: UDP, length 148
11:39:04.597931 IP <hidden>.59240 > 192.168.20.210.51820: UDP, length 148
11:39:09.759826 IP <hidden>.59240 > 192.168.20.210.51820: UDP, length 148
11:39:14.809137 IP <hidden>.59240 > 192.168.20.210.51820: UDP, length 148
11:39:19.864651 IP <hidden>.59240 > 192.168.20.210.51820: UDP, length 148
5 packets captured
5 packets received by filter
0 packets dropped by kernel
```

### Console output of `sudo iptables -S`
```
-P INPUT ACCEPT
-P FORWARD ACCEPT
-P OUTPUT ACCEPT
-A FORWARD -d 10.6.0.0/24 -i eth0 -o wg0 -m conntrack --ctstate RELATED,ESTABLISHED -m comment --comment wireguard-forward-rule -j ACCEPT
-A FORWARD -s 10.6.0.0/24 -i wg0 -o eth0 -m comment --comment wireguard-forward-rule -j ACCEPT
-A FORWARD -i eth0 -j ACCEPT
-A FORWARD -o wg0 -j ACCEPT
```

### Console output of `sudo iptables -t nat -S` (there is an additional route to forward from `eth0` to `eth1` which has always worked in the past)
```
-P PREROUTING ACCEPT
-P INPUT ACCEPT
-P OUTPUT ACCEPT
-P POSTROUTING ACCEPT
-A POSTROUTING -s 10.6.0.0/24 -o eth0 -m comment --comment wireguard-nat-rule -j MASQUERADE
-A POSTROUTING -o eth0 -j MASQUERADE
-A POSTROUTING -o eth1 -j MASQUERADE
```

### Console output of `sudo wg show wg0`
```
interface: wg0
  public key: <hidden>
  private key: (hidden)
  listening port: 51820

peer: lovGkkOJ7qWhPq/zaCMthKZV7lI2VQaUjiBwZhkU3Dc=
  preshared key: (hidden)
  allowed ips: 10.6.0.2/32
```

**Comment by orazioedoardo** [comment]
> Console output of cat /etc/pivpn/setupVars.conf
>
> This file doesn't exist but I could find the file /etc/pivpn/wireguard/setupVars.conf and this is its content

Oh yes I should update that.

> /etc/wireguard/configs:
> clients.txt  MarcoZ.conf
> 
> /etc/wireguard/keys:
> example_priv  example_psk  example_pub  server_priv  server_pub

Do you actually have MarcoZ.conf and example or you just changed the text in the issue?

There are some rules with have not been added by pivpn, they should not interfere as those are place after pivpn rules.

> The problem though seems to be related to a forwarding issue since with tcpdump I can see the incoming packets but no response

Any chance you are accidentally trying to connect with the old configuration?

**Comment by zillemarco** [comment]
> Do you actually have MarcoZ.conf and example or you just changed the text in the issue?
Silly me...should have used find and replace instead of doing it manually.

> Any chance you are accidentally trying to connect with the old configuration?
I uninstalled `pivpn` and restarted the VPN server so nothing should have been left of the old configuration on the server (except that route from `eth0` to `eth1`). Also, on the client I was testing the connection I made sure to delete the old configuration from wireguard. Anyway, to be sure I created a test user which has never been created before and the issue still remains the same.

**Comment by zillemarco** [comment]
The thing is, I noticed that the peers actually seems to not even reach wireguard because running `pivpn -c` the output is
```
::: Connected Clients List :::
Name        Remote IP      Virtual IP      Bytes Received      Bytes Sent      Last Seen
example      (none)         10.6.0.2        0B                  0B              (not yet)
test        (none)         10.6.0.3        0B                  0B              (not yet)
```

When I connect with one of these I see that packets are coming from those peers using `tcpdump` but they seem to not be able to connect.

**Comment by orazioedoardo** [comment]
Temporarily replace the public IP/domain name of the endpoint line with the internal IP and try to connect from the internal network.

**Comment by zillemarco** [comment]
@orazioedoardo do you mean I have to set `pivpnHOST` to the IP assigned to `eth0` (the interface I told pivpn to use)?

**Comment by orazioedoardo** [comment]
In the client config, set `Endpoint = [...]` to the IP of eth0, it should be `Endpoint = 192.168.20.210:51820`.

**Comment by zillemarco** [comment]
Same result. This is the output from `tcpdump`:
```
tcpdump: verbose output suppressed, use -v or -vv for full protocol decode
listening on eth0, link-type EN10MB (Ethernet), capture size 262144 bytes
15:46:24.845524 IP 192.168.10.7.64050 > 192.168.20.210.51820: UDP, length 148
15:46:29.963239 IP 192.168.10.7.64050 > 192.168.20.210.51820: UDP, length 148
15:46:35.134061 IP 192.168.10.7.64050 > 192.168.20.210.51820: UDP, length 148
3 packets captured
3 packets received by filter
0 packets dropped by kernel
```

**Comment by orazioedoardo** [comment]
Routing table? `ip r`

**Comment by zillemarco** [comment]
Here it is:
```
default via 192.168.10.138 dev eth1 proto static 
default via 192.168.20.138 dev eth0 proto static 
10.6.0.0/24 dev wg0 proto kernel scope link src 10.6.0.1 
192.168.10.0/24 dev eth1 proto kernel scope link src 192.168.10.210 
192.168.20.0/24 dev eth0 proto kernel scope link src 192.168.20.210 
```

**Comment by orazioedoardo** [comment]
Can you temporarily remove the POSTROUTING rules?

```
sudo iptables -t nat -D POSTROUTING -o eth0 -j MASQUERADE
sudo iptables -t nat -D POSTROUTING -o eth1 -j MASQUERADE
```

**Comment by zillemarco** [comment]
Tried removing POSTROUTING with the commands you gave me and started `tcpdump` on two terminals (one for `eth0` and one for `eth1`) but nothing changed.

This if the output of `sudo iptables -t nat -S` after running the commands:
```
-P PREROUTING ACCEPT
-P INPUT ACCEPT
-P OUTPUT ACCEPT
-P POSTROUTING ACCEPT
-A POSTROUTING -s 10.6.0.0/24 -o eth0 -m comment --comment wireguard-nat-rule -j MASQUERADE
```

The output of `ip r` and `sudo iptables -S` are still the same.

**Comment by orazioedoardo** [comment]
If you run `traceroute 8.8.8.8`, does traffic go through 192.168.10.210 or 192.168.20.210? What about `traceroute 192.168.10.7`

> started tcpdump on two terminals (one for eth0 and one for eth1) but nothing changed.

Did you see some output on eth1?

**Comment by zillemarco** [comment]
This is the output of `traceroute 192.168.10.185` (I had to change the PC I used as test-peer and `192.168.10.185` is the IP address of the new PC), ran from the VPN server where pivpn is installed:
```
traceroute to 192.168.10.185 (192.168.10.185), 64 hops max
  1   192.168.10.185  71.774ms  1.493ms  1.487ms 
```

This is the output of `traceroute 8.8.8.8`, ran from the VPN server where pivpn is installed:
```
traceroute to 8.8.8.8 (8.8.8.8), 64 hops max
  1   *   *   *
  2   *   *   *
  3   *   *   *
  ...
```

> Did you see some output on eth1?

No, nothing.

**Comment by orazioedoardo** [comment]
I'm not sure if wireguard is working at this point because if you are connecting from 192.168.10.185 you should see outgoing traffic on eth1.

Silly test, connect to wireguard from localhost: replace endpoint with `Endpoint = 127.0.0.1:51820` and run `wg-quick up ./MarcoZ.conf`, then `pivpn -c`. Connected? (`wg-quick down ./MarcoZ.conf` to bring down the interface).

**Comment by zillemarco** [comment]
I changed `MarcoZ.conf` to `example_2.conf` because after lunch I removed `MarcoZ` and started using `example` and `example_2` to be sure the configuration files were new.

I edited the configuration file located at `/etc/wireguard/configs/example_2.conf` changing the endpoint and run `wg-quick up /etc/wireguard/configs/example_2.conf` and its output is:
```
Warning: `/etc/wireguard/configs/example_2.conf' is world accessible
[#] ip link add example_2 type wireguard
[#] wg setconf example_2 /dev/fd/63
[#] ip -4 address add 10.6.0.2/24 dev example_2
[#] ip link set mtu 65456 up dev example_2
[#] resolvconf -a example_2 -m 0 -x
/usr/bin/wg-quick: line 32: resolvconf: command not found
[#] ip link delete dev example_2
```

And this is the output from `pivpn -c`:
```
::: Connected Clients List :::
Name           Remote IP      Virtual IP      Bytes Received      Bytes Sent      Last Seen
example_2      (none)         10.6.0.2        0B                  0B              (not yet)
```

**Comment by zillemarco** [comment]
Maybe a step forward: seeing the error reported by `wg-quick` I installed `openresolv` and connecting from localhost actually worked. Thinking the issue was finally fixed I tried adding an `example_3` user but sadly didn't work.

This is the output of `pivpn -c` after these changes:
```
::: Connected Clients List :::
Name           Remote IP            Virtual IP      Bytes Received      Bytes Sent      Last Seen
example_2      127.0.0.1:47436      10.6.0.2        180B                92B             Jun 30 2020 - 18:08:24
example_3      (none)               10.6.0.4        0B                  0B              (not yet)
```

**Comment by orazioedoardo** [comment]
Can connect from localhost, so WireGuard should be working. Now try to tcpdump on every interface and see if some packets actually leave the server `sudo tcpdump -n udp port 51820`. Try to connect from local network and/or outside.

**Comment by zillemarco** [comment]
These are the tests I ran.

### Connected from localhost (I turned up the interface while tracking with `tcpdump`)
```
vpn@vpn:~$ sudo tcpdump -n udp port 51820
[sudo] password for vpn: 
tcpdump: verbose output suppressed, use -v or -vv for full protocol decode
listening on eth0, link-type EN10MB (Ethernet), capture size 262144 bytes
0 packets captured
0 packets received by filter
0 packets dropped by kernel

vpn@vpn:~$ sudo tcpdump -n -i eth0 udp port 51820
tcpdump: verbose output suppressed, use -v or -vv for full protocol decode
listening on eth0, link-type EN10MB (Ethernet), capture size 262144 bytes
0 packets captured
0 packets received by filter
0 packets dropped by kernel

vpn@vpn:~$ sudo tcpdump -n -i eth1 udp port 51820
tcpdump: verbose output suppressed, use -v or -vv for full protocol decode
listening on eth1, link-type EN10MB (Ethernet), capture size 262144 bytes
0 packets captured
0 packets received by filter
0 packets dropped by kernel

vpn@vpn:~$ sudo tcpdump -n -i example_2 udp port 51820
tcpdump: verbose output suppressed, use -v or -vv for full protocol decode
listening on example_2, link-type RAW (Raw IP), capture size 262144 bytes
0 packets captured
0 packets received by filter
0 packets dropped by kernel
```

### Connected from an outside mobile network
```
vpn@vpn:~$ sudo tcpdump -n udp port 51820
tcpdump: verbose output suppressed, use -v or -vv for full protocol decode
listening on eth0, link-type EN10MB (Ethernet), capture size 262144 bytes
08:21:02.079873 IP 5.90.79.160.38896 > 192.168.20.210.51820: UDP, length 148
08:21:07.349315 IP 5.90.79.160.38896 > 192.168.20.210.51820: UDP, length 148
2 packets captured
2 packets received by filter
0 packets dropped by kernel
```

### Connected from a device on the local network
```
vpn@vpn:~$ sudo tcpdump -n udp port 51820
tcpdump: verbose output suppressed, use -v or -vv for full protocol decode
listening on eth0, link-type EN10MB (Ethernet), capture size 262144 bytes
08:24:58.560479 IP 192.168.10.184.59227 > 192.168.20.210.51820: UDP, length 148
08:25:03.847142 IP 192.168.10.184.59227 > 192.168.20.210.51820: UDP, length 148
08:25:09.010436 IP 192.168.10.184.59227 > 192.168.20.210.51820: UDP, length 148
3 packets captured
3 packets received by filter
0 packets dropped by kernel
```

**Comment by orazioedoardo** [comment]
Tcpdump captures traffic at the "edges" of the flow: immediately when entering the computer and just before leaving the computer. The fact that `sudo tcpdump -n udp port 51820` shows no response, considering that the firewall should not stop packets from leaving the computer (iptables OUTPUT chain is empty and his policy is ACCEPt), to me means that wireguard is not responding.

See if you can enable dynamic debugging: as root run `echo module wireguard +p > /sys/kernel/debug/dynamic_debug/control`. You should see wireguard logs in the `dmesg` when connecting.

**Comment by zillemarco** [comment]
I ran the command you gave me then I connected from a PC on an enternal network.
This is what `dmesg` prints after that. It's not the full output but it's where I started seeing wireguard, if you need it all just tell me.
```
[  152.858688] new mount options do not match the existing superblock, will be ignored
[  158.605288] wireguard: module verification failed: signature and/or required key missing - tainting kernel
[  158.605869] wireguard: WireGuard 1.0.20200623 loaded. See www.wireguard.com for information.
[  158.605870] wireguard: Copyright (C) 2015-2019 Jason A. Donenfeld <Jason@zx2c4.com>. All Rights Reserved.
[  980.693205] device eth0 entered promiscuous mode
[ 1026.409808] device eth0 left promiscuous mode
[ 1300.949955] device eth0 entered promiscuous mode
[ 1321.973611] device eth0 left promiscuous mode
[ 4029.166182] device eth0 entered promiscuous mode
[ 4044.510958] device eth1 entered promiscuous mode
[ 4326.081769] device eth0 left promiscuous mode
[ 5602.711191] device eth1 left promiscuous mode
[ 5748.029550] device eth0 entered promiscuous mode
[ 5760.140496] device eth0 left promiscuous mode
[ 9317.105873] device eth0 entered promiscuous mode
[ 9500.371596] ip6_tables: (C) 2000-2006 Netfilter Core Team
[ 9906.882944] device eth0 left promiscuous mode
[60732.405322] Bluetooth: Core ver 2.22
[60732.405353] NET: Registered protocol family 31
[60732.405354] Bluetooth: HCI device and connection manager initialized
[60732.406377] Bluetooth: HCI socket layer initialized
[60732.406380] Bluetooth: L2CAP socket layer initialized
[60732.406384] Bluetooth: SCO socket layer initialized
[60732.423097] Netfilter messages via NETLINK v0.30.
[60732.446133] device eth0 entered promiscuous mode
[60792.603781] device eth0 left promiscuous mode
[60841.255216] device eth0 entered promiscuous mode
[60849.493324] device eth0 left promiscuous mode
[60853.866953] device eth1 entered promiscuous mode
[60857.459952] device eth1 left promiscuous mode
[60865.373735] device example_2 entered promiscuous mode
[60897.364274] device example_2 left promiscuous mode
[60917.290175] device eth0 entered promiscuous mode
[61001.420189] device eth0 left promiscuous mode
[61160.023082] device eth0 entered promiscuous mode
[61246.194107] device eth0 left promiscuous mode
[62601.440037] wireguard: wg0: Sending keepalive packet to peer 10 (127.0.0.1:59519)
[62601.440099] wireguard: example_2: Receiving keepalive packet from peer 13 (127.0.0.1:51820)
[62636.256970] device eth0 entered promiscuous mode
[62660.035514] device eth0 left promiscuous mode
```

One thing: `example_2` is the user I used to test connection from localhost. There should be an `example_3` which is the one I'm using to connect form outside but `mesg` never refers that.
I also did: `dmesg -> connected from outside -> dmesg` and the output from `dmesg` never changed.

**Comment by zillemarco** [comment]
While writing the previous post I forgot to turn down the connection from localhost and this is the output from `dmesg`:
```
[61160.023082] device eth0 entered promiscuous mode
[61246.194107] device eth0 left promiscuous mode
[62601.440037] wireguard: wg0: Sending keepalive packet to peer 10 (127.0.0.1:59519)
[62601.440099] wireguard: example_2: Receiving keepalive packet from peer 13 (127.0.0.1:51820)
[62636.256970] device eth0 entered promiscuous mode
[62660.035514] device eth0 left promiscuous mode
[62861.176233] wireguard: example_2: Sending handshake initiation to peer 13 (127.0.0.1:51820)
[62861.176444] wireguard: wg0: Receiving handshake initiation from peer 10 (127.0.0.1:59519)
[62861.176445] wireguard: wg0: Sending handshake response to peer 10 (127.0.0.1:59519)
[62861.176606] wireguard: wg0: Keypair 146 destroyed for peer 10
[62861.176608] wireguard: wg0: Keypair 150 created for peer 10
[62861.176737] wireguard: example_2: Receiving handshake response from peer 13 (127.0.0.1:51820)
[62861.176741] wireguard: example_2: Keypair 147 destroyed for peer 13
[62861.176742] wireguard: example_2: Keypair 151 created for peer 13
[62861.176766] wireguard: wg0: Failed to give packet to userspace from peer 10 (127.0.0.1:59519)
[62861.176787] wireguard: wg0: Failed to give packet to userspace from peer 10 (127.0.0.1:59519)
[62871.179089] net_ratelimit: 2 callbacks suppressed
[62871.179100] wireguard: wg0: Failed to give packet to userspace from peer 10 (127.0.0.1:59519)
[62871.180682] wireguard: wg0: Failed to give packet to userspace from peer 10 (127.0.0.1:59519)
[62871.264082] wireguard: wg0: Sending keepalive packet to peer 10 (127.0.0.1:59519)
[62871.264228] wireguard: example_2: Receiving keepalive packet from peer 13 (127.0.0.1:51820)
[62876.181150] wireguard: wg0: Failed to give packet to userspace from peer 10 (127.0.0.1:59519)
[62876.182340] wireguard: wg0: Failed to give packet to userspace from peer 10 (127.0.0.1:59519)
[62881.184693] wireguard: wg0: Failed to give packet to userspace from peer 10 (127.0.0.1:59519)
[62881.184769] wireguard: wg0: Failed to give packet to userspace from peer 10 (127.0.0.1:59519)
[62886.188247] wireguard: wg0: Failed to give packet to userspace from peer 10 (127.0.0.1:59519)
[62886.188294] wireguard: wg0: Failed to give packet to userspace from peer 10 (127.0.0.1:59519)
[62886.368024] wireguard: wg0: Sending keepalive packet to peer 10 (127.0.0.1:59519)
[62886.368089] wireguard: example_2: Receiving keepalive packet from peer 13 (127.0.0.1:51820)
[62891.190459] wireguard: wg0: Failed to give packet to userspace from peer 10 (127.0.0.1:59519)
[62891.190482] wireguard: wg0: Failed to give packet to userspace from peer 10 (127.0.0.1:59519)
[62896.195646] wireguard: wg0: Failed to give packet to userspace from peer 10 (127.0.0.1:59519)
[62896.195652] wireguard: wg0: Failed to give packet to userspace from peer 10 (127.0.0.1:59519)
[62901.216022] wireguard: wg0: Sending keepalive packet to peer 10 (127.0.0.1:59519)
[62901.216085] wireguard: example_2: Receiving keepalive packet from peer 13 (127.0.0.1:51820)
[62980.705676] wireguard: wg0: Failed to give packet to userspace from peer 10 (127.0.0.1:59519)
[62980.705734] wireguard: wg0: Failed to give packet to userspace from peer 10 (127.0.0.1:59519)
[62985.706726] wireguard: wg0: Failed to give packet to userspace from peer 10 (127.0.0.1:59519)
[62985.706732] wireguard: example_2: Sending handshake initiation to peer 13 (127.0.0.1:51820)
[62985.706930] wireguard: wg0: Receiving handshake initiation from peer 10 (127.0.0.1:59519)
[62985.706931] wireguard: wg0: Sending handshake response to peer 10 (127.0.0.1:59519)
[62985.707093] wireguard: wg0: Keypair 148 destroyed for peer 10
[62985.707094] wireguard: wg0: Keypair 152 created for peer 10
[62985.707223] wireguard: example_2: Receiving handshake response from peer 13 (127.0.0.1:51820)
[62985.707227] wireguard: example_2: Keypair 149 destroyed for peer 13
[62990.708335] net_ratelimit: 4 callbacks suppressed
[62990.708338] wireguard: wg0: Failed to give packet to userspace from peer 10 (127.0.0.1:59519)
[62990.708344] wireguard: wg0: Failed to give packet to userspace from peer 10 (127.0.0.1:59519)
[62995.709482] wireguard: wg0: Failed to give packet to userspace from peer 10 (127.0.0.1:59519)
[62995.709497] wireguard: wg0: Failed to give packet to userspace from peer 10 (127.0.0.1:59519)
[62995.936047] wireguard: wg0: Sending keepalive packet to peer 10 (127.0.0.1:59519)
[62995.936389] wireguard: example_2: Receiving keepalive packet from peer 13 (127.0.0.1:51820)
[63000.710623] wireguard: wg0: Failed to give packet to userspace from peer 10 (127.0.0.1:59519)
[63000.710628] wireguard: wg0: Failed to give packet to userspace from peer 10 (127.0.0.1:59519)
[63005.712152] wireguard: wg0: Failed to give packet to userspace from peer 10 (127.0.0.1:59519)
[63005.712157] wireguard: wg0: Failed to give packet to userspace from peer 10 (127.0.0.1:59519)
[63010.712876] wireguard: wg0: Failed to give packet to userspace from peer 10 (127.0.0.1:59519)
[63010.712887] wireguard: wg0: Failed to give packet to userspace from peer 10 (127.0.0.1:59519)
[63010.784056] wireguard: wg0: Sending keepalive packet to peer 10 (127.0.0.1:59519)
[63010.784152] wireguard: example_2: Receiving keepalive packet from peer 13 (127.0.0.1:51820)
[63015.713939] wireguard: wg0: Failed to give packet to userspace from peer 10 (127.0.0.1:59519)
[63015.713945] wireguard: wg0: Failed to give packet to userspace from peer 10 (127.0.0.1:59519)
[63020.717276] wireguard: wg0: Failed to give packet to userspace from peer 10 (127.0.0.1:59519)
[63020.717291] wireguard: wg0: Failed to give packet to userspace from peer 10 (127.0.0.1:59519)
[63025.717231] wireguard: wg0: Failed to give packet to userspace from peer 10 (127.0.0.1:59519)
[63025.717237] wireguard: wg0: Failed to give packet to userspace from peer 10 (127.0.0.1:59519)
[63025.888065] wireguard: wg0: Sending keepalive packet to peer 10 (127.0.0.1:59519)
[63025.888640] wireguard: example_2: Receiving keepalive packet from peer 13 (127.0.0.1:51820)
[63030.718451] wireguard: wg0: Failed to give packet to userspace from peer 10 (127.0.0.1:59519)
[63030.718460] wireguard: wg0: Failed to give packet to userspace from peer 10 (127.0.0.1:59519)
[63035.719633] wireguard: wg0: Failed to give packet to userspace from peer 10 (127.0.0.1:59519)
[63035.719643] wireguard: wg0: Failed to give packet to userspace from peer 10 (127.0.0.1:59519)
[63040.720793] wireguard: wg0: Failed to give packet to userspace from peer 10 (127.0.0.1:59519)
[63040.720799] wireguard: wg0: Failed to give packet to userspace from peer 10 (127.0.0.1:59519)
[63040.736029] wireguard: wg0: Sending keepalive packet to peer 10 (127.0.0.1:59519)
[63040.736097] wireguard: example_2: Receiving keepalive packet from peer 13 (127.0.0.1:51820)
[63045.724178] wireguard: wg0: Failed to give packet to userspace from peer 10 (127.0.0.1:59519)
[63045.724186] wireguard: wg0: Failed to give packet to userspace from peer 10 (127.0.0.1:59519)
[63050.729417] wireguard: wg0: Failed to give packet to userspace from peer 10 (127.0.0.1:59519)
[63050.729432] wireguard: wg0: Failed to give packet to userspace from peer 10 (127.0.0.1:59519)
[63055.734479] wireguard: wg0: Failed to give packet to userspace from peer 10 (127.0.0.1:59519)
[63055.734485] wireguard: wg0: Failed to give packet to userspace from peer 10 (127.0.0.1:59519)
[63055.840029] wireguard: wg0: Sending keepalive packet to peer 10 (127.0.0.1:59519)
[63055.840088] wireguard: example_2: Receiving keepalive packet from peer 13 (127.0.0.1:51820)
[63060.742326] wireguard: wg0: Failed to give packet to userspace from peer 10 (127.0.0.1:59519)
[63060.742333] wireguard: wg0: Failed to give packet to userspace from peer 10 (127.0.0.1:59519)
[63062.416292] wireguard: wg0: Failed to give packet to userspace from peer 10 (127.0.0.1:59519)
[63062.416300] wireguard: wg0: Failed to give packet to userspace from peer 10 (127.0.0.1:59519)
[63065.744175] wireguard: wg0: Failed to give packet to userspace from peer 10 (127.0.0.1:59519)
[63065.744181] wireguard: wg0: Failed to give packet to userspace from peer 10 (127.0.0.1:59519)
[63067.421349] wireguard: wg0: Failed to give packet to userspace from peer 10 (127.0.0.1:59519)
[63067.421424] wireguard: wg0: Failed to give packet to userspace from peer 10 (127.0.0.1:59519)
[63070.749263] wireguard: wg0: Failed to give packet to userspace from peer 10 (127.0.0.1:59519)
[63070.749296] wireguard: wg0: Failed to give packet to userspace from peer 10 (127.0.0.1:59519)
[63070.944052] wireguard: wg0: Sending keepalive packet to peer 10 (127.0.0.1:59519)
[63070.944184] wireguard: example_2: Receiving keepalive packet from peer 13 (127.0.0.1:51820)
[63072.426645] wireguard: wg0: Failed to give packet to userspace from peer 10 (127.0.0.1:59519)
[63072.426651] wireguard: wg0: Failed to give packet to userspace from peer 10 (127.0.0.1:59519)
[63075.754469] wireguard: wg0: Failed to give packet to userspace from peer 10 (127.0.0.1:59519)
[63075.754474] wireguard: wg0: Failed to give packet to userspace from peer 10 (127.0.0.1:59519)
[63077.431865] wireguard: wg0: Failed to give packet to userspace from peer 10 (127.0.0.1:59519)
[63077.431879] wireguard: wg0: Failed to give packet to userspace from peer 10 (127.0.0.1:59519)
[63080.759753] wireguard: wg0: Failed to give packet to userspace from peer 10 (127.0.0.1:59519)
[63080.759760] wireguard: wg0: Failed to give packet to userspace from peer 10 (127.0.0.1:59519)
[63082.464035] wireguard: wg0: Sending keepalive packet to peer 10 (127.0.0.1:59519)
[63082.464376] wireguard: example_2: Receiving keepalive packet from peer 13 (127.0.0.1:51820)
[63085.764378] wireguard: wg0: Failed to give packet to userspace from peer 10 (127.0.0.1:59519)
[63085.764393] wireguard: wg0: Failed to give packet to userspace from peer 10 (127.0.0.1:59519)
[63090.769463] wireguard: wg0: Failed to give packet to userspace from peer 10 (127.0.0.1:59519)
[63090.769473] wireguard: wg0: Failed to give packet to userspace from peer 10 (127.0.0.1:59519)
[63095.774563] wireguard: wg0: Failed to give packet to userspace from peer 10 (127.0.0.1:59519)
[63095.774572] wireguard: wg0: Failed to give packet to userspace from peer 10 (127.0.0.1:59519)
[63095.776038] wireguard: wg0: Sending keepalive packet to peer 10 (127.0.0.1:59519)
[63095.776552] wireguard: example_2: Receiving keepalive packet from peer 13 (127.0.0.1:51820)
[63161.179914] wireguard: wg0: Failed to give packet to userspace from peer 10 (127.0.0.1:59519)
[63161.179929] wireguard: wg0: Failed to give packet to userspace from peer 10 (127.0.0.1:59519)
[63161.179940] wireguard: example_2: Sending handshake initiation to peer 13 (127.0.0.1:51820)
[63161.181367] wireguard: wg0: Receiving handshake initiation from peer 10 (127.0.0.1:59519)
[63161.181371] wireguard: wg0: Sending handshake response to peer 10 (127.0.0.1:59519)
[63161.181799] wireguard: wg0: Keypair 150 destroyed for peer 10
[63161.181801] wireguard: wg0: Keypair 154 created for peer 10
[63161.182234] wireguard: example_2: Receiving handshake response from peer 13 (127.0.0.1:51820)
[63161.182241] wireguard: example_2: Keypair 151 destroyed for peer 13
[63161.182243] wireguard: example_2: Keypair 155 created for peer 13
[63166.181395] net_ratelimit: 2 callbacks suppressed
[63166.181399] wireguard: wg0: Failed to give packet to userspace from peer 10 (127.0.0.1:59519)
[63166.181408] wireguard: wg0: Failed to give packet to userspace from peer 10 (127.0.0.1:59519)
[63171.182864] wireguard: wg0: Failed to give packet to userspace from peer 10 (127.0.0.1:59519)
[63171.182875] wireguard: wg0: Failed to give packet to userspace from peer 10 (127.0.0.1:59519)
[63176.185357] wireguard: wg0: Failed to give packet to userspace from peer 10 (127.0.0.1:59519)
[63176.185371] wireguard: wg0: Failed to give packet to userspace from peer 10 (127.0.0.1:59519)
[63176.416031] wireguard: wg0: Sending keepalive packet to peer 10 (127.0.0.1:59519)
[63176.416349] wireguard: example_2: Receiving keepalive packet from peer 13 (127.0.0.1:51820)
[63181.187741] wireguard: wg0: Failed to give packet to userspace from peer 10 (127.0.0.1:59519)
[63181.187755] wireguard: wg0: Failed to give packet to userspace from peer 10 (127.0.0.1:59519)
[63186.190562] wireguard: wg0: Failed to give packet to userspace from peer 10 (127.0.0.1:59519)
[63186.190576] wireguard: wg0: Failed to give packet to userspace from peer 10 (127.0.0.1:59519)
[63191.190114] wireguard: wg0: Failed to give packet to userspace from peer 10 (127.0.0.1:59519)
[63191.190129] wireguard: wg0: Failed to give packet to userspace from peer 10 (127.0.0.1:59519)
[63191.264047] wireguard: wg0: Sending keepalive packet to peer 10 (127.0.0.1:59519)
[63191.264533] wireguard: example_2: Receiving keepalive packet from peer 13 (127.0.0.1:51820)
[63196.190171] wireguard: wg0: Failed to give packet to userspace from peer 10 (127.0.0.1:59519)
[63196.190176] wireguard: wg0: Failed to give packet to userspace from peer 10 (127.0.0.1:59519)
[63206.368050] wireguard: wg0: Sending keepalive packet to peer 10 (127.0.0.1:59519)
[63206.368404] wireguard: example_2: Receiving keepalive packet from peer 13 (127.0.0.1:51820)
[63403.857104] wireguard: example_2: Keypair 153 destroyed for peer 13
[63403.857106] wireguard: example_2: Keypair 155 destroyed for peer 13
[63403.872316] wireguard: example_2: Peer 13 (127.0.0.1:51820) destroyed
[63403.880072] wireguard: example_2: Interface destroyed
[63455.571118] device eth0 entered promiscuous mode
```

I tried leaving the connection from outside open but nothing changed afterward, only `tcpdump` show the same output as always.

**Comment by orazioedoardo** [comment]
No wireguard output in dmesg when connecting from local network or outside?

**Comment by zillemarco** [comment]
> No wireguard output in dmesg when connecting from local network or outside?

This is the output before (without any active connection)
```
[63455.571118] device eth0 entered promiscuous mode
[63705.718312] device eth0 left promiscuous mode
[63706.080111] wireguard: wg0: Zeroing out all keys for peer 10 (127.0.0.1:59519), since we haven't received a new one in 540 seconds
[63706.080117] wireguard: wg0: Keypair 152 destroyed for peer 10
[63706.080121] wireguard: wg0: Keypair 154 destroyed for peer 10
```

This is the output after turning up and down the connection from localhost:
```
[64194.550644] wireguard: example_2: Interface created
[64194.552378] wireguard: example_2: Peer 14 created
[64195.415975] wireguard: example_2: Sending handshake initiation to peer 14 (127.0.0.1:51820)
[64195.416414] wireguard: wg0: Receiving handshake initiation from peer 10 (127.0.0.1:47281)
[64195.416416] wireguard: wg0: Sending handshake response to peer 10 (127.0.0.1:47281)
[64195.416724] wireguard: wg0: Keypair 156 created for peer 10
[64195.417025] wireguard: example_2: Receiving handshake response from peer 14 (127.0.0.1:51820)
[64195.417032] wireguard: example_2: Keypair 157 created for peer 14
[64195.417073] wireguard: wg0: Failed to give packet to userspace from peer 10 (127.0.0.1:47281)
[64195.418021] wireguard: wg0: Failed to give packet to userspace from peer 10 (127.0.0.1:47281)
[64195.559917] wireguard: wg0: Failed to give packet to userspace from peer 10 (127.0.0.1:47281)
[64195.559928] wireguard: wg0: Failed to give packet to userspace from peer 10 (127.0.0.1:47281)
[64200.558732] net_ratelimit: 13 callbacks suppressed
[64200.558738] wireguard: wg0: Failed to give packet to userspace from peer 10 (127.0.0.1:47281)
[64200.558751] wireguard: wg0: Failed to give packet to userspace from peer 10 (127.0.0.1:47281)
[64200.558761] wireguard: wg0: Failed to give packet to userspace from peer 10 (127.0.0.1:47281)
[64200.564248] wireguard: wg0: Failed to give packet to userspace from peer 10 (127.0.0.1:47281)
[64200.564325] wireguard: wg0: Failed to give packet to userspace from peer 10 (127.0.0.1:47281)
[64200.564378] wireguard: wg0: Failed to give packet to userspace from peer 10 (127.0.0.1:47281)
[64200.665840] wireguard: wg0: Failed to give packet to userspace from peer 10 (127.0.0.1:47281)
[64202.165813] wireguard: wg0: Failed to give packet to userspace from peer 10 (127.0.0.1:47281)
[64203.744216] wireguard: wg0: Packet has unallowed src IP (192.168.10.210) from peer 10 (127.0.0.1:47281)
[64204.570286] wireguard: wg0: Failed to give packet to userspace from peer 10 (127.0.0.1:47281)
[64205.560121] net_ratelimit: 4 callbacks suppressed
[64205.560126] wireguard: wg0: Failed to give packet to userspace from peer 10 (127.0.0.1:47281)
[64205.560199] wireguard: wg0: Failed to give packet to userspace from peer 10 (127.0.0.1:47281)
[64205.560240] wireguard: wg0: Failed to give packet to userspace from peer 10 (127.0.0.1:47281)
[64205.568135] wireguard: wg0: Failed to give packet to userspace from peer 10 (127.0.0.1:47281)
[64205.568180] wireguard: wg0: Failed to give packet to userspace from peer 10 (127.0.0.1:47281)
[64205.568211] wireguard: wg0: Failed to give packet to userspace from peer 10 (127.0.0.1:47281)
[64205.756645] wireguard: wg0: Packet has unallowed src IP (192.168.10.210) from peer 10 (127.0.0.1:47281)
[64205.916089] wireguard: wg0: Failed to give packet to userspace from peer 10 (127.0.0.1:47281)
[64207.415774] wireguard: wg0: Failed to give packet to userspace from peer 10 (127.0.0.1:47281)
[64209.572138] wireguard: wg0: Failed to give packet to userspace from peer 10 (127.0.0.1:47281)
[64210.573352] net_ratelimit: 5 callbacks suppressed
[64210.573357] wireguard: wg0: Failed to give packet to userspace from peer 10 (127.0.0.1:47281)
[64210.573398] wireguard: wg0: Failed to give packet to userspace from peer 10 (127.0.0.1:47281)
[64210.573432] wireguard: wg0: Failed to give packet to userspace from peer 10 (127.0.0.1:47281)
[64210.758313] wireguard: wg0: Failed to give packet to userspace from peer 10 (127.0.0.1:47281)
[64210.758340] wireguard: wg0: Failed to give packet to userspace from peer 10 (127.0.0.1:47281)
[64210.915919] wireguard: wg0: Failed to give packet to userspace from peer 10 (127.0.0.1:47281)
[64211.680112] wireguard: wg0: Packet has unallowed src IP (192.168.10.210) from peer 10 (127.0.0.1:47281)
[64212.665721] wireguard: wg0: Failed to give packet to userspace from peer 10 (127.0.0.1:47281)
[64214.577282] wireguard: wg0: Failed to give packet to userspace from peer 10 (127.0.0.1:47281)
[64214.577303] wireguard: wg0: Failed to give packet to userspace from peer 10 (127.0.0.1:47281)
[64215.578704] net_ratelimit: 4 callbacks suppressed
[64215.578708] wireguard: wg0: Failed to give packet to userspace from peer 10 (127.0.0.1:47281)
[64215.578819] wireguard: wg0: Failed to give packet to userspace from peer 10 (127.0.0.1:47281)
[64215.578839] wireguard: wg0: Failed to give packet to userspace from peer 10 (127.0.0.1:47281)
[64215.763544] wireguard: wg0: Failed to give packet to userspace from peer 10 (127.0.0.1:47281)
[64215.763583] wireguard: wg0: Failed to give packet to userspace from peer 10 (127.0.0.1:47281)
[64215.776047] wireguard: wg0: Sending keepalive packet to peer 10 (127.0.0.1:47281)
[64215.776143] wireguard: example_2: Receiving keepalive packet from peer 14 (127.0.0.1:51820)
[64216.165794] wireguard: wg0: Failed to give packet to userspace from peer 10 (127.0.0.1:47281)
[64217.915898] wireguard: wg0: Failed to give packet to userspace from peer 10 (127.0.0.1:47281)
[64218.498900] wireguard: wg0: Failed to give packet to userspace from peer 10 (127.0.0.1:47281)
[64220.584021] net_ratelimit: 6 callbacks suppressed
[64220.584023] wireguard: wg0: Failed to give packet to userspace from peer 10 (127.0.0.1:47281)
[64220.584066] wireguard: wg0: Failed to give packet to userspace from peer 10 (127.0.0.1:47281)
[64220.584090] wireguard: wg0: Failed to give packet to userspace from peer 10 (127.0.0.1:47281)
[64220.665885] wireguard: wg0: Failed to give packet to userspace from peer 10 (127.0.0.1:47281)
[64220.764214] wireguard: wg0: Failed to give packet to userspace from peer 10 (127.0.0.1:47281)
[64220.764266] wireguard: wg0: Failed to give packet to userspace from peer 10 (127.0.0.1:47281)
[64221.415796] wireguard: wg0: Failed to give packet to userspace from peer 10 (127.0.0.1:47281)
[64223.081050] wireguard: example_2: Keypair 157 destroyed for peer 14
[64223.088166] wireguard: example_2: Peer 14 (127.0.0.1:51820) destroyed
[64223.096053] wireguard: example_2: Interface destroyed
[64226.272039] wireguard: wg0: Sending keepalive packet to peer 10 (127.0.0.1:47281)
```

Connecting from an outside network or from another PC on the local network didn't change the output (it's the same as above).

> Ok what if you stop the current server and reinstall the module?
I ran the commands you gave me and reinstalled the module. After that I tried connecting from outside (with `example_3`) and the output from `dmesg` is the following:
```
[64226.272039] wireguard: wg0: Sending keepalive packet to peer 10 (127.0.0.1:47281)
[64516.578828] device eth0 entered promiscuous mode
[64521.261906] device eth0 left promiscuous mode
[64577.333468] wireguard: wg0: Keypair 156 destroyed for peer 10
[64577.352155] wireguard: wg0: Peer 10 (127.0.0.1:47281) destroyed
[64577.352164] wireguard: wg0: Peer 11 ((invalid address)) destroyed
[64577.352173] wireguard: wg0: Peer 12 (192.168.10.184:61792) destroyed
[64577.368052] wireguard: wg0: Interface destroyed
[64643.183052] wireguard: wg0: Interface created
[64643.235140] wireguard: wg0: Peer 15 created
[64643.235204] wireguard: wg0: Peer 16 created
[64643.235265] wireguard: wg0: Peer 17 created
```

Connecting from localhost the output is the same as the last few times.

**Comment by orazioedoardo** [comment]
I don't really know what's going on, but here's some more steps:

- Reboot the server to make sure the new module is reloaded and wireguard state is cleared
- Reenable dynamic debug
- Check if the keys in the config you are using to connect from outside or local network are actually the keys used in the server configuration `/etc/wireguard/wg0.conf` and `/etc/wireguard/keys`
- Connect
- Check dmesg (do not use tcpdump this time as it pollutes the dmesg output)
- `pivpn -c`?

**Comment by zillemarco** [comment]
> Reboot the server to make sure the new module is reloaded and wireguard state is cleared

How do I check that wireguard's state is cleared?

**Comment by orazioedoardo** [comment]
> How do I check that wireguard's state is cleared?

The fact that dmesg still showed 127.0.0.1 after you reinstalled and restarted wireguard made me think that maybe the old module was somehow in memory (i could be wrong though). If you reboot clearly the memory is cleared.

**Comment by zillemarco** [comment]
Ok, I restarted the server.

> Check if the keys in the config you are using to connect from outside or local network are actually the keys used in the server configuration /etc/wireguard/wg0.conf and /etc/wireguard/keys

The keys are all matching.

Output of `dmesg` before and after connecting from both outside network and a PC from the local network (the output didn't change form the restart of the server)
```
[   67.049228] hv_balloon: Max. dynamic memory size: 2048 MB
[  150.376810] new mount options do not match the existing superblock, will be ignored
[  158.361997] wireguard: module verification failed: signature and/or required key missing - tainting kernel
[  158.362536] wireguard: WireGuard 1.0.20200623 loaded. See www.wireguard.com for information.
[  158.362537] wireguard: Copyright (C) 2015-2019 Jason A. Donenfeld <Jason@zx2c4.com>. All Rights Reserved.
```

Output of `dmesg` before and after connecting and disconnecting with `example_2` (from localhost):
```
[   67.049228] hv_balloon: Max. dynamic memory size: 2048 MB
[  150.376810] new mount options do not match the existing superblock, will be ignored
[  158.361997] wireguard: module verification failed: signature and/or required key missing - tainting kernel
[  158.362536] wireguard: WireGuard 1.0.20200623 loaded. See www.wireguard.com for information.
[  158.362537] wireguard: Copyright (C) 2015-2019 Jason A. Donenfeld <Jason@zx2c4.com>. All Rights Reserved.
[  518.531788] wireguard: example_2: Interface created
[  518.536663] wireguard: example_2: Peer 4 created
[  518.809247] ip6_tables: (C) 2000-2006 Netfilter Core Team
[  523.768811] wireguard: example_2: Sending handshake initiation to peer 4 (127.0.0.1:51820)
[  523.769183] wireguard: wg0: Receiving handshake initiation from peer 1 (127.0.0.1:38995)
[  523.769185] wireguard: wg0: Sending handshake response to peer 1 (127.0.0.1:38995)
[  523.769466] wireguard: wg0: Keypair 1 created for peer 1
[  523.769697] wireguard: example_2: Receiving handshake response from peer 4 (127.0.0.1:51820)
[  523.769703] wireguard: example_2: Keypair 2 created for peer 4
[  523.769741] wireguard: wg0: Failed to give packet to userspace from peer 1 (127.0.0.1:38995)
[  523.769785] wireguard: wg0: Failed to give packet to userspace from peer 1 (127.0.0.1:38995)
[  528.707732] wireguard: wg0: Failed to give packet to userspace from peer 1 (127.0.0.1:38995)
[  528.775020] wireguard: wg0: Failed to give packet to userspace from peer 1 (127.0.0.1:38995)
[  528.775026] wireguard: wg0: Failed to give packet to userspace from peer 1 (127.0.0.1:38995)
[  533.984102] wireguard: wg0: Sending keepalive packet to peer 1 (127.0.0.1:38995)
[  533.984223] wireguard: example_2: Receiving keepalive packet from peer 4 (127.0.0.1:51820)
[  535.002447] wireguard: wg0: Failed to give packet to userspace from peer 1 (127.0.0.1:38995)
[  535.002476] wireguard: wg0: Failed to give packet to userspace from peer 1 (127.0.0.1:38995)
[  538.957310] wireguard: wg0: Failed to give packet to userspace from peer 1 (127.0.0.1:38995)
[  540.005715] wireguard: wg0: Failed to give packet to userspace from peer 1 (127.0.0.1:38995)
[  540.005773] wireguard: wg0: Failed to give packet to userspace from peer 1 (127.0.0.1:38995)
[  545.010939] wireguard: wg0: Failed to give packet to userspace from peer 1 (127.0.0.1:38995)
[  545.010966] wireguard: wg0: Failed to give packet to userspace from peer 1 (127.0.0.1:38995)
[  545.248047] wireguard: wg0: Sending keepalive packet to peer 1 (127.0.0.1:38995)
[  545.248132] wireguard: example_2: Receiving keepalive packet from peer 4 (127.0.0.1:51820)
[  549.207999] wireguard: wg0: Failed to give packet to userspace from peer 1 (127.0.0.1:38995)
[  550.016207] wireguard: wg0: Failed to give packet to userspace from peer 1 (127.0.0.1:38995)
[  550.016246] wireguard: wg0: Failed to give packet to userspace from peer 1 (127.0.0.1:38995)
[  555.817721] wireguard: example_2: Keypair 2 destroyed for peer 4
[  555.832407] wireguard: example_2: Peer 4 (127.0.0.1:51820) destroyed
[  555.836061] wireguard: example_2: Interface destroyed
[  559.328040] wireguard: wg0: Sending keepalive packet to peer 1 (127.0.0.1:38995)
```

Output of `pivpn -c` after the tests:
```
::: Connected Clients List :::
Name           Remote IP            Virtual IP      Bytes Received      Bytes Sent      Last Seen
example_2      127.0.0.1:38995      10.6.0.2        148B                188B            Jul 01 2020 - 09:58:42
example_3      (none)               10.6.0.4        0B                  0B              (not yet)
```

If nothing works and nothing comes to mind, should I think about extreme measures? I mean, I could reinstall the whole VPN server. It is feasible, I set up this server only to act as VPN server so I could wipe it clean and reinstall it all, Ubuntu and everything.

**Comment by orazioedoardo** [comment]
> If nothing works and nothing comes to mind, should I think about extreme measures? I mean, I could reinstall the whole VPN server. It is feasible, I set up this server only to act as VPN server so I could wipe it clean and reinstall it all, Ubuntu and everything.

Well yes if you don't mind. You said that it worked up to yesterday so maybe the issue was a software update? I don't know. Doesn't seems a network issue as the wireguard module doesn't even see the peer.

**Comment by zillemarco** [comment]
Ok, then I'll reinstall the server and hope it works well again.
Thank you for your time and efforts!

I'll let you know if after reinstalling the server the VPN works again :)

**Comment by zillemarco** [comment]
Sorry to bring this back up but finally I got the time to reinstall the VPN server.
After installing the server from scratch I installed pivpn and added a single user, `test_2`.
I tested the VPN connecting from an external network using my smartphone and the connection seems ok.

### This is the output of `sudo wg`
```
interface: wg0
  public key: ucqLzQVArs7Tkaw6st6XUg8ERFG8iELyd+xQ+Fh+Tgs=
  private key: (hidden)
  listening port: 51820

peer: 75NRjoGbsXn49FcCqXac/5E3E2Wez5p0pfu/nnSxgho=
  preshared key: (hidden)
  endpoint: 5.90.8.238:36820
  allowed ips: 10.6.0.2/32
  latest handshake: 26 seconds ago
  transfer: 34.40 KiB received, 1.96 KiB sent
```

### This is the output of `pivpn -c`
```
::: Connected Clients List :::
Name        Remote IP             Virtual IP      Bytes Received      Bytes Sent      Last Seen
test_2      5.90.8.238:36820      10.6.0.2        39KiB               2.1KiB          Jul 13 2020 - 07:20:28
```

I can also see that every N second `latest handshake` from `sudo wg` restarts so the smartphone is actually communicating with wireguard.

The problem is that, almost like before, wireguard is not responding to the client.

### This is the output of `tcpdump` taken during the first ever connection of `test_2` to the VPN
As you can see, there are a number of connection to wireguard but only a couple back to the client.
```
tcpdump: verbose output suppressed, use -v or -vv for full protocol decode
listening on eth0, link-type EN10MB (Ethernet), capture size 262144 bytes
07:16:33.618901 IP 5.90.8.238.36820 > 192.168.20.210.51820: UDP, length 148
07:16:33.619786 IP 192.168.20.210.51820 > 5.90.8.238.36820: UDP, length 92
07:16:33.670632 IP 5.90.8.238.36820 > 192.168.20.210.51820: UDP, length 96
07:16:33.676916 IP 5.90.8.238.36820 > 192.168.20.210.51820: UDP, length 96
07:16:33.677188 IP 5.90.8.238.36820 > 192.168.20.210.51820: UDP, length 96
07:16:33.677233 IP 5.90.8.238.36820 > 192.168.20.210.51820: UDP, length 112
07:16:33.677237 IP 5.90.8.238.36820 > 192.168.20.210.51820: UDP, length 96
[...]
07:17:20.136968 IP 5.90.8.238.36820 > 192.168.20.210.51820: UDP, length 148
07:17:25.437386 IP 5.90.8.238.36820 > 192.168.20.210.51820: UDP, length 148
07:17:25.438342 IP 192.168.20.210.51820 > 5.90.8.238.36820: UDP, length 92
07:17:25.489448 IP 5.90.8.238.36820 > 192.168.20.210.51820: UDP, length 32
07:17:25.860940 IP 5.90.8.238.36820 > 192.168.20.210.51820: UDP, length 112
07:17:25.929469 IP 5.90.8.238.36820 > 192.168.20.210.51820: UDP, length 112
[...]
07:18:02.003241 IP 5.90.8.238.36820 > 192.168.20.210.51820: UDP, length 96
07:18:04.020089 IP 5.90.8.238.36820 > 192.168.20.210.51820: UDP, length 96
07:18:06.609538 IP 5.90.8.238.36820 > 192.168.20.210.51820: UDP, length 148
```

After a bunch of testing I found that I can actually reach the VPN, sometimes. By this I mean that I tried using remote desktop from my smartphone to a server visibile through the VPN and it kinda worke: the first time it didn't responde and remote desktop gave me an error but after the error I was able to connect to the server and this is a portion of the output of `tcpdump`:
```
08:40:28.735010 IP 5.90.8.238.36771 > 192.168.20.210.51820: UDP, length 96
08:40:28.737315 IP 5.90.8.238.36771 > 192.168.20.210.51820: UDP, length 96
08:40:28.737341 IP 5.90.8.238.36771 > 192.168.20.210.51820: UDP, length 112
08:40:28.737459 IP 5.90.8.238.36771 > 192.168.20.210.51820: UDP, length 96
08:40:31.124992 IP 5.90.8.238.36771 > 192.168.20.210.51820: UDP, length 96
08:40:31.125473 IP 192.168.20.210.51820 > 5.90.8.238.36771: UDP, length 96
08:40:31.125514 IP 192.168.20.210.51820 > 5.90.8.238.36771: UDP, length 80
08:40:32.298779 IP 5.90.8.238.36771 > 192.168.20.210.51820: UDP, length 96
08:40:32.299868 IP 192.168.20.210.51820 > 5.90.8.238.36771: UDP, length 96
08:40:32.348797 IP 5.90.8.238.36771 > 192.168.20.210.51820: UDP, length 96
08:40:32.349137 IP 5.90.8.238.36771 > 192.168.20.210.51820: UDP, length 112
08:40:32.350710 IP 192.168.20.210.51820 > 5.90.8.238.36771: UDP, length 112
08:40:32.408789 IP 5.90.8.238.36771 > 192.168.20.210.51820: UDP, length 96
08:40:32.409118 IP 5.90.8.238.36771 > 192.168.20.210.51820: UDP, length 96
08:40:32.409392 IP 192.168.20.210.51820 > 5.90.8.238.36771: UDP, length 96
08:40:32.409429 IP 192.168.20.210.51820 > 5.90.8.238.36771: UDP, length 80
08:40:32.432435 IP 5.90.8.238.36771 > 192.168.20.210.51820: UDP, length 96
08:40:32.433814 IP 192.168.20.210.51820 > 5.90.8.238.36771: UDP, length 96
08:40:32.498745 IP 5.90.8.238.36771 > 192.168.20.210.51820: UDP, length 96
08:40:32.499115 IP 5.90.8.238.36771 > 192.168.20.210.51820: UDP, length 112
08:40:32.500630 IP 192.168.20.210.51820 > 5.90.8.238.36771: UDP, length 112
08:40:32.558681 IP 5.90.8.238.36771 > 192.168.20.210.51820: UDP, length 96
08:40:32.728795 IP 5.90.8.238.36771 > 192.168.20.210.51820: UDP, length 96
08:40:32.729131 IP 5.90.8.238.36771 > 192.168.20.210.51820: UDP, length 96
08:40:32.734968 IP 5.90.8.238.36771 > 192.168.20.210.51820: UDP, length 112
08:40:32.735102 IP 5.90.8.238.36771 > 192.168.20.210.51820: UDP, length 96
08:40:33.748829 IP 5.90.8.238.36771 > 192.168.20.210.51820: UDP, length 96
08:40:33.749648 IP 192.168.20.210.51820 > 5.90.8.238.36771: UDP, length 96
08:40:33.749665 IP 192.168.20.210.51820 > 5.90.8.238.36771: UDP, length 80
08:40:34.088715 IP 5.90.8.238.36771 > 192.168.20.210.51820: UDP, length 96
08:40:34.739314 IP 5.90.8.238.36771 > 192.168.20.210.51820: UDP, length 96
08:40:34.739353 IP 5.90.8.238.36771 > 192.168.20.210.51820: UDP, length 96
08:40:34.744907 IP 5.90.8.238.36771 > 192.168.20.210.51820: UDP, length 112
08:40:34.745770 IP 5.90.8.238.36771 > 192.168.20.210.51820: UDP, length 96
08:40:36.104976 IP 5.90.8.238.36771 > 192.168.20.210.51820: UDP, length 96
08:40:38.755004 IP 5.90.8.238.36771 > 192.168.20.210.51820: UDP, length 96
08:40:38.755207 IP 5.90.8.238.36771 > 192.168.20.210.51820: UDP, length 96
08:40:38.755223 IP 5.90.8.238.36771 > 192.168.20.210.51820: UDP, length 112
08:40:38.755228 IP 5.90.8.238.36771 > 192.168.20.210.51820: UDP, length 96
08:40:44.229438 IP 192.168.20.210.51820 > 5.90.8.238.36771: UDP, length 32
```

When I saw this I tried setting up this environment:
 - hotspot with my smartphone (VPN disabled of the smartphone)
 - a macbook connected to the hotspot and enabled the VPN connection on the mac

Doing this did not work, not even using remote desktop to reach the server using the VPN and during this test `tcpdump` only showed incoming packets.

Anyway, even if I am able to use remote desktop from the smartphone, I'm not able to browse the internet when the VPN is active and the remove dektop only works after it prompts me that "Unable to connect" error...very strange.

Any idea on what I could test? Also note that I upgraded the server from Ubuntu Server 18.04 (the one I was using when the VPN was working a month ago) to Ubuntu Server 20.04 and I can revert back to 18.04 if you think it could help.

**Comment by zillemarco** [comment]
Don't know why but I reinstalled the server again (keeping Ubuntu Server 20.04), setup pivpn as I did before and it still did not work. Just to try I setup the routing from `eth0` to `eth1` as I needed it anyway and it started working again...
Maybe changing the routing tables fixed some problems? It's a mistery, I'll keep it checked to make sure it keeps working.

**Comment by orazioedoardo** [comment]
How about the MTU? https://wiki.archlinux.org/index.php/WireGuard#Low_MTU

**Comment by LFARTHUR** [comment]
Hi, I have the same exact issue as well. I started from a fresh install of Raspbian OS and pivpn, but unfortunately none of my device seems to be able to connect to the VPN. I have tried running pivpn -d, everything seems fine
`::::		PiVPN debug		 ::::
=============================================
::::		Latest commit		 ::::
commit 32bd1c628af9e1926f3f4471c0bf49c74deff7c7 (grafted, HEAD -> test, origin/test, origin/master, origin/HEAD, master)
Author: Orazio <orazioedoardo@users.noreply.github.com>
Date:   Fri Jul 24 18:52:57 2020 +0200

    Update LatestUpdate.md
=============================================
::::	    Installation settings    	 ::::
PLAT=Raspbian
OSCN=buster
USING_UFW=0
IPv4dev=eth0
dhcpReserv=1
IPv4addr=192.168.0.74/24
IPv4gw=192.168.0.1
install_user=pi
install_home=/home/pi
VPN=wireguard
pivpnPORT=51820
pivpnDNS1=1.1.1.1
pivpnDNS2=1.0.0.1
pivpnHOST=REDACTED
INPUT_CHAIN_EDITED=0
FORWARD_CHAIN_EDITED=0
pivpnPROTO=udp
pivpnDEV=wg0
pivpnNET=10.6.0.0
subnetClass=24
UNATTUPG=1
INSTALLED_PACKAGES=(raspberrypi-kernel-headers wireguard wireguard-tools wireguard-dkms qrencode unattended-upgrades)
=============================================
::::  Server configuration shown below   ::::
[Interface]
PrivateKey = server_priv
Address = 10.6.0.1/24
ListenPort = 51820
PostUp = iptables -A FORWARD -i %i -j ACCEPT; iptables -t nat -A POSTROUTING -o eth0 -j MASQUERADE
PostDown = iptables -D FORWARD -i %i -j ACCEPT; iptables -t nat -D POSTROUTING -o eth0 -j MASQUERADE
### begin phone ###
[Peer]
PublicKey = phone_pub
PresharedKey = phone_psk
AllowedIPs = 0.0.0.0/0
### end phone ###
=============================================
::::  Client configuration shown below   ::::
[Interface]
PrivateKey = phone_priv
Address = 10.6.0.2/24
DNS = 1.1.1.1, 1.0.0.1

[Peer]
PublicKey = server_pub
PresharedKey = phone_psk
Endpoint = REDACTED:51820
AllowedIPs = 0.0.0.0/0, ::0/0
=============================================
:::: 	Recursive list of files in	 ::::
::::	[4m/etc/wireguard shown below	 ::::
/etc/wireguard:
configs  keys  wg0.conf

/etc/wireguard/configs:
clients.txt  phone.conf

/etc/wireguard/keys:
phone_priv  phone_psk  phone_pub  server_priv  server_pub
=============================================
::::		Self check		 ::::
:: [OK] IP forwarding is enabled
:: [OK] Iptables MASQUERADE rule set
:: [OK] WireGuard is running
:: [OK] WireGuard is enabled (it will automatically start on reboot)
:: [OK] WireGuard is listening on port 51820/udp
=============================================
:::: Having trouble connecting? Take a look at the FAQ:
:::: https://github.com/pivpn/pivpn/wiki/FAQ
=============================================
:::: WARNING: This script should have automatically masked sensitive       ::::
:::: information, however, still make sure that PrivateKey, PublicKey      ::::
:::: and PresharedKey are masked before reporting an issue. An example key ::::
:::: that you should NOT see in this log looks like this:                  ::::
:::: YIAoJVsdIeyvXfGGDDadHh6AxsMRymZTnnzZoAb9cxRe                          ::::
=============================================
::::		Debug complete		 ::::
`
However I was able to successfully connect to the VPN after installing DietPi OS and subsequently install pivpn under the optimised software lists. After this, I tried with Raspbian OS again but with no luck.

**Comment by orazioedoardo** [comment]
@LFARTHUR Your issue is different (it doesn't work in the first place), please open a new one.

**Comment by orazioedoardo** [comment]
Closing this as inactive
