### DISCUSSION TITLE
Pivpn won't respond to client (Wireguard)

### DISCUSSION THREAD

**Discussion by bwirt** [pivpn/pivpn#1545] [Bug Reports]
## In raising this issue, I confirm the following:

- [X] I have read the [documentation](https://docs.pivpn.io)
- [] Is it a feature request? please consider opening a [Discussion] (https://github.com/pivpn/pivpn/discussions/new)
- [X] I have read and understood the [contributors guide](https://github.com/pivpn/pivpn/blob/master/CONTRIBUTING.md).
- [X] The issue I am reporting can be *replicated*.  
- [] The issue I am reporting *is* directly related to the pivpn installer script.
- [X] The issue I am reporting isn't a duplicate (see [FAQs](https://github.com/pivpn/pivpn/wiki/FAQ), [closed issues](https://github.com/pivpn/pivpn/issues?q=is%3Aissue+sort%3Aupdated-desc+is%3Aclosed), and [open issues](https://github.com/pivpn/pivpn/issues?q=is%3Aissue+sort%3Aupdated-desc+is%3Aopen)).

### Has your install failed? 
```
no
```

### Describe the issue
Client cannot connect to local network from external location over Wireguard VPN.

I have confirmed with tcpdump that Pivpn is receiving traffic from the client but not responding.  Example:
```
root@unifipi:/home/pi/configs# tcpdump -n -i eth1 udp port 51820
tcpdump: verbose output suppressed, use -v or -vv for full protocol decode
listening on eth1, link-type EN10MB (Ethernet), capture size 262144 bytes
07:57:55.345396 IP 107.122.84.177.39392 > 192.168.20.30.51820: UDP, length 148
07:58:00.382500 IP 107.122.84.177.39392 > 192.168.20.30.51820: UDP, length 148
07:58:05.785598 IP 107.122.84.177.39392 > 192.168.20.30.51820: UDP, length 148
07:58:11.167606 IP 107.122.84.177.39392 > 192.168.20.30.51820: UDP, length 148
07:58:16.061518 IP 107.122.84.177.39392 > 192.168.20.30.51820: UDP, length 148
```

**Expected behavior**
Pivpn should respond to client, which should be able to browse local network resources.

**Screenshots**
See tcpdump above.

### Can you replicate the issue? Describe the steps below
1. Add a USB ethernet adapther (eth1) to your pi
2. Install Pivpn, selecting eth1 as the interface.
3. Add a client (iOS)
4. Install iOS Wireguard app and use qr code to add the tunnel
5. Turn off wi-fi on client and use 5G connection to connect.

### Have you searched for similar issues and solutions?
Yes.  I didn't find anything here but found a thread that describes exactly what I'm experiencing on Reddit.  Their [solution](https://www.reddit.com/r/VPN/comments/md8gju/pivpn_wireguard_can_receive_traffic_but_doesnt/) was to remove Pivpn and install Wireguard manually, which I will try if I can't find resolution to this here.

**Additional context**
My pi has two LAN ports: onboard (eth0), and a USB adapter (eth1).  The onboard port is 192.168.1.8 (Management LAN) and the USB adapter is 192.168.20.30 (VLAN).

The pi is behind an Edgerouter 4 with port 51820 UDP forwarded to 192.168.20.30:51820.  Pihole (unused) and the Unifi controller app are also installed on the pi.  Pivpn was installed last.

Network adapters:
```
eth0: flags=4163<UP,BROADCAST,RUNNING,MULTICAST>  mtu 1500
        inet 192.168.1.8  netmask 255.255.255.0  broadcast 192.168.1.255
        inet6 fe80::ba27:ebff:febe:7a95  prefixlen 64  scopeid 0x20<link>
        ether b8:27:eb:be:7a:95  txqueuelen 1000  (Ethernet)
        RX packets 8336801  bytes 2795648333 (2.6 GiB)
        RX errors 0  dropped 0  overruns 0  frame 0
        TX packets 3949514  bytes 502140377 (478.8 MiB)
        TX errors 0  dropped 0 overruns 0  carrier 0  collisions 0

eth1: flags=4163<UP,BROADCAST,RUNNING,MULTICAST>  mtu 1500
        inet 192.168.20.30  netmask 255.255.255.0  broadcast 192.168.20.255
        inet6 fe80::fae4:3bff:fe71:8016  prefixlen 64  scopeid 0x20<link>
        ether f8:e4:3b:71:80:16  txqueuelen 1000  (Ethernet)
        RX packets 1201336  bytes 219782013 (209.6 MiB)
        RX errors 1193155  dropped 138  overruns 0  frame 0
        TX packets 316953  bytes 216504679 (206.4 MiB)
        TX errors 0  dropped 0 overruns 0  carrier 0  collisions 0

lo: flags=73<UP,LOOPBACK,RUNNING>  mtu 65536
        inet 127.0.0.1  netmask 255.0.0.0
        inet6 ::1  prefixlen 128  scopeid 0x10<host>
        loop  txqueuelen 1000  (Local Loopback)
        RX packets 2341426  bytes 6172219615 (5.7 GiB)
        RX errors 0  dropped 0  overruns 0  frame 0
        TX packets 2341426  bytes 6172219615 (5.7 GiB)
        TX errors 0  dropped 0 overruns 0  carrier 0  collisions 0

wg0: flags=209<UP,POINTOPOINT,RUNNING,NOARP>  mtu 1420
        inet 10.14.223.1  netmask 255.255.255.0  destination 10.14.223.1
        unspec 00-00-00-00-00-00-00-00-00-00-00-00-00-00-00-00  txqueuelen 1000  (UNSPEC)
        RX packets 641  bytes 94868 (92.6 KiB)
        RX errors 0  dropped 0  overruns 0  frame 0
        TX packets 641  bytes 58972 (57.5 KiB)
        TX errors 0  dropped 0 overruns 0  carrier 0  collisions 0
```

### Have you taken any steps towards solving your issue?
Read FAQ.  Tried troubleshooting steps.  Details above.

#### What type of hardware are you running PiVPN at?

```
Raspberrypi 3
```
#### Output of `uname -a`
```
Linux unifipi 5.10.103-v7+ #1529 SMP Tue Mar 8 12:21:37 GMT 2022 armv7l GNU/Linux
```

#### Output of `cat /etc/os-release`
```
PRETTY_NAME="Raspbian GNU/Linux 10 (buster)"
NAME="Raspbian GNU/Linux"
VERSION_ID="10"
VERSION="10 (buster)"
VERSION_CODENAME=buster
ID=raspbian
ID_LIKE=debian
HOME_URL="http://www.raspbian.org/"
SUPPORT_URL="http://www.raspbian.org/RaspbianForums"
BUG_REPORT_URL="http://www.raspbian.org/RaspbianBugs"
```

### If install failed Please provide the console output of  `curl -L https://install.pivpn.io | bash`
N/A

### Console output of      `curl -L install.pivpn.io | bash`
```
Text screen comes up indicating existing install is detected.  Offers options to update, repair, reconfigure.
```

### Console output of      `pivpn add` or `pivpn add nopass`
```
root@unifipi:/home/pi/configs# pivpn add
Enter a Name for the Client: testclient
::: Client Keys generated
::: Client config generated
::: Updated server config
::: WireGuard reloaded
======================================================================
::: Done! testclient.conf successfully created!
::: testclient.conf was copied to /home/pi/configs for easy transfer.
::: Please use this profile only on one device and create additional
::: profiles for other devices. You can also use pivpn -qr
::: to generate a QR Code you can scan with the mobile app.
======================================================================
```

### Console output of      `pivpn debug`

```
::: Generating Debug Output
::::            PiVPN debug              ::::
=============================================
::::            Latest commit            ::::
Branch: master
Commit: 0b5aab87221e83ed0e0d66a0279d04f1c59f8cb4
Author: 4s3ti
Date: Tue May 24 16:46:48 2022 +0200
Summary: pre-merge changelog update
=============================================
::::        Installation settings        ::::
PLAT=Raspbian
OSCN=buster
USING_UFW=0
pivpnforceipv6route=1
IPv4dev=eth1
IPv4addr=192.168.20.30/24
IPv4gw=192.168.20.1
install_user=pi
install_home=/home/pi
VPN=wireguard
pivpnPORT=51820
pivpnDNS1=1.1.1.1
pivpnDNS2=1.0.0.1
pivpnHOST=REDACTED
INPUT_CHAIN_EDITED=0
FORWARD_CHAIN_EDITED=0
INPUT_CHAIN_EDITEDv6=
FORWARD_CHAIN_EDITEDv6=
pivpnPROTO=udp
pivpnMTU=1420
pivpnDEV=wg0
pivpnNET=10.14.223.0
subnetClass=24
pivpnenableipv6=0
ALLOWED_IPS="0.0.0.0/0, ::0/0"
UNATTUPG=1
INSTALLED_PACKAGES=(grepcidr)
=============================================
::::  Server configuration shown below   ::::
[Interface]
PrivateKey = server_priv
Address = 10.14.223.1/24
MTU = 1420
ListenPort = 51820
### begin iPhone ###
[Peer]
PublicKey = iPhone_pub
PresharedKey = iPhone_psk
AllowedIPs = 10.14.223.2/32
### end iPhone ###
### begin testclient ###
[Peer]
PublicKey = testclient_pub
PresharedKey = testclient_psk
AllowedIPs = 10.14.223.3/32
### end testclient ###
=============================================
::::  Client configuration shown below   ::::
[Interface]
PrivateKey = iPhone_priv
Address = 10.14.223.2/24
DNS = 1.1.1.1, 1.0.0.1

[Peer]
PublicKey = server_pub
PresharedKey = iPhone_psk
Endpoint = REDACTED:51820
AllowedIPs = 0.0.0.0/0, ::0/0
=============================================
::::    Recursive list of files in       ::::
::::    /etc/wireguard shown below       ::::
/etc/wireguard:
configs
keys
wg0.conf

/etc/wireguard/configs:
clients.txt
iPhone.conf
testclient.conf

/etc/wireguard/keys:
iPhone_priv
iPhone_psk
iPhone_pub
server_priv
server_pub
testclient_priv
testclient_psk
testclient_pub
=============================================
::::            Self check               ::::
:: [OK] IP forwarding is enabled
:: [OK] Iptables MASQUERADE rule set
:: [OK] WireGuard is running
:: [OK] WireGuard is enabled (it will automatically start on reboot)
:: [OK] WireGuard is listening on port 51820/udp
=============================================
:::: Having trouble connecting? Take a look at the FAQ:
:::: https://docs.pivpn.io/faq
=============================================
:::: WARNING: This script should have automatically masked sensitive       ::::
:::: information, however, still make sure that PrivateKey, PublicKey      ::::
:::: and PresharedKey are masked before reporting an issue. An example key ::::
:::: that you should NOT see in this log looks like this:                  ::::
:::: YIAoJVsdIeyvXfGGDDadHh6AxsMRymZTnnzZoAb9cxRe                          ::::
=============================================
::::            Debug complete           ::::
:::
::: Debug output completed above.
::: Copy saved to /tmp/debug.log
```

**Comment by bwirt** [comment]
It looks like pivpn is accepting packets on eth1 but trying to send them back out on eth0, which is incorrect.

```
[Tue Jun 28 16:39:06 2022] wireguard iptables: IN=eth1 OUT= MAC=f8:e4:3b:71:80:16:b4:fb:e4:8a:e0:f9:08:00 SRC=107.122.84.110 DST=192.168.20.30 LEN=176 TOS=0x00 PREC=0x20 TTL=51 ID=40500 PROTO=UDP SPT=6082 DPT=51820 LEN=156
[Tue Jun 28 16:39:06 2022] wireguard iptables: IN= OUT=eth0 SRC=192.168.1.8 DST=107.122.84.110 LEN=120 TOS=0x08 PREC=0x80 TTL=64 ID=36298 PROTO=UDP SPT=51820 DPT=6082 LEN=100
```

`sudo iptables -S` output:

```
-P INPUT ACCEPT
-P FORWARD ACCEPT
-P OUTPUT ACCEPT
-A INPUT -p udp -m udp --dport 51820 -j LOG --log-prefix "wireguard iptables: " --log-level 7
-A OUTPUT -p udp -m udp --sport 51820 -j LOG --log-prefix "wireguard iptables: " --log-level 7
```

`sudo iptables -t nat -S` output:
```
-P PREROUTING ACCEPT
-P INPUT ACCEPT
-P POSTROUTING ACCEPT
-P OUTPUT ACCEPT
-A POSTROUTING -s 10.165.152.0/24 -o eth1 -m comment --comment wireguard-nat-rule -j MASQUERADE
```
