### ISSUE TITLE
After PIVPN installation on RP3B, Clients connect but there is no traffic at all!

### ISSUE THREAD

**Issue by GianniFP809** [pivpn/pivpn#967]
## In raising this issue, I confirm the following: 

`{please fill the checkboxes, e.g: [X]}`

- [X] I have read and understood the [contributors guide](https://github.com/pivpn/pivpn/blob/master/CONTRIBUTING.md).
- [X] The issue I am reporting can be *replicated*.
- [X] The issue I am reporting can be *is* directly related to the pivpn installer script.
- [X] The issue I am reporting isn't a duplicate (see [FAQs](https://github.com/pivpn/pivpn/wiki/FAQ), [closed issues](https://github.com/pivpn/pivpn/issues?q=is%3Aissue+sort%3Aupdated-desc+is%3Aclosed), and [open issues](https://github.com/pivpn/pivpn/issues?q=is%3Aissue+sort%3Aupdated-desc+is%3Aopen)).

Installed PIVPN. No errors. All seemed good. Created an user, and transferred the OVPN file to my Iphone. Loaded the profile into OpenVPN and connects like a charm. The problem is no traffic anywhere. The RPI is located behind an Ubiquity EdgeRouter. Setup the port forwarding and when connecting from the Iphone I'm using AT&T cellular and connects to port 443 with no issues. Port Forwarding is 443 and the port in the PIVPN during setup was changed to 443. I don't have any special routing rules in the router for the 10.8.0.0 network. Only the port forwarding. 

### Have you searched for similar issues and solutions?
Have searched all over and added the iptables rules that follow with no result. 
```
iptables -t nat -I POSTROUTING -s 10.8.0.0/24 -o eth0 -j MASQUERADE
iptables -I FORWARD 1 -d 10.8.0.0/24 -i eth0 -o tun0 -m conntrack --ctstate RELATED,ESTABLISHED -j ACCEPT
iptables -I FORWARD 2 -s 10.8.0.0/24 -i tun0 -o eth0 -j ACCEPT
```

### Console output of      `curl -L install.pivpn.dev | bash`
```
  % Total    % Received % Xferd  Average Speed   Time    Time     Time  Current
                                 Dload  Upload   Total   Spent    Left  Speed
100     5  100     5    0     0     20      0 --:--:-- --:--:-- --:--:--    20
100   162  100   162    0     0    236      0 --:--:-- --:--:-- --:--:--   236
100 81925  100 81925    0     0  93950      0 --:--:-- --:--:-- --:--:-- 93950
:::
::: sudo will be used for the install.
::: Update option selected.
going do update PiVPN Scripts
Cloning into '/etc/.pivpn'...
remote: Enumerating objects: 113, done.
remote: Counting objects: 100% (113/113), done.
remote: Compressing objects: 100% (63/63), done.
remote: Total 2293 (delta 55), reused 78 (delta 36), pack-reused 2180
Receiving objects: 100% (2293/2293), 755.03 KiB | 5.17 MiB/s, done.
Resolving deltas: 100% (1278/1278), done.
PiVPN Scripts have been updated
```

### Console output of      `pivpn add` or `pivpn add nopass`
```
  Output Here
```

### Console output of      `pivpn debug`
```
pi@raspberrypi:/etc/openvpn $ pivpn debug
::: Generating Debug Output
::::            PiVPN debug              ::::
=============================================
::::            Latest commit            ::::
commit e73f274fca692f40f7aa83d3931dc43257da5a54
Author: Orazio <orazioedoardo@users.noreply.github.com>
Date:   Mon Feb 17 16:34:07 2020 +0100

    Update LatestUpdate.md
=============================================
::::        Installation settings        ::::
PLAT=Raspbian
OSCN=buster
USING_UFW=0
IPv4dev=eth0
dhcpReserv=1
IPv4addr=10.0.11.100/16
IPv4gw=10.0.0.1
install_user=pi
install_home=/home/pi
VPN=openvpn
pivpnDEV=tun0
pivpnNET=10.8.0.0
subnetClass=24
pivpnPROTO=udp
pivpnPORT=443
pivpnDNS1=10.0.0.1
pivpnDNS2=8.8.8.8
pivpnSEARCHDOMAIN=
pivpnHOST=REDACTED
TWO_POINT_FOUR=1
pivpnENCRYPT=521
USE_PREDEFINED_DH_PARAM=0
INPUT_CHAIN_EDITED=0
FORWARD_CHAIN_EDITED=0
UNATTUPG=1
INSTALLED_PACKAGES=(git dnsutils iptables-persistent openvpn grepcidr expect unattended-upgrades)
HELP_SHOWN=1
=============================================
::::  Server configuration shown below   ::::
dev tun
proto udp
port 443
ca /etc/openvpn/easy-rsa/pki/ca.crt
cert /etc/openvpn/easy-rsa/pki/issued/raspberrypi_e645ebf3-d69d-49c1-9218-f6e601b75540.crt
key /etc/openvpn/easy-rsa/pki/private/raspberrypi_e645ebf3-d69d-49c1-9218-f6e601b75540.key
dh none
ecdh-curve secp521r1
topology subnet
server 10.8.0.0 255.255.255.0
# Set your primary domain name server address for clients
push "dhcp-option DNS 10.0.0.1"
push "dhcp-option DNS 8.8.8.8"
# Prevent DNS leaks on Windows
push "block-outside-dns"
# Override the Client default gateway by using 0.0.0.0/1 and
# 128.0.0.0/1 rather than 0.0.0.0/0. This has the benefit of
# overriding but not wiping out the original default gateway.
push "redirect-gateway def1"
client-to-client
client-config-dir /etc/openvpn/ccd
keepalive 15 120
remote-cert-tls client
tls-version-min 1.2
tls-crypt /etc/openvpn/easy-rsa/pki/ta.key
cipher AES-256-CBC
auth SHA256
user openvpn
group openvpn
persist-key
persist-tun
crl-verify /etc/openvpn/crl.pem
status /var/log/openvpn-status.log 20
status-version 3
syslog
verb 3
#DuplicateCNs allow access control on a less-granular, per user basis.
#Remove # if you will manage access by user instead of device.
#duplicate-cn
# Generated for use by PiVPN.io
=============================================
::::  Client template file shown below   ::::
client
dev tun
proto udp
remote REDACTED 443
resolv-retry infinite
nobind
remote-cert-tls server
tls-version-min 1.2
verify-x509-name raspberrypi_e645ebf3-d69d-49c1-9218-f6e601b75540 name
cipher AES-256-CBC
auth SHA256
auth-nocache
verb 3
=============================================
::::    Recursive list of files in       ::::
::: /etc/openvpn/easy-rsa/pki shows below :::
/etc/openvpn/easy-rsa/pki/:
ca.crt
crl.pem
Default.txt
ecparams
extensions.temp
GianniFP.ovpn
index.txt
index.txt.attr
index.txt.attr.old
index.txt.old
issued
openssl-easyrsa.cnf
private
renewed
revoked
safessl-easyrsa.cnf
serial
serial.old
ta.key

/etc/openvpn/easy-rsa/pki/ecparams:
secp521r1.pem

/etc/openvpn/easy-rsa/pki/issued:
GianniFP.crt
raspberrypi_e645ebf3-d69d-49c1-9218-f6e601b75540.crt

/etc/openvpn/easy-rsa/pki/private:
ca.key
GianniFP.key
raspberrypi_e645ebf3-d69d-49c1-9218-f6e601b75540.key

/etc/openvpn/easy-rsa/pki/renewed:
private_by_serial
reqs_by_serial

/etc/openvpn/easy-rsa/pki/renewed/private_by_serial:

/etc/openvpn/easy-rsa/pki/renewed/reqs_by_serial:

/etc/openvpn/easy-rsa/pki/revoked:
private_by_serial
reqs_by_serial

/etc/openvpn/easy-rsa/pki/revoked/private_by_serial:

/etc/openvpn/easy-rsa/pki/revoked/reqs_by_serial:
=============================================
::::            Self check               ::::
:: [OK] IP forwarding is enabled
:: [OK] Iptables MASQUERADE rule set
:: [OK] OpenVPN is running
:: [OK] OpenVPN is enabled (it will automatically start on reboot)
:: [OK] OpenVPN is listening on port 443/udp
=============================================
:::: Having trouble connecting? Take a look at the FAQ:
:::: https://github.com/pivpn/pivpn/wiki/FAQ
=============================================
::::      Snippet of the server log      ::::
Feb 29 19:19:12 raspberrypi ovpn-server[1028]: REDACTED:45144 ++ Certificate has EKU (str) TLS Web Client Authentication, expects TLS Web Client Authentication
Feb 29 19:19:12 raspberrypi ovpn-server[1028]: REDACTED:45144 VERIFY EKU OK
Feb 29 19:19:12 raspberrypi ovpn-server[1028]: REDACTED:45144 VERIFY OK: depth=0, CN=GianniFP
Feb 29 19:19:12 raspberrypi ovpn-server[1028]: REDACTED:45144 peer info: IV_GUI_VER=net.openvpn.connect.ios_3.1.1-2819
Feb 29 19:19:12 raspberrypi ovpn-server[1028]: REDACTED:45144 peer info: IV_VER=3.git::2ae73415
Feb 29 19:19:12 raspberrypi ovpn-server[1028]: REDACTED:45144 peer info: IV_PLAT=ios
Feb 29 19:19:12 raspberrypi ovpn-server[1028]: REDACTED:45144 peer info: IV_NCP=2
Feb 29 19:19:12 raspberrypi ovpn-server[1028]: REDACTED:45144 peer info: IV_TCPNL=1
Feb 29 19:19:12 raspberrypi ovpn-server[1028]: REDACTED:45144 peer info: IV_PROTO=2
Feb 29 19:19:12 raspberrypi ovpn-server[1028]: REDACTED:45144 peer info: IV_AUTO_SESS=1
Feb 29 19:19:12 raspberrypi ovpn-server[1028]: REDACTED:45144 Control Channel: TLSv1.2, cipher TLSv1.2 ECDHE-ECDSA-AES256-GCM-SHA384, 521 bit EC, curve: secp521r1
Feb 29 19:19:12 raspberrypi ovpn-server[1028]: REDACTED:45144 [GianniFP] Peer Connection Initiated with [AF_INET]REDACTED:45144
Feb 29 19:19:12 raspberrypi ovpn-server[1028]: GianniFP/REDACTED:45144 OPTIONS IMPORT: reading client specific options from: /etc/openvpn/ccd/GianniFP
Feb 29 19:19:12 raspberrypi ovpn-server[1028]: GianniFP/REDACTED:45144 MULTI: Learn: 10.8.0.2 -> GianniFP/REDACTED:45144
Feb 29 19:19:12 raspberrypi ovpn-server[1028]: GianniFP/REDACTED:45144 MULTI: primary virtual IP for GianniFP/REDACTED:45144: 10.8.0.2
Feb 29 19:19:12 raspberrypi ovpn-server[1028]: GianniFP/REDACTED:45144 PUSH: Received control message: 'PUSH_REQUEST'
Feb 29 19:19:12 raspberrypi ovpn-server[1028]: GianniFP/REDACTED:45144 SENT CONTROL [GianniFP]: 'PUSH_REPLY,dhcp-option DNS 10.0.0.1,dhcp-option DNS 8.8.8.8,block-outside-dns,redirect-gateway def1,route-gateway 10.8.0.1,topology subnet,ping 15,ping-restart 120,ifconfig 10.8.0.2 255.255.255.0,peer-id 0,cipher AES-256-GCM' (status=1)
Feb 29 19:19:12 raspberrypi ovpn-server[1028]: GianniFP/REDACTED:45144 Data Channel: using negotiated cipher 'AES-256-GCM'
Feb 29 19:19:12 raspberrypi ovpn-server[1028]: GianniFP/REDACTED:45144 Outgoing Data Channel: Cipher 'AES-256-GCM' initialized with 256 bit key
Feb 29 19:19:12 raspberrypi ovpn-server[1028]: GianniFP/REDACTED:45144 Incoming Data Channel: Cipher 'AES-256-GCM' initialized with 256 bit key
=============================================
::::            Debug complete           ::::
:::
::: Debug output completed above.
::: Copy saved to /tmp/debug.txt
:::
```
### Have you taken any steps towards solving your issue?
```
Only the IPTABLES fix. 
```

**Comment by orazioedoardo** [comment]
Your client seem to connect successfully:

```
Feb 29 19:19:12 raspberrypi ovpn-server[1028]: GianniFP/REDACTED:45144 Outgoing Data Channel: Cipher 'AES-256-GCM' initialized with 256 bit key
Feb 29 19:19:12 raspberrypi ovpn-server[1028]: GianniFP/REDACTED:45144 Incoming Data Channel: Cipher 'AES-256-GCM' initialized with 256 bit key
```

However I think you can’t route traffic through it because your LAN range 10.0.11.100/16 overlaps with the VPN range 10.8.0.0/24, I think you have to change either of them, pick one.

**Comment by GianniFP809** [comment]
Thanks for the reply... 
Here are the outputs.

`pi@raspberrypi:~ $ sudo iptables -S
-P INPUT ACCEPT
-P FORWARD ACCEPT
-P OUTPUT ACCEPT
-A FORWARD -d 10.8.0.0/24 -i eth0 -o tun0 -m conntrack --ctstate RELATED,ESTABLISHED -j ACCEPT
-A FORWARD -s 10.8.0.0/24 -i tun0 -o eth0 -j ACCEPT
pi@raspberrypi:~ $ sudo iptables -t nat -S
-P PREROUTING ACCEPT
-P INPUT ACCEPT
-P OUTPUT ACCEPT
-P POSTROUTING ACCEPT
-A POSTROUTING -s 10.8.0.0/24 -o eth0 -j MASQUERADE
-A POSTROUTING -s 10.8.0.0/24 -o eth0 -m comment --comment openvpn-nat-rule -j MASQUERADE
-A POSTROUTING -s 10.8.0.0/24 -o eth0 -j MASQUERADE`

**Comment by orazioedoardo** [comment]
There are some reduntant rules, you only really need this one `-A POSTROUTING -s 10.8.0.0/24 -o eth0 -m comment --comment openvpn-nat-rule -j MASQUERADE`, however this is not a problem. Can you connect and try to browse the internet/local network while you issue a packet capture? It should show the traffic (censor the client IP if you want): https://github.com/pivpn/pivpn/wiki/FAQ#packet-capture

**Comment by GianniFP809** [comment]
It seems there is plenty of traffic. Even when I try to browse a page which never returns anything.... traffic is happening on the PiVPN interface. Even if I browse a local server, it doesn't return anything. 

`15:15:27.964294 IP PublicPhoneIP.15380 > 10.0.11.100.443: UDP, length 1264
15:15:27.974592 IP 10.0.11.100.443 > PublicPhoneIP.15380: UDP, length 76
15:15:27.985209 IP PublicPhoneIP.15380 > 10.0.11.100.443: UDP, length 1264
15:15:27.999836 IP PublicPhoneIP.15380 > 10.0.11.100.443: UDP, length 500
15:15:28.005380 IP PublicPhoneIP.15380 > 10.0.11.100.443: UDP, length 84
15:15:28.005428 IP PublicPhoneIP.15380 > 10.0.11.100.443: UDP, length 95
15:15:28.011174 IP 10.0.11.100.443 > PublicPhoneIP.15380: UDP, length 76
15:15:28.016316 IP 10.0.11.100.443 > PublicPhoneIP.15380: UDP, length 226
15:15:28.016465 IP 10.0.11.100.443 > PublicPhoneIP.15380: UDP, length 116
15:15:28.088171 IP PublicPhoneIP.15380 > 10.0.11.100.443: UDP, length 88
15:15:28.088229 IP PublicPhoneIP.15380 > 10.0.11.100.443: UDP, length 88
15:15:28.101577 IP 10.0.11.100.443 > PublicPhoneIP.15380: UDP, length 84
15:15:28.102737 IP PublicPhoneIP.15380 > 10.0.11.100.443: UDP, length 88
15:15:28.102794 IP PublicPhoneIP.15380 > 10.0.11.100.443: UDP, length 88
15:15:28.102818 IP PublicPhoneIP.15380 > 10.0.11.100.443: UDP, length 88
15:15:28.106671 IP PublicPhoneIP.15380 > 10.0.11.100.443: UDP, length 88
15:15:28.109722 IP 10.0.11.100.443 > PublicPhoneIP.15380: UDP, length 84
15:15:28.112458 IP 10.0.11.100.443 > PublicPhoneIP.15380: UDP, length 84
15:15:28.113709 IP 10.0.11.100.443 > PublicPhoneIP.15380: UDP, length 84
15:15:28.114004 IP 10.0.11.100.443 > PublicPhoneIP.15380: UDP, length 84
15:15:28.114246 IP 10.0.11.100.443 > PublicPhoneIP.15380: UDP, length 84
15:15:28.178588 IP PublicPhoneIP.15380 > 10.0.11.100.443: UDP, length 76
15:15:28.179653 IP PublicPhoneIP.15380 > 10.0.11.100.443: UDP, length 76
15:15:28.179702 IP PublicPhoneIP.15380 > 10.0.11.100.443: UDP, length 76
15:15:28.182044 IP PublicPhoneIP.15380 > 10.0.11.100.443: UDP, length 76
15:15:28.210148 IP PublicPhoneIP.15380 > 10.0.11.100.443: UDP, length 631
15:15:28.219675 IP 10.0.11.100.443 > PublicPhoneIP.15380: UDP, length 76
15:15:28.220082 IP 10.0.11.100.443 > PublicPhoneIP.15380: UDP, length 279
15:15:28.227819 IP PublicPhoneIP.15380 > 10.0.11.100.443: UDP, length 631
15:15:28.227987 IP PublicPhoneIP.15380 > 10.0.11.100.443: UDP, length 593
15:15:28.237583 IP PublicPhoneIP.15380 > 10.0.11.100.443: UDP, length 631
15:15:28.238014 IP 10.0.11.100.443 > PublicPhoneIP.15380: UDP, length 76
15:15:28.238492 IP 10.0.11.100.443 > PublicPhoneIP.15380: UDP, length 279
15:15:28.241173 IP PublicPhoneIP.15380 > 10.0.11.100.443: UDP, length 76
15:15:28.243616 IP PublicPhoneIP.15380 > 10.0.11.100.443: UDP, length 76
15:15:28.247708 IP 10.0.11.100.443 > PublicPhoneIP.15380: UDP, length 76
15:15:28.248240 IP 10.0.11.100.443 > PublicPhoneIP.15380: UDP, length 279
15:15:28.250060 IP PublicPhoneIP.15380 > 10.0.11.100.443: UDP, length 631
15:15:28.256499 IP 10.0.11.100.443 > PublicPhoneIP.15380: UDP, length 76
15:15:28.260051 IP 10.0.11.100.443 > PublicPhoneIP.15380: UDP, length 76
15:15:28.261089 IP 10.0.11.100.443 > PublicPhoneIP.15380: UDP, length 1425
15:15:28.261289 IP 10.0.11.100.443 > PublicPhoneIP.15380: UDP, length 1425
15:15:28.261444 IP 10.0.11.100.443 > PublicPhoneIP.15380: UDP, length 848
15:15:28.261559 IP 10.0.11.100.443 > PublicPhoneIP.15380: UDP, length 279
15:15:28.266943 IP PublicPhoneIP.15380 > 10.0.11.100.443: UDP, length 593
15:15:28.278437 IP 10.0.11.100.443 > PublicPhoneIP.15380: UDP, length 76
15:15:28.280223 IP 10.0.11.100.443 > PublicPhoneIP.15380: UDP, length 1425
15:15:28.280423 IP 10.0.11.100.443 > PublicPhoneIP.15380: UDP, length 1425
15:15:28.280547 IP 10.0.11.100.443 > PublicPhoneIP.15380: UDP, length 380
15:15:28.300965 IP PublicPhoneIP.15380 > 10.0.11.100.443: UDP, length 76
15:15:28.318438 IP PublicPhoneIP.15380 > 10.0.11.100.443: UDP, length 140
15:15:28.332128 IP 10.0.11.100.443 > PublicPhoneIP.15380: UDP, length 76
15:15:28.336046 IP 10.0.11.100.443 > PublicPhoneIP.15380: UDP, length 672
15:15:28.338749 IP PublicPhoneIP.15380 > 10.0.11.100.443: UDP, length 76
15:15:28.340557 IP PublicPhoneIP.15380 > 10.0.11.100.443: UDP, length 140
15:15:28.341799 IP PublicPhoneIP.15380 > 10.0.11.100.443: UDP, length 76
15:15:28.341833 IP PublicPhoneIP.15380 > 10.0.11.100.443: UDP, length 140
15:15:28.341859 IP PublicPhoneIP.15380 > 10.0.11.100.443: UDP, length 88
15:15:28.341880 IP PublicPhoneIP.15380 > 10.0.11.100.443: UDP, length 76
15:15:28.342909 IP PublicPhoneIP.15380 > 10.0.11.100.443: UDP, length 140
15:15:28.344418 IP PublicPhoneIP.15380 > 10.0.11.100.443: UDP, length 88
15:15:28.358933 IP 10.0.11.100.443 > PublicPhoneIP.15380: UDP, length 76
15:15:28.359051 IP 10.0.11.100.443 > PublicPhoneIP.15380: UDP, length 76
15:15:28.359672 IP 10.0.11.100.443 > PublicPhoneIP.15380: UDP, length 76
15:15:28.362985 IP 10.0.11.100.443 > PublicPhoneIP.15380: UDP, length 674
15:15:28.363137 IP 10.0.11.100.443 > PublicPhoneIP.15380: UDP, length 671
15:15:28.363284 IP 10.0.11.100.443 > PublicPhoneIP.15380: UDP, length 673
15:15:28.376770 IP 10.0.11.100.443 > PublicPhoneIP.15380: UDP, length 1425
15:15:28.376974 IP 10.0.11.100.443 > PublicPhoneIP.15380: UDP, length 1425
15:15:28.383557 IP PublicPhoneIP.15380 > 10.0.11.100.443: UDP, length 76
15:15:28.387434 IP PublicPhoneIP.15380 > 10.0.11.100.443: UDP, length 112
15:15:28.392518 IP 10.0.11.100.443 > PublicPhoneIP.15380: UDP, length 1425
15:15:28.392725 IP 10.0.11.100.443 > PublicPhoneIP.15380: UDP, length 1425
15:15:28.403145 IP 10.0.11.100.443 > PublicPhoneIP.15380: UDP, length 76
15:15:28.405444 IP 10.0.11.100.443 > PublicPhoneIP.15380: UDP, length 315
15:15:28.415642 IP PublicPhoneIP.15380 > 10.0.11.100.443: UDP, length 76
15:15:28.423741 IP PublicPhoneIP.15380 > 10.0.11.100.443: UDP, length 76
15:15:28.434823 IP PublicPhoneIP.15380 > 10.0.11.100.443: UDP, length 76
15:15:28.434860 IP PublicPhoneIP.15380 > 10.0.11.100.443: UDP, length 112
15:15:28.443636 IP PublicPhoneIP.15380 > 10.0.11.100.443: UDP, length 112
15:15:28.443672 IP PublicPhoneIP.15380 > 10.0.11.100.443: UDP, length 112
15:15:28.453022 IP 10.0.11.100.443 > PublicPhoneIP.15380: UDP, length 76
15:15:28.454540 IP PublicPhoneIP.15380 > 10.0.11.100.443: UDP, length 76
15:15:28.455997 IP 10.0.11.100.443 > PublicPhoneIP.15380: UDP, length 317
15:15:28.458855 IP 10.0.11.100.443 > PublicPhoneIP.15380: UDP, length 76
15:15:28.462135 IP 10.0.11.100.443 > PublicPhoneIP.15380: UDP, length 314
15:15:28.463606 IP 10.0.11.100.443 > PublicPhoneIP.15380: UDP, length 76
15:15:28.467055 IP 10.0.11.100.443 > PublicPhoneIP.15380: UDP, length 316
15:15:28.472285 IP PublicPhoneIP.15380 > 10.0.11.100.443: UDP, length 375
15:15:28.479026 IP 10.0.11.100.443 > PublicPhoneIP.15380: UDP, length 1100
15:15:28.479211 IP 10.0.11.100.443 > PublicPhoneIP.15380: UDP, length 457
15:15:28.489179 IP 10.0.11.100.443 > PublicPhoneIP.15380: UDP, length 76
15:15:28.513328 IP PublicPhoneIP.15380 > 10.0.11.100.443: UDP, length 76
15:15:28.529762 IP PublicPhoneIP.15380 > 10.0.11.100.443: UDP, length 423
15:15:28.529799 IP PublicPhoneIP.15380 > 10.0.11.100.443: UDP, length 76
15:15:28.538402 IP PublicPhoneIP.15380 > 10.0.11.100.443: UDP, length 363
15:15:28.540570 IP PublicPhoneIP.15380 > 10.0.11.100.443: UDP, length 76
15:15:28.545060 IP 10.0.11.100.443 > PublicPhoneIP.15380: UDP, length 76
15:15:28.549520 IP PublicPhoneIP.15380 > 10.0.11.100.443: UDP, length 367
15:15:28.557871 IP 10.0.11.100.443 > PublicPhoneIP.15380: UDP, length 76
15:15:28.559363 IP PublicPhoneIP.15380 > 10.0.11.100.443: UDP, length 76
15:15:28.565667 IP 10.0.11.100.443 > PublicPhoneIP.15380: UDP, length 76
15:15:28.576182 IP PublicPhoneIP.15380 > 10.0.11.100.443: UDP, length 1186
15:15:28.585124 IP 10.0.11.100.443 > PublicPhoneIP.15380: UDP, length 76
15:15:28.594862 IP PublicPhoneIP.15380 > 10.0.11.100.443: UDP, length 489
15:15:28.602673 IP 10.0.11.100.443 > PublicPhoneIP.15380: UDP, length 76
15:15:28.618984 IP 10.0.11.100.443 > PublicPhoneIP.15380: UDP, length 372
15:15:28.664001 IP PublicPhoneIP.15380 > 10.0.11.100.443: UDP, length 76
15:15:28.669363 IP PublicPhoneIP.15380 > 10.0.11.100.443: UDP, length 112
15:15:28.672162 IP 10.0.11.100.443 > PublicPhoneIP.15380: UDP, length 1100
15:15:28.672323 IP 10.0.11.100.443 > PublicPhoneIP.15380: UDP, length 161
15:15:28.674029 IP 10.0.11.100.443 > PublicPhoneIP.15380: UDP, length 365
15:15:28.677604 IP 10.0.11.100.443 > PublicPhoneIP.15380: UDP, length 76
15:15:28.689521 IP 10.0.11.100.443 > PublicPhoneIP.15380: UDP, length 1425
15:15:28.711309 IP 10.0.11.100.443 > PublicPhoneIP.15380: UDP, length 330
15:15:28.744416 IP PublicPhoneIP.15380 > 10.0.11.100.443: UDP, length 76
15:15:28.755883 IP PublicPhoneIP.15380 > 10.0.11.100.443: UDP, length 76
15:15:28.762519 IP PublicPhoneIP.15380 > 10.0.11.100.443: UDP, length 112
15:15:28.764258 IP 10.0.11.100.443 > PublicPhoneIP.15380: UDP, length 371
15:15:28.765567 IP PublicPhoneIP.15380 > 10.0.11.100.443: UDP, length 76
15:15:28.777398 IP 10.0.11.100.443 > PublicPhoneIP.15380: UDP, length 76
15:15:28.779398 IP PublicPhoneIP.15380 > 10.0.11.100.443: UDP, length 186
15:15:28.786793 IP 10.0.11.100.443 > PublicPhoneIP.15380: UDP, length 1425
15:15:28.794979 IP 10.0.11.100.443 > PublicPhoneIP.15380: UDP, length 76
15:15:28.810947 IP 10.0.11.100.443 > PublicPhoneIP.15380: UDP, length 330
15:15:28.819428 IP PublicPhoneIP.15380 > 10.0.11.100.443: UDP, length 76
15:15:28.820412 IP PublicPhoneIP.15380 > 10.0.11.100.443: UDP, length 112
15:15:28.823226 IP 10.0.11.100.443 > PublicPhoneIP.15380: UDP, length 274
15:15:28.829506 IP 10.0.11.100.443 > PublicPhoneIP.15380: UDP, length 76
15:15:28.867679 IP PublicPhoneIP.15380 > 10.0.11.100.443: UDP, length 76
15:15:28.868388 IP 10.0.11.100.443 > PublicPhoneIP.15380: UDP, length 330
15:15:28.868415 IP PublicPhoneIP.15380 > 10.0.11.100.443: UDP, length 186
15:15:28.879628 IP PublicPhoneIP.15380 > 10.0.11.100.443: UDP, length 76
15:15:28.879660 IP PublicPhoneIP.15380 > 10.0.11.100.443: UDP, length 118
15:15:28.887631 IP 10.0.11.100.443 > PublicPhoneIP.15380: UDP, length 76
15:15:28.894999 IP 10.0.11.100.443 > PublicPhoneIP.15380: UDP, length 76
15:15:28.917322 IP 10.0.11.100.443 > PublicPhoneIP.15380: UDP, length 274
15:15:28.923064 IP 10.0.11.100.443 > PublicPhoneIP.15380: UDP, length 112
15:15:28.951388 IP PublicPhoneIP.15380 > 10.0.11.100.443: UDP, length 76
15:15:28.963477 IP PublicPhoneIP.15380 > 10.0.11.100.443: UDP, length 186
15:15:28.973708 IP PublicPhoneIP.15380 > 10.0.11.100.443: UDP, length 76
15:15:28.973742 IP PublicPhoneIP.15380 > 10.0.11.100.443: UDP, length 118
15:15:28.977135 IP 10.0.11.100.443 > PublicPhoneIP.15380: UDP, length 76
15:15:28.980796 IP PublicPhoneIP.15380 > 10.0.11.100.443: UDP, length 76
15:15:28.983479 IP PublicPhoneIP.15380 > 10.0.11.100.443: UDP, length 112
15:15:28.992636 IP 10.0.11.100.443 > PublicPhoneIP.15380: UDP, length 76
15:15:29.000985 IP 10.0.11.100.443 > PublicPhoneIP.15380: UDP, length 76
15:15:29.009097 IP 10.0.11.100.443 > PublicPhoneIP.15380: UDP, length 274
15:15:29.021231 IP 10.0.11.100.443 > PublicPhoneIP.15380: UDP, length 112
15:15:29.029984 IP 10.0.11.100.443 > PublicPhoneIP.15380: UDP, length 118
15:15:29.054616 IP PublicPhoneIP.15380 > 10.0.11.100.443: UDP, length 76
15:15:29.060793 IP PublicPhoneIP.15380 > 10.0.11.100.443: UDP, length 118
15:15:29.063450 IP PublicPhoneIP.15380 > 10.0.11.100.443: UDP, length 76
15:15:29.073660 IP PublicPhoneIP.15380 > 10.0.11.100.443: UDP, length 112
15:15:29.078126 IP 10.0.11.100.443 > PublicPhoneIP.15380: UDP, length 76
15:15:29.081876 IP PublicPhoneIP.15380 > 10.0.11.100.443: UDP, length 76
15:15:29.085290 IP PublicPhoneIP.15380 > 10.0.11.100.443: UDP, length 133
15:15:29.088622 IP 10.0.11.100.443 > PublicPhoneIP.15380: UDP, length 76
15:15:29.101005 IP 10.0.11.100.443 > PublicPhoneIP.15380: UDP, length 76
15:15:29.112488 IP 10.0.11.100.443 > PublicPhoneIP.15380: UDP, length 112
15:15:29.117174 IP 10.0.11.100.443 > PublicPhoneIP.15380: UDP, length 118
15:15:29.134966 IP 10.0.11.100.443 > PublicPhoneIP.15380: UDP, length 164
`
I did try and connect using the WiFi. It should not work, right?, but it worked, I manage to browse internet and local network. I though maybe is the client routing the traffic outside, but the capture showed the same traffic from the router this time instead from the phone external IP. Maybe AT&T is blocking the traffic which is hard to believe. I was able to use a commercial VPN service like NordVPN on the same phone and same wireless network. Maybe is a port issue? I'm using 443 as is less filtered by firewalls.

**Comment by orazioedoardo** [comment]
It seems there is plenty of traffic.

> This traffic to port 443/UDP is the client trying to authenticate with the PiVPN.

Even if I browse a local server, it doesn't return anything.

> Try to tap into the virtual interface now, what you get? You won't see the authentication but you should be able to see what the client is up to: `tcpdump -n -i tun0`.

**Comment by orazioedoardo** [comment]
No answer in a while, closing...
