### DISCUSSION TITLE
Installation config not show IPv4addr or IPv4gw

### DISCUSSION THREAD

**Discussion by namcusamlc** [pivpn/pivpn#1627] [Support]
## In raising this issue, I confirm the following:

`{please fill the checkboxes, e.g: [X]}`

- [x] I have read the [documentation](https://docs.pivpn.io)
- [] Is it a feature request? please consider opening a [Discussion] (https://github.com/pivpn/pivpn/discussions/new?category=feature-requests)
- [ ] Is this a support request? please consider copying the content of this document and using it to open a [Discussion](https://github.com/pivpn/pivpn/discussions/new?category=support)
- [x] I have read and understood the [PiVPN General Guidelines](https://github.com/pivpn/pivpn/#general-guidelines)
- [x] The issue I am reporting can be *replicated*.  
- [ ] The issue I am reporting *is* directly related to the pivpn installer script.
- [x] The issue I am reporting isn't a duplicate (see [FAQs](https://github.com/pivpn/pivpn/wiki/FAQ), [closed issues](https://github.com/pivpn/pivpn/issues?q=is%3Aissue+sort%3Aupdated-desc+is%3Aclosed), and [open issues](https://github.com/pivpn/pivpn/issues?q=is%3Aissue+sort%3Aupdated-desc+is%3Aopen)).

### Has your install failed? 
```
no
```

### Describe the issue
After installing PiVPN (openvpn) successfully, I issued an OpenVPN profile. I used the profile on a different machine with a different network to connect (on OpenVPN Client). The OpenVPN client throwed Time Out error

**Expected behavior**
The OpenVPN will show connection successfully.

**Screenshots**
![image](https://user-images.githubusercontent.com/25699657/189272115-67ae4286-1134-4675-86cc-8cb93d6068d1.png)

### Can you replicate the issue? Describe the steps below

1. Install PiVPN (OPEN VPN) with default config using command `curl -L https://install.pivpn.io | bash`
2. Issue new profile using command `pivpn add`
3. Copy the profile to my mobile/test machine
4. Use the profile to connect on OpenVPN Client

### Have you searched for similar issues and solutions?
    (yes/no / which issues?)

**Additional context**

### Have you taken any steps towards solving your issue?
```
  - I removed the old installation, restart machine
  - I tried to set my machine internal network ip to static
  - I install PiVPN again, restart machine
  - Try to do steps again
```

#### What type of hardware are you running PiVPN at?

```
20.04.4 LTS (Focal Fossa)
```
#### Output of `uname -a`
```
  Linux elife-server 5.15.0-46-generic #49~20.04.1-Ubuntu SMP Thu Aug 4 19:15:44 UTC 2022 x86_64 x86_64 x86_64 GNU/Linux
```

#### Output of `cat /etc/os-release`
```
  NAME="Ubuntu"
VERSION="20.04.4 LTS (Focal Fossa)"
ID=ubuntu
ID_LIKE=debian
PRETTY_NAME="Ubuntu 20.04.4 LTS"
VERSION_ID="20.04"
HOME_URL="https://www.ubuntu.com/"
SUPPORT_URL="https://help.ubuntu.com/"
BUG_REPORT_URL="https://bugs.launchpad.net/ubuntu/"
PRIVACY_POLICY_URL="https://www.ubuntu.com/legal/terms-and-policies/privacy-policy"
VERSION_CODENAME=focal
UBUNTU_CODENAME=focal
```

### If install failed Please provide the console output of  `curl -L https://install.pivpn.io | bash`
```
The installation successfully
```

### Console output of      `curl -L install.pivpn.io | bash`
```
  OUTPUT HERE
  DO NOT DELETE THE BACK-TICKS 
  PASTE THE OUTPUT INSIDE THE BACK-TICKS
```

### Console output of      `pivpn add` or `pivpn add nopass`
```
Enter a Name for the Client:  NamNV
How many days should the certificate last?  1080
Enter the password for the client:
Enter the password again to verify:
* Notice:
Using Easy-RSA configuration from: /etc/openvpn/easy-rsa/pki/vars

* Notice:
Using SSL: openssl OpenSSL 1.1.1f  31 Mar 2020

Generating an EC private key
writing new private key to '/etc/openvpn/easy-rsa/pki/f26ed7da/temp.fbcabbb3'
-----
* Notice:

Keypair and certificate request completed. Your files are:
req: /etc/openvpn/easy-rsa/pki/reqs/NamNV.req
key: /etc/openvpn/easy-rsa/pki/private/NamNV.key

Using configuration from /etc/openvpn/easy-rsa/pki/f26ed7da/temp.c8ce68d7
Check that the request matches the signature
Signature ok
The Subject's Distinguished Name is as follows
commonName            :ASN.1 12:'NamNV'
Certificate is to be certified until Aug 24 04:46:11 2025 GMT (1080 days)

Write out database with 1 new entries
Data Base Updated

* Notice:
Certificate created at: /etc/openvpn/easy-rsa/pki/issued/NamNV.crt

Client's cert found: NamNV.crt
Client's Private Key found: NamNV.key
CA public Key found: ca.crt
tls Private Key found: ta.key


========================================================
Done! NamNV.ovpn successfully created!
NamNV.ovpn was copied to:
  /home/vpn/ovpns
for easy transfer. Please use this profile only on one
device and create additional profiles for other devices.
========================================================

```

### Console output of      `pivpn debug`

```
::::            PiVPN debug              ::::
=============================================
::::            Latest commit            ::::
Branch: master
Commit: 202c173dd783036a09fa6de6e3a2409d4ea565d9
Author: 4s3ti
Date: Sun Sep 4 16:41:57 2022 +0200
Summary: fix(openvpn): makeOVPN Missing space
=============================================
::::        Installation settings        ::::
PLAT=Ubuntu
OSCN=focal
USING_UFW=0
pivpnforceipv6route=1
IPv4dev=eno1
install_user=vpn
install_home=/home/vpn
VPN=openvpn
pivpnPROTO=udp
pivpnPORT=1194
pivpnDNS1=8.8.8.8
pivpnDNS2=8.8.4.4
pivpnSEARCHDOMAIN=
pivpnHOST=REDACTED
TWO_POINT_FOUR=1
pivpnENCRYPT=256
USE_PREDEFINED_DH_PARAM=
INPUT_CHAIN_EDITED=1
FORWARD_CHAIN_EDITED=1
INPUT_CHAIN_EDITEDv6=
FORWARD_CHAIN_EDITEDv6=
pivpnDEV=tun0
pivpnNET=10.140.200.0
subnetClass=24
pivpnenableipv6=0
ALLOWED_IPS=""
UNATTUPG=1
INSTALLED_PACKAGES=(openvpn)
HELP_SHOWN=1
=============================================
::::  Server configuration shown below   ::::
dev tun
proto udp
port 1194
ca /etc/openvpn/easy-rsa/pki/ca.crt
cert /etc/openvpn/easy-rsa/pki/issued/elife-server_1c4924c2-b06e-454e-899e-53352038f7bf.crt
key /etc/openvpn/easy-rsa/pki/private/elife-server_1c4924c2-b06e-454e-899e-53352038f7bf.key
dh none
ecdh-curve prime256v1
topology subnet
server 10.140.200.0 255.255.255.0
# Set your primary domain name server address for clients
push "dhcp-option DNS 8.8.8.8"
push "dhcp-option DNS 8.8.4.4"
# Prevent DNS leaks on Windows
push "block-outside-dns"
# Override the Client default gateway by using 0.0.0.0/1 and
# 128.0.0.0/1 rather than 0.0.0.0/0. This has the benefit of
# overriding but not wiping out the original default gateway.
push "redirect-gateway def1"
client-to-client
client-config-dir /etc/openvpn/ccd
keepalive 15 120
remote-cert-tls client
tls-version-min 1.2
 tls-crypt /etc/openvpn/easy-rsa/pki/ta.key
cipher AES-256-CBC
auth SHA256
user openvpn
group openvpn
persist-key
persist-tun
crl-verify /etc/openvpn/crl.pem
status /var/log/openvpn-status.log 20
status-version 3
syslog
verb 3
#DuplicateCNs allow access control on a less-granular, per user basis.
#Remove # if you will manage access by user instead of device.
#duplicate-cn
# Generated for use by PiVPN.io
=============================================
::::  Client template file shown below   ::::
client
dev tun
proto udp
remote REDACTED 1194
resolv-retry infinite
nobind
remote-cert-tls server
tls-version-min 1.2
verify-x509-name elife-server_1c4924c2-b06e-454e-899e-53352038f7bf name
cipher AES-256-CBC
auth SHA256
auth-nocache
verb 3
=============================================
::::    Recursive list of files in       ::::

::: /etc/openvpn/easy-rsa/pki shows below :::
/etc/openvpn/easy-rsa/pki/:
ca.crt
crl.pem
Default.txt
index.txt
index.txt.attr
index.txt.attr.old
index.txt.old
issued
NamNV0909.ovpn
openssl-easyrsa.cnf
private
revoked
safessl-easyrsa.cnf
serial
serial.old
ta.key
vars
vars.example

/etc/openvpn/easy-rsa/pki/issued:
elife-server_1c4924c2-b06e-454e-899e-53352038f7bf.crt
NamNV0909.crt

/etc/openvpn/easy-rsa/pki/private:
ca.key
elife-server_1c4924c2-b06e-454e-899e-53352038f7bf.key
NamNV0909.key

/etc/openvpn/easy-rsa/pki/revoked:
private_by_serial
reqs_by_serial

/etc/openvpn/easy-rsa/pki/revoked/private_by_serial:

/etc/openvpn/easy-rsa/pki/revoked/reqs_by_serial:
=============================================
::::            Self check               ::::
:: [OK] IP forwarding is enabled
:: [OK] Iptables MASQUERADE rule set
:: [OK] Iptables INPUT rule set
:: [OK] Iptables FORWARD rule set
:: [OK] OpenVPN is running
:: [OK] OpenVPN is enabled
(it will automatically start on reboot)
:: [OK] OpenVPN is listening on port 1194/udp
=============================================
:::: Having trouble connecting? Take a look at the FAQ:
:::: https://docs.pivpn.io/faq
=============================================
::::      Snippet of the server log      ::::
Sep  9 11:11:36 elife-server ovpn-server[987]: OpenVPN 2.4.7 x86_64-pc-linux-gnu [SSL (OpenSSL)] [LZO] [LZ4] [EPOLL] [PKCS11] [MH/PKTINFO] [AEAD] built on Mar 22 2022
Sep  9 11:11:36 elife-server ovpn-server[987]: library versions: OpenSSL 1.1.1f  31 Mar 2020, LZO 2.10
Sep  9 11:11:36 elife-server ovpn-server[987]: ECDH curve prime256v1 added
Sep  9 11:11:36 elife-server ovpn-server[987]: Outgoing Control Channel Encryption: Cipher 'AES-256-CTR' initialized with 256 bit key
Sep  9 11:11:36 elife-server ovpn-server[987]: Outgoing Control Channel Encryption: Using 256 bit message hash 'SHA256' for HMAC authentication
Sep  9 11:11:36 elife-server ovpn-server[987]: Incoming Control Channel Encryption: Cipher 'AES-256-CTR' initialized with 256 bit key
Sep  9 11:11:36 elife-server ovpn-server[987]: Incoming Control Channel Encryption: Using 256 bit message hash 'SHA256' for HMAC authentication
Sep  9 11:11:36 elife-server ovpn-server[987]: TUN/TAP device tun0 opened
Sep  9 11:11:36 elife-server ovpn-server[987]: TUN/TAP TX queue length set to 100
Sep  9 11:11:36 elife-server ovpn-server[987]: /sbin/ip link set dev tun0 up mtu 1500
Sep  9 11:11:36 elife-server ovpn-server[987]: /sbin/ip addr add dev tun0 10.140.200.1/24 broadcast 10.140.200.255
Sep  9 11:11:36 elife-server ovpn-server[987]: Could not determine IPv4/IPv6 protocol. Using AF_INET
Sep  9 11:11:36 elife-server ovpn-server[987]: Socket Buffers: R=[212992->212992] S=[212992->212992]
Sep  9 11:11:36 elife-server ovpn-server[987]: UDPv4 link local (bound): [AF_INET][undef]:1194
Sep  9 11:11:36 elife-server ovpn-server[987]: UDPv4 link remote: [AF_UNSPEC]
Sep  9 11:11:36 elife-server ovpn-server[987]: GID set to openvpn
Sep  9 11:11:36 elife-server ovpn-server[987]: UID set to openvpn
Sep  9 11:11:36 elife-server ovpn-server[987]: MULTI: multi_init called, r=256 v=256
Sep  9 11:11:36 elife-server ovpn-server[987]: IFCONFIG POOL: base=10.140.200.2 size=252, ipv6=0
Sep  9 11:11:36 elife-server ovpn-server[987]: Initialization Sequence Completed
=============================================
::::            Debug complete           ::::
:::
::: Debug output completed above.
::: Copy saved to /tmp/debug.log
:::
```

### Console output of      `cat /etc/pivpn/openvpn/setupVars.conf`

```
PLAT=Ubuntu
OSCN=focal
USING_UFW=0
pivpnforceipv6route=1
IPv4dev=eno1
install_user=vpn
install_home=/home/vpn
VPN=openvpn
pivpnPROTO=udp
pivpnPORT=1194
pivpnDNS1=8.8.8.8
pivpnDNS2=8.8.4.4
pivpnSEARCHDOMAIN=
pivpnHOST=MY_CORRECT_IP_HERE
TWO_POINT_FOUR=1
pivpnENCRYPT=256
USE_PREDEFINED_DH_PARAM=
INPUT_CHAIN_EDITED=1
FORWARD_CHAIN_EDITED=1
INPUT_CHAIN_EDITEDv6=
FORWARD_CHAIN_EDITEDv6=
pivpnDEV=tun0
pivpnNET=10.140.200.0
subnetClass=24
pivpnenableipv6=0
ALLOWED_IPS=""
UNATTUPG=1
INSTALLED_PACKAGES=(openvpn)
HELP_SHOWN=1
```

### Console output of      `tcpdump -n -i IPv4dev pivpnPROTO port pivpnPORT`

```
tcpdump: verbose output suppressed, use -v or -vv for full protocol decode
listening on eno1, link-type EN10MB (Ethernet), capture size 262144 bytes
11:42:29.892345 IP 27.67.142.114.40042 > 172.16.9.120.1194: UDP, length 54
11:42:30.874847 IP 27.67.142.114.40042 > 172.16.9.120.1194: UDP, length 54
11:42:31.892061 IP 27.67.142.114.40042 > 172.16.9.120.1194: UDP, length 54
11:42:32.915881 IP 27.67.142.114.40042 > 172.16.9.120.1194: UDP, length 54
11:42:33.891852 IP 27.67.142.114.40042 > 172.16.9.120.1194: UDP, length 54
11:42:34.891799 IP 27.67.142.114.40042 > 172.16.9.120.1194: UDP, length 54
11:42:35.891745 IP 27.67.142.114.40042 > 172.16.9.120.1194: UDP, length 54
11:42:36.891678 IP 27.67.142.114.40042 > 172.16.9.120.1194: UDP, length 54
11:42:37.901732 IP 27.67.142.114.40042 > 172.16.9.120.1194: UDP, length 54
11:42:38.891619 IP 27.67.142.114.40042 > 172.16.9.120.1194: UDP, length 54
11:42:39.901895 IP 27.67.142.114.5483 > 172.16.9.120.1194: UDP, length 54
11:42:40.901570 IP 27.67.142.114.5483 > 172.16.9.120.1194: UDP, length 54
11:42:41.917476 IP 27.67.142.114.5483 > 172.16.9.120.1194: UDP, length 54
11:42:42.901529 IP 27.67.142.114.5483 > 172.16.9.120.1194: UDP, length 54
11:42:43.901417 IP 27.67.142.114.5483 > 172.16.9.120.1194: UDP, length 54
11:42:44.901350 IP 27.67.142.114.5483 > 172.16.9.120.1194: UDP, length 54
11:42:45.901581 IP 27.67.142.114.5483 > 172.16.9.120.1194: UDP, length 54
11:42:46.901317 IP 27.67.142.114.5483 > 172.16.9.120.1194: UDP, length 54
11:42:47.901315 IP 27.67.142.114.5483 > 172.16.9.120.1194: UDP, length 54
11:42:48.901204 IP 27.67.142.114.5483 > 172.16.9.120.1194: UDP, length 54
11:42:49.911590 IP 27.67.142.114.10457 > 172.16.9.120.1194: UDP, length 54
11:42:50.901267 IP 27.67.142.114.10457 > 172.16.9.120.1194: UDP, length 54
11:42:51.901229 IP 27.67.142.114.10457 > 172.16.9.120.1194: UDP, length 54
11:42:52.901201 IP 27.67.142.114.10457 > 172.16.9.120.1194: UDP, length 54
11:42:53.919156 IP 27.67.142.114.10457 > 172.16.9.120.1194: UDP, length 54
11:42:54.919556 IP 27.67.142.114.10457 > 172.16.9.120.1194: UDP, length 54
11:42:55.911102 IP 27.67.142.114.10457 > 172.16.9.120.1194: UDP, length 54
11:42:56.911055 IP 27.67.142.114.10457 > 172.16.9.120.1194: UDP, length 54
11:42:57.911389 IP 27.67.142.114.10457 > 172.16.9.120.1194: UDP, length 54
11:42:58.910954 IP 27.67.142.114.10457 > 172.16.9.120.1194: UDP, length 54
11:42:59.921280 IP 27.67.142.114.35961 > 172.16.9.120.1194: UDP, length 54
11:43:00.918974 IP 27.67.142.114.35961 > 172.16.9.120.1194: UDP, length 54
11:43:01.910901 IP 27.67.142.114.35961 > 172.16.9.120.1194: UDP, length 54
11:43:02.910836 IP 27.67.142.114.35961 > 172.16.9.120.1194: UDP, length 54
11:43:03.920867 IP 27.67.142.114.35961 > 172.16.9.120.1194: UDP, length 54
11:43:04.910732 IP 27.67.142.114.35961 > 172.16.9.120.1194: UDP, length 54
11:43:05.921231 IP 27.67.142.114.35961 > 172.16.9.120.1194: UDP, length 54
11:43:06.921178 IP 27.67.142.114.35961 > 172.16.9.120.1194: UDP, length 54
11:43:07.920606 IP 27.67.142.114.35961 > 172.16.9.120.1194: UDP, length 54
11:43:08.918639 IP 27.67.142.114.35961 > 172.16.9.120.1194: UDP, length 54
11:43:09.920837 IP 27.67.142.114.38028 > 172.16.9.120.1194: UDP, length 54
11:43:10.920486 IP 27.67.142.114.38028 > 172.16.9.120.1194: UDP, length 54
11:43:11.920618 IP 27.67.142.114.38028 > 172.16.9.120.1194: UDP, length 54
11:43:12.921052 IP 27.67.142.114.38028 > 172.16.9.120.1194: UDP, length 54
11:43:13.920395 IP 27.67.142.114.38028 > 172.16.9.120.1194: UDP, length 54
11:43:14.928437 IP 27.67.142.114.38028 > 172.16.9.120.1194: UDP, length 54
11:43:15.920325 IP 27.67.142.114.38028 > 172.16.9.120.1194: UDP, length 54
11:43:16.920302 IP 27.67.142.114.38028 > 172.16.9.120.1194: UDP, length 54
11:43:17.920264 IP 27.67.142.114.38028 > 172.16.9.120.1194: UDP, length 54
11:43:18.938247 IP 27.67.142.114.38028 > 172.16.9.120.1194: UDP, length 54
11:43:19.930388 IP 27.67.142.114.15093 > 172.16.9.120.1194: UDP, length 54
11:43:20.937024 IP 27.67.142.114.15093 > 172.16.9.120.1194: UDP, length 54
11:43:21.937914 IP 27.67.142.114.15093 > 172.16.9.120.1194: UDP, length 54
11:43:22.929967 IP 27.67.142.114.15093 > 172.16.9.120.1194: UDP, length 54
11:43:23.938080 IP 27.67.142.114.15093 > 172.16.9.120.1194: UDP, length 54
11:43:24.937882 IP 27.67.142.114.15093 > 172.16.9.120.1194: UDP, length 54
11:43:25.929813 IP 27.67.142.114.15093 > 172.16.9.120.1194: UDP, length 54
11:43:26.937697 IP 27.67.142.114.15093 > 172.16.9.120.1194: UDP, length 54
11:43:27.929727 IP 27.67.142.114.15093 > 172.16.9.120.1194: UDP, length 54
11:43:28.929665 IP 27.67.142.114.15093 > 172.16.9.120.1194: UDP, length 54
```

Seem like my server has received the Open connection request but it does not send any response back to client.
